Municipality,Sector,Outage Reported,Estimated Time of Restoration,Estimated Customers Impacted,Category,Current Status
SAN JUAN,"ARE. AREA RECREATIVA HATO REY CENTRAL, BDA. BITUMUL, BDA. ISRAEL, BDA. LAS MONJAS, COM. GASOLINERA GULF, COM. NATIONAL LUMBER AND HARDWARE, COND. URBANA ELDERLY 1, COND. VENUS TOWER, COND. VILLAS DEL PARAISO, EDIF. 221 PLAZA BUILDINGS, EDIF. MCS PLAZA, ED",May 11 03:45',May 11 17:00',<500,Unplanned,"LUMA has successfully completed repairs and restored power to the area. If you have any questions, please contact us at 1-844-888-5862 (LUMA). "
,CAYEY - CIDRA,May 11 12:30',May 11 19:00',<500,Unplanned,Our local power restoration team is being dispatched to the area as soon as possible. 
, AGUAS BUENAS GIS - SABANA LLANA TC ,May 11 12:28',May 11 19:00',<500,Unplanned,Our power restoration team is onsite conducting critical repairs to restore power the area as quickly and safely as possible. 
SAN JUAN,"PARC. CARRAIZO, SECT. CAMINO EL MUDO, SECT. CAMINO LOS CALOCA, SECT. LOS AYALAS, URB. EL VIGIA, URB. REPARTO VILLA OLGA, SECT. EL MUDO, SECT. LOS POMALES, URB. COLINAS DE FAIR VIEW",May 11 09:49',May 11 17:00',<500,Scheduled Maintenance,Our power restoration team is onsite conducting critical repairs to restore power the area as quickly and safely as possible. 
,MAYAGUEZ-MORA-CAMBALACHE ,May 07 21:36',June 03 18:00',<500,Unknown,Our power restoration team is onsite conducting critical repairs to restore power the area as quickly and safely as possible.