Municipality,Sector,Outage Reported,Estimated Time of Restoration,Estimated Customers Impacted,Category,Current Status
,,,,,,
VEGA ALTA,"COMU. LOS PUERTOS, EDU. ESCUELA ELEMENTAL ECOLOGICA, PARC. EL COTTO, SECT. COTTO MARTELL, SECT. LA ALDEA, SECT. LA POZA, SECT. LA PRA, SECT. MAYSONET 1, SECT. MAYSONET 2, URB. PAISAJES DE DORADO, CEM. MAUSOLEO MUNICIPAL DE VEGA ALTA, COMU. MONTE REY, COND",September 28 09:09',September 28 17:00',501-1000,Scheduled Maintenance,Our power restoration team is onsite conducting critical repairs to restore power the area as quickly and safely as possible. 
OROCOVIS,"CEM. CEMENTERIO MUNICIPAL DE OROCOVIS, EDU. ESCUELA ALBERTO MELENDEZ, FGM. ALCALDIA DE OROCOVIS, RES. RESIDENCIAL JOSE VENTURA FORTIS, SECT. BAJURAS, SECT. CALLE LUIS M. ALFARO, SECT. CASCO URBANO, SECT. COLINAS DEL PUEBLO, SECT. DR. UMPIERRE, SECT. EL PU",September 28 08:10',September 28 17:00',1001-1500,Scheduled Maintenance,Our power restoration team is onsite conducting critical repairs to restore power the area as quickly and safely as possible. 
, MIRADOR - ARECIBO PUEBLO ,September 28 02:27',September 28 15:00',<500,Unplanned,Our power restoration team is onsite conducting critical repairs to restore power the area as quickly and safely as possible.
,TRAMO YAHUECAS-ADJUNTAS  ,September 17 15:09',September 28 18:00',<500,3rd Party Damage,Our power restoration team is onsite conducting critical repairs to restore power the area as quickly and safely as possible.