Municipality,Sector,Outage Reported,Estimated Time of Restoration,Estimated Customers Impacted,Category,Current Status
,,,,,,
BAYAMON,"COME. CIUDAD JARDIN, COMU. DAJAOS, COND. CIUDAD DORADA, EDU. ESCUELA CACIQUE MAJAGUA, PARC. JARDINES DE BUENA VISTA, PARC. SABANA, PARC. VAN SCOY, RES. RESIDENCIAL BELLA VISTA HEIGHTS, RES. RESIDENCIAL COLINAS DEL SOL, RES. RESIDENCIAL COLINAS DEL SOL 2, ",September 14 14:58',September 14 20:00',1501-2000,Unplanned,Our local power restoration team is being dispatched to the area as soon as possible. 
,JOBOS - HORIZON ,September 14 14:27',September 14 20:00',<500,Unplanned,Our local power restoration team is being dispatched to the area as soon as possible. 
CAYEY,"COMU. PASTO VIEJO, EDU. ESCUELA REXFORD GUY TUGWELL, SECT. CRUZ, SECT. EL CAMPITO, SECT. EL HATO, SECT. GORITO, SECT. LOS GUZMAN, SECT. LOS PAGANES, SECT. MORENO, SECT. TOnO SAEZ, URB. VISTAS DEL SUR PLANTATION, SECT. SANCHEZ, URB. VISTAS DEL CARIBE",September 14 14:27',September 14 20:00',1501-2000,Unplanned,Our local power restoration team is being dispatched to the area as soon as possible. 
SAN JUAN,"SECT. CAPETILLO, SECT. RIO PIEDRAS ANTIGUO",September 14 13:20',September 14 18:00',<500,Unplanned,Our power restoration team is onsite conducting critical repairs to restore power the area as quickly and safely as possible. 
CABO ROJO,"CAMINO EL BRUJO, CARR 312, CABO ROJO",September 14 10:25',September 14 18:00',501-1000,Scheduled Maintenance,Our power restoration team is onsite conducting critical repairs to restore power the area as quickly and safely as possible. 
FAJARDO,"BDA. MONTAnEZ, BDA. VEVE CALZADA, RES. RESIDENCIAL VILLA FAJARDO , SECT. CASCO URBANO, URB. GARCIA PONCE, URB. PROYECTO FEMA, URB. RESIDENCIAL VILLA FAJARDO 1, URB. SANTIAGO VEVE CALZADA",September 14 09:13',September 14 18:00',<500,Scheduled Maintenance,Our power restoration team is onsite conducting critical repairs to restore power the area as quickly and safely as possible. 
GUAYANILLA,"COMU. VERDUN, EDU. ESCUELA FRANCISCO RODRIGUEZ LOPEZ, PARC. INDIOS, PARC. LOS SOLARES, RES. RESIDENCIAL PADRE NAZARIO, SECT. PIEDRAS BLANCAS, URB. LA CONCEPCION , URB. VILLA DEL RIO",September 14 09:12',September 14 18:00',<500,Scheduled Maintenance,Our power restoration team is onsite conducting critical repairs to restore power the area as quickly and safely as possible. 