Municipality,Sector,Outage Reported,Estimated Time of Restoration,Estimated Customers Impacted,Category,Current Status
VEGA ALTA,"COMU. LOS PUERTOS, EDU. ESCUELA ELEMENTAL ECOLOGICA, PARC. EL COTTO, SECT. COTTO MARTELL, SECT. LA ALDEA, SECT. LA POZA, SECT. LA PRA, SECT. MAYSONET 1, SECT. MAYSONET 2, URB. PAISAJES DE DORADO, CEM. MAUSOLEO MUNICIPAL DE VEGA ALTA, COMU. MONTE REY, COND",April 22 11:26',April 22 16:00',1001-1500,Unplanned,"LUMA has successfully completed repairs and restored power to the area. If you have any questions, please contact us at 1-844-888-5862 (LUMA). "
TOA BAJA,"CMPG. PARQUE DE LAS CIENCIAS, COME. CANTON MALL, COME. PLAZA DEL SOL, COME. PLAZOLETA DEL CANTON, COND. SIERRA BAYAMON APARTMENTS, COND. SIERRA BAYAMON APARTMENTS 750, EDU. ESCUELA INTERMEDIA CACIQUE AGUEYBANA, RES. RESIDENCIAL SIERRA BAYAMON APARTMENTS, ",April 22 12:02',April 22 18:00',2001-2500,Unplanned,Our local power restoration team is being dispatched to the area as soon as possible. 
TRUJILLO ALTO,"SECT. LOS COLONES, SECT. LOS MARQUEZ, SECT. MARIA ANTONIA HERNANDEZ, SECT. PEN, SECT. CULEBRA, SECT. GONZALO CORTEZ, SECT. LUISA SANCHEZ, URB. BRISAS DE LA GLORIA",April 22 11:43',April 22 17:00',501-1000,Unplanned,Our local power restoration team is being dispatched to the area as soon as possible. 
SAN JUAN,"HOTEL LA CONCHA, HOTEL VANDERBILT, VENTANA DEL MAR, IGL. PARROQUIA SAN MERRITZ",April 22 06:43',April 22 15:00',<500,Unplanned,Our local power restoration team is being dispatched to the area as soon as possible. 
,BALDRICH-ACB 3201B MAPFRE,April 21 05:33',April 22 19:00',<500,Unplanned,Our power restoration team is onsite conducting critical repairs to restore power the area as quickly and safely as possible.
,TRAMO > MONACILLOS > CENTRO MEDICO,April 17 18:10',April 22 21:00',<500,Unplanned,Our power restoration team is onsite conducting critical repairs to restore power the area as quickly and safely as possible.