Municipality,Sector,Outage Reported,Estimated Time of Restoration,Estimated Customers Impacted,Category,Current Status
RINCON,"SECT. LAS CRUCES, SECT. LOS MANGOS, URB. ESTANCIA DE RIO GRANDE, URB. PALMA REAL",September 22 09:10',September 22 19:00',<500,Scheduled Maintenance,"LUMA has successfully completed repairs and restored power to the area. If you have any questions, please contact us at 1-844-888-5862 (LUMA). "
SAN JUAN,"SECT. LOS BAEZ, URB. MONTE APOLO ESTATES, PARC. CANEJA, SECT. COREA, SECT. LA CORTE, SECT. LOS GONZALEZ 2, SECT. LOS ROMEROS, SECT. VILLA MARGARITA, URB. DEL PILAR, URB. GARCIA, URB. LOS CALDAS, URB. MILAVILLE, URB. REPARTO DEL PILAR, URB. ROMANY, URB. SA",September 22 08:36',September 22 19:00',<500,Scheduled Maintenance,"LUMA has successfully completed repairs and restored power to the area. If you have any questions, please contact us at 1-844-888-5862 (LUMA). "
,,,,,,
,      TRAMO DE CAPARRA-SEA LAND ,September 22 15:10',September 22 21:00',<500,Unplanned,Our power restoration team is onsite conducting critical repairs to restore power the area as quickly and safely as possible. 
,MAYAGUEZ PLANTA- CUATRO HERMANOS,September 22 14:55',September 22 19:00',<500,Unplanned,Our power restoration team is onsite conducting critical repairs to restore power the area as quickly and safely as possible. 
SAN JUAN,"COND. METRO COURT, RES. RESIDENCIAL VILLA ESPAnA, URB. LAS LOMAS",September 22 07:52',September 22 19:00',501-1000,Scheduled Maintenance,Our power restoration team is onsite conducting critical repairs to restore power the area as quickly and safely as possible. 
,TRAMO YAHUECAS-ADJUNTAS  ,September 17 15:09',September 23 17:00',<500,Unplanned,Our power restoration team is onsite conducting critical repairs to restore power the area as quickly and safely as possible.