Municipality,Sector,Outage Reported,Estimated Time of Restoration,Estimated Customers Impacted,Category,Current Status
YABUCOA,"EDU. ESCUELA MARTA SANCHEZ, PARC. PLAYITA, SECT. QUEBRADILLAS, URB. JAIME C. RODRIGUEZ, URB. SANTA MARIA, CEM. CEMENTERIO REPARTO HORIZONTE YABUCOA, EDU. ESCUELA JUAN B. HUYKE, EDU. ESCUELA LOS COLEGIOS, FGE. ESTACION DE BOMBEROS DE YABUCOA, HOSP. HOSPITA",June 19 03:42',June 19 18:00',>5000,Unplanned,Our local power restoration team is being dispatched to the area as soon as possible. 
,MAUNABO TC - HUMACAO TC ,June 19 03:34',June 19 13:00',<500,Unplanned,Our power restoration team is onsite conducting critical repairs to restore power the area as quickly and safely as possible.
SANTA ISABEL,"URB. HACIENDA MIRAFLORES, URB. LAS FUENTES DE COAMO, URB. MANSIONES DE COAMO, URB. PARAISO DE COAMO, URB. PARQUE DE LAS FLORES, URB. REPARTO EL PRADO, URB. REPARTO LOMAS, SECT. LA PICA, SECT. LOMAS DEL EXPRESO, SECT. USERAS, URB. HACIENDA ISABEL, COME. CO",June 18 22:58',June 18 04:00',3501-4000,Unplanned,Our local power restoration team is being dispatched to the area as soon as possible. 
,TRAMO > BUENA VISTA > PONCE TC,June 15 19:10',June 19 20:00',<500,Unplanned,Our power restoration team is onsite conducting critical repairs to restore power the area as quickly and safely as possible.
,TRAMO > VIADUCTO > PARQUES Y RECREOS,June 14 03:55',June 20 13:00',<500,Unplanned,Our power restoration team is onsite conducting critical repairs to restore power the area as quickly and safely as possible.