Municipality,Sector,Outage Reported,Estimated Time of Restoration,Estimated Customers Impacted,Category,Current Status
GUAYNABO,"COND. MANSIONES DE GARDEN HILLS SUR, URB. GARDEN HILLS , URB. GARDEN HILLS ESTATES, URB. MANSIONES DE GARDEN HILLS, URB. VILLA CAPARRA, COME. ALTAMIRA SHOPPING CENTER, COND. CAMINO REAL, EDIF. POMPINA INVESTMENT, RES. RESIDENCIAL VILLA ESPAnA, URB. ALTAMIRA",September 27 21:22',September 28 03:00',4501-5000,Unplanned,"LUMA has successfully completed repairs and restored power to the area. If you have any questions, please contact us at 1-844-888-5862 (LUMA). "
VEGA ALTA,"COME. PLAZA DORADA SHOPPING CENTER, COM. GASOLINERA PUMA, COND. FAIRWAYS VILLAGE, COND. THE GREENS, IGL. IGLESIA NORTH POINT BAPTIST CHURCH, URB. DORADO BEACH COTTAGES, URB. DORADO BEACH EAST, URB. DORADO BEACH ESTATES, URB. DORADO COUTRY STATE, URB. DORA",September 27 21:05',September 28 02:00',1001-1500,Unplanned,"LUMA has successfully completed repairs and restored power to the area. If you have any questions, please contact us at 1-844-888-5862 (LUMA). "
AGUADILLA,"COME. BORINQUEN TOWN PLAZA, COND. PUERTA DEL MAR, HOSP. HOSPITAL BUEN SAMARITANO, HTL. HOTEL EL FARO, RES. RESIDENCIAL AGUSTIN STAHL, RES. RESIDENCIAL JOSE DE DIEGO, SECT. EL COBO, SECT. LOS ROBLES CUESTA VIEJA, SECT. PLAYUELA, SECT. REPARTO RAMOS, SECT. ",September 27 20:35',September 28 02:00',501-1000,Unplanned,"LUMA has successfully completed repairs and restored power to the area. If you have any questions, please contact us at 1-844-888-5862 (LUMA). "
, MIRADOR - ARECIBO PUEBLO ,September 28 02:27',September 28 07:00',2001-2500,Unplanned,Our power restoration team is onsite conducting critical repairs to restore power the area as quickly and safely as possible.
,TRAMO YAHUECAS-ADJUNTAS  ,September 17 15:09',September 28 18:00',<500,3rd Party Damage,Our power restoration team is onsite conducting critical repairs to restore power the area as quickly and safely as possible.