Municipality,Sector,Outage Reported,Estimated Time of Restoration,Estimated Customers Impacted,Category,Current Status
SAN JUAN,"COND. ISLA NENA 1511, COND. KINGS COURT 76, EDU. SAINT JOHN'S SCHOOL, SECT. BAYOLA, SECT. MINILLAS, SECT. PARQUE, SECT. SAN JUAN MODERNO, SECT. SAN MATEO",December 14 02:48',December 14 10:00',501-1000,Unplanned,"LUMA has successfully completed repairs and restored power to the area. If you have any questions, please contact us at 1-844-888-5862 (LUMA). "
, JOBOS T.C. > MAUNABO T.C.,November 30 21:14',December 15 19:00',<500,Unplanned,Our power restoration team is onsite conducting critical repairs to restore power the area as quickly and safely as possible.
,TRAMO > ENTRE LOS ACB'S 7911A - 7925B. ,November 16 20:20',December 15 18:00',<500,Unplanned,Our power restoration team is onsite conducting critical repairs to restore power the area as quickly and safely as possible.
MAYAGUEZ,"URB. ALTURAS DE MAYAGUEZ, URB. PASEO LOS ROBLES, SECT. MILLO COTES, SECT. QUEBRADA LARGA, COM. RESTAURANTE EL COCHE, COND. PLAYA ALMIRANTE, EDU. ESCUELA MARIANA BRACETTI, PARC. LAS MARIAS, SECT. AJIES, SECT. JUAN VEGA, SECT. LA CHOZA, SECT. LA TOSCA, URB. ESTANCIAS DE SIERRA MAESTRA, URB. HACIENDA LIBERTAD, URB. JARDINES DE DAGUEY, URB. LOS ARBOLES, URB. MANSIONES DE AnASCO, URB. REPARTO DAGUEY, URB. VALLE DE AnASCO, URB. VALLE DE AnASCO 2, URB. VALLE REAL, COMU. SANTA ROSA DE LIMA, COND. WESTERN LAKE VILLAGE, HTL. HOLIDAY INN MAYAGUEZ AND EL TROPICAL CASINO, URB. ALTURAS DE ALGARROBOS, URB. ALTURAS DE MAYAGUEZ, URB. EUGENIO MARIA DE HOSTOS, URB. REPARTO SAN FRANCISCO, EDIF. VILLAS AT HOMED DORSE, COME. WESTERN PLAZA SHOPPING CENTER, SECT. BONET, SECT. CUBA, SECT. PITILLO, URB. ALTURAS DE MAYAGUEZ, URB. BELLAS LOMAS, URB. COLINAS DE ALTURAS DE MAYAGUEZ, URB. COLLEGE GARDENS, URB. CUMBRES DE MIRADERO, URB. EL RETIRO, URB. ESTANCIAS DE MIRADERO, URB. JARDINES DE BORINQUEN, URB. LA RUEDA, URB. LOS VERSALLES, URB. MENDOZA, URB. MIRADERO GARDENS 1, URB. MIRADERO GARDENS 2, URB. MIRADERO HILLS, URB. NU SIGMA, URB. QUINTAS DE SANTA MARIA, URB. QUINTAS DE SANTA MARIA 2, URB. REPARTO PRIVATE COURT, URB. VILLA ENSENAT, URB. VILLA FONTANA, URB. VILLA LAS VIOLETAS, URB. VILLAS DE ALGARROBO, URB. VILLA SUNSIRE, URB. VILLA SUNSIRE CHALETS, URB. VILLA TULI, URB. VISTA DEL MAR, VERT. VERTEDERO DE MAYAGUEZ, COND. EL CASTILLO, COND. VILLAS CENTROAMERICANAS, IND. ZONA INDUSTRIAL, SECT. CALLE LOS INGENIEROS, SECT. CALLE PERPETUO SOCORRO, SECT. CAMINO CRISTO DE LOS MILAGROS, SECT. EL SECO, SECT. PITILLO, URB. ALTURAS DE MAYAGUEZ, URB. JARDINES DEL OBISPADO, URB. MANSIONES DE ESPAnA, URB. PARQUE DE LA CEIBA, URB. PASEO LOS ROBLES, URB. VILLA OBISPADO, URB.",December 14 08:23',December 14 18:00',1001-1500,Scheduled Maintenance,Our power restoration team is onsite conducting critical repairs to restore power the area as quickly and safely as possible. 
AGUADILLA,"CMPD. GUAYABO, COME. CENTRO COMERCIAL ASOMANTE, COME. PLAZA COPPELIA, COMU. COMUNIDAD ESPECIAL CALLE SAN JOSE, COMU. ESPINAL, COMU. LAS FLORES, EDU. ESCUELA EPIFANIO ESTRADA, PARC. NIEVES, RES. RESIDENCIAL AGUADA GARDENS, RES. RESIDENCIAL JARDINES DE AGUA",December 14 07:52',December 14 18:00',<500,Scheduled Maintenance,Our power restoration team is onsite conducting critical repairs to restore power the area as quickly and safely as possible. 
SAN GERMAN,"URB. ESTANCIAS DEL RIO, URB. LAS PALMAS, URB. MANSIONES DE SABANA GRANDE, URB. SAN ANTONIO, URB. SANTA ANA, URB. VILLA BORINQUEN, COMU. CAMINO MERITO, EDIF. ROSADO, PARC. MINILLAS, SECT. FLOR, URB. PASEOS DEL VALLE",December 14 06:30',December 14 18:00',501-1000,Unplanned,Our power restoration team is onsite conducting critical repairs to restore power the area as quickly and safely as possible. 
BAYAMON,"COME. VICTORY SHOPPING CENTER, RES. RESIDENCIAL JOSE CELSO BARBOSA, SECT. LOS MILLONES, URB. HERMANAS DAVILA, URB. SAN FERNANDO, URB. SIERRA LINDA",December 13 18:12',December 14 13:00',<500,Unplanned,Our power restoration team is onsite conducting critical repairs to restore power the area as quickly and safely as possible.
, FAJARDO - PALMER ,December 13 15:35',December 14 20:00',<500,Unplanned,Our power restoration team is onsite conducting critical repairs to restore power the area as quickly and safely as possible.
SAN JUAN,CMPR. PARQUE ESCORIAL,December 13 11:10',December 14 18:00',<500,Unplanned,Our power restoration team is onsite conducting critical repairs to restore power the area as quickly and safely as possible.