Municipality,Sector,Outage Reported,Estimated Time of Restoration,Estimated Customers Impacted,Category,Current Status
YAUCO,"SECT. LA REPUBLICA, SECT. LOS HERNANDEZ, SECT. QUInONES, URB. QUINTAS DE VALLE VERDE, URB. VILLAS DEL CAFETAL 2",March 16 12:15',March 16 19:00',<500,Unplanned,Our local power restoration team is being dispatched to the area as soon as possible. 
SAN JUAN,"COND. LUISA 55, COND. PICCIONI 1125, COND. VENETIAN TOWER",March 16 11:00',March 16 17:00',1501-2000,Unplanned,Our local power restoration team is being dispatched to the area as soon as possible. 
BAYAMON,"COM. POPULAR AUTO, COMU. MACUN, COMU. PAJAROS, COMU. VILLA OLGA, SECT. BUEN VECINO, SECT. CAPITAN, SECT. LA PRA 1, SECT. LAS CASITAS, SECT. REPARTO ANAMAR",March 16 09:00',March 16 19:00',<500,Scheduled Maintenance,Our power restoration team is onsite conducting critical repairs to restore power the area as quickly and safely as possible. 
SAN JUAN,"BDA. BUEN CONSEJO, BDA. VENEZUELA, CEM. CEMENTERIO VILLA NEVAREZ, CMPE. JARDIN BOTANICO, COND. EL PARAISO, COND. PARADISE COURT, COND. PARADISE COURT 2, COND. PARK GARDENS COURT, EDU. COLEGIO SAN JOSE, IND. SAN JOSE, IND. URBANIZACION INDUSTRIAL EL CINCO,",March 16 03:55',March 16 19:00',501-1000,Unplanned,Our power restoration team is onsite conducting critical repairs to restore power the area as quickly and safely as possible.
SAN JUAN,"COND. EL COMANDANTE, URB. COUNTRY CLUB, URB. EL COMANDANTE ",March 16 02:15',March 16 15:00',<500,Unplanned,Our power restoration team is onsite conducting critical repairs to restore power the area as quickly and safely as possible. 
,TRAMO DE PUERTA DE TIERRAS -COVADONGA GIS,March 12 10:39',March 17 16:00',<500,Unplanned,Our power restoration team is onsite conducting critical repairs to restore power the area as quickly and safely as possible.