Municipality,Sector,Outage Reported,Estimated Time of Restoration,Estimated Customers Impacted,Category,Current Status
, ACACIAS - MAYAGUEZ PLANTA,January 17 13:01',January 17 17:00',<500,Scheduled Maintenance,"LUMA has successfully completed repairs and restored power to the area. If you have any questions, please contact us at 1-844-888-5862 (LUMA). "
PONCE,"COMU. BRISAS DEL LAGO, COMU. CERRILLO HOYOS, COMU. COTO LAUREL, EDU. ESCUELA INTERMEDIA JUAN SERRALLES, EDU. ESCUELA SUPERIOR JUAN SERRALES, SECT. CERRILLO HOYOS, SECT. PALMAREJO, URB. HACIENDAS ANA MARIA, URB. LLANOS DEL SUR, URB. SANTA RITA 3, URB. SANT",January 17 08:01',January 17 17:00',>5000,Scheduled Maintenance,"LUMA has successfully completed repairs and restored power to the area. If you have any questions, please contact us at 1-844-888-5862 (LUMA). "
,ACACIAS - MAYAGUEZ PLANTA,January 17 13:01',January 17 17:00',<500,Scheduled Maintenance,Our power restoration team is onsite conducting critical repairs to restore power the area as quickly and safely as possible. 
TRUJILLO ALTO,"URB. ALAMEIN, URB. EXTENSION VILLA CAPRI, URB. PARK GARDENS, URB. VENUS GARDENS SUR, URB. VILLA ANDALUCIA, URB. VILLA CAPRI, URB. VILLA CAPRI COURT, URB. VILLA ROSALES, COME. UNIVERSAL PLAZA, COND. CAMINO TERRA VERDE, COND. COOPERATIVA JARDINES DE TRUJILL",January 17 11:16',January 17 18:00',<500,Scheduled Maintenance,Our power restoration team is onsite conducting critical repairs to restore power the area as quickly and safely as possible. 
SALINAS,"BDA. MOSQUITO, BDA. LOPEZ, COMU. CENTRAL AGUIRRE HACIENDA VIEJA, COMU. LAS OCHENTA, COMU. MONTESORIA 2, EDU. ESCUELA ESCUELA COQUI INTERMEDIA, PARC. EXTENSION COQUI 2, SECT. BRISAS DEL SUR, SECT. COQUI , URB. EUGENE RICE, URB. EXTENSION COQUI, URB. LA FAB",January 17 10:25',January 17 18:00',501-1000,Scheduled Maintenance,Our power restoration team is onsite conducting critical repairs to restore power the area as quickly and safely as possible. 
CABO ROJO,"COM. BOQUERON BAKERY, COND. BOQUERON BAY VIEW, COND. BOQUERON BAY VILLAS, COND. BRISA REAL, COND. CABOQUERON, COND. HACIENDA DE LA BAUME 1, COND. HACIENDA DE LA BAUME 2, COND. NEPTUNE VILLAGE, COND. PASEO DEL MAR, COND. PASEOS DEL FARO 1, COND. PASEO TAIN",January 17 08:01',January 17 17:00',<500,Scheduled Maintenance,Our power restoration team is onsite conducting critical repairs to restore power the area as quickly and safely as possible. 
AGUADA,"COMU. COMUNIDAD ESPECIAL CALLE SAN FRANCISCO, COMU. COMUNIDAD ESPECIAL CALLE SAN JOSE, RES. RESIDENCIAL FRANCISCO EGIPCIACO, RES. RESIDENCIAL LOS ROBLES, SECT. CASCO URBANO, SECT. JOSE CHEPE HERNANDEZ, SECT. POLO DIAZ, URB. ALTURAS DE AGUADA, URB. EXTENSI",January 17 08:01',January 17 17:00',<500,Scheduled Maintenance,Our power restoration team is onsite conducting critical repairs to restore power the area as quickly and safely as possible. 
BAYAMON,"BDA. LOS ANGELES, COME. FOREST HILLS PLAZA, COME. VICTORY SHOPPING CENTER, COM. FUNERARIA VINER, EDU. AMERICAN SCHOOL, RES. RESIDENCIAL LOS MILLONES APARTMENTS, RES. RESIDENCIAL LOS MILLONES APARTMENTS 2, SECT. CALLE COMERIO, SECT. LOS MILLONES, URB. BRAU",January 17 08:01',January 17 18:00',501-1000,Scheduled Maintenance,Our power restoration team is onsite conducting critical repairs to restore power the area as quickly and safely as possible. 
JUNCOS,"COND. VIRGINIA VALLEY RENTAL, COND. VIRGINIA VALLY COURT, RES. RESIDENCIAL NARCISO VARONA, SECT. GALARZA, URB. EXTENSION JARDINES DE BARCELONA, URB. JARDINES DE BARCELONA, URB. JARDINES DE JUNCOS 1, URB. JARDINES DE JUNCOS 2, URB. JARDINES DE JUNCOS 3, UR",January 17 07:13',January 17 17:00',501-1000,Scheduled Maintenance,Our power restoration team is onsite conducting critical repairs to restore power the area as quickly and safely as possible. 