Municipality,Sector,Outage Reported,Estimated Time of Restoration,Estimated Customers Impacted,Category,Current Status
PONCE,"URB. SANTA RITA 3, URB. SANTA RITA 4, COMU. CERRILLO HOYOS, COMU. EL LAUREL, COMU. MANDRY, COMU. RAICES, EDU. ESCUELA ELEMENTAL PEDRO J. FOUR, HOSP. SAN CRISTOBAL, SECT. AGUSTINILLO, SECT. CERRILLO HOYOS, SECT. REAL ANON, SECT. VISTA ALEGRE, URB. ESTANCIA",December 12 09:00',December 12 23:30',1001-1500,Scheduled Maintenance,"LUMA has successfully completed repairs and restored power to the area. If you have any questions, please contact us at 1-844-888-5862 (LUMA). "
, JOBOS T.C. > MAUNABO T.C.,November 30 21:14',December 13 19:00',<500,Unplanned,Our power restoration team is onsite conducting critical repairs to restore power the area as quickly and safely as possible.
,TRAMO > ENTRE LOS ACB'S 7911A - 7925B. ,November 16 20:20',December 13 18:00',<500,Unplanned,Our power restoration team is onsite conducting critical repairs to restore power the area as quickly and safely as possible.
SAN JUAN,"CMPD. FRAIGCOMAR, CMPG. AUTORIDAD METROPOLITANA DE AUTOBUSES, FGM. DEFENSA CIVIL MUNICIPAL, IND. URBANIZACION INDUSTRIAL EL CINCO, RES. RESIDENCIAL LAS AMAPOLAS, RES. RESIDENCIAL SAN FERNANDO, URB. ALTURAS DE SANTA MARIA, URB. BELISA, URB. CARIBE, URB. CH",December 12 20:34',December 13 04:00',1501-2000,Unplanned,Our local power restoration team is being dispatched to the area as soon as possible. 
,HATO TEJAS A DORADO TC,December 12 15:30',December 12 21:00',<500,Unplanned,Our local power restoration team is being dispatched to the area as soon as possible. 