Municipality,Sector,Outage Reported,Estimated Time of Restoration,Estimated Customers Impacted,Category,Current Status
,"BO. FULLADOZA, PUEBLO, FLAMENCO, PLAYA SARDINAS, BDA. CLARK, BDA. VILLA MUnECO, CEM. CEMENTERIO MUNICIPAL DE CULEBRA, COMU. VILLA FLAMENCO, COND. COSTA BONITA RESOT, SECT. LA ROMANA, URB. ALTURAS DE ZONI, URB. LA PERLA, URB. PLAYA CLARA, URB. PUNTA VIENTO ESTATES",October 31 10:37',November 02 23:00',<500,3rd Party Damage,"LUMA has successfully completed repairs and restored power to the area. If you have any questions, please contact us at 1-844-888-5862 (LUMA). "
DORADO,"URB. BRIGTHON COUNTRY CLUB, CMPR. DORADO DEL MAR, COMU. MAMEYAL, COMU. SAN ANTONIO, COMU. VILLA PLATA, COND. COSTA DORADA, COND. OCEAN VILLAS, COND. VISTAS DEL MAR, EDU. ESCUELA INTERMEDIA JOSE SANTOS ALEGRIA, RES. RESIDENCIAL MANUEL MORALES, SECT. CASCO ",November 02 20:04',November 02 23:00',1001-1500,Scheduled Maintenance,"LUMA has successfully completed repairs and restored power to the area. If you have any questions, please contact us at 1-844-888-5862 (LUMA). "
DORADO,"COM. FERRETERIA NATIONAL, COMU. SAN ANTONIO, RES. RESIDENCIAL MANUEL MORALES, SECT. CASCO URBANO, URB. BRISAS DEL PLATA, URB. JARDINES DE DORADO, URB. MARTORELL, CMPA. DORADO DEL MAR, CMPR. DORADO DEL MAR, COMU. MAMEYAL, IGL. IGLESIA CRISTIANA DISCIPULOS ",November 02 08:14',November 02 21:00',>5000,Scheduled Maintenance,"LUMA has successfully completed repairs and restored power to the area. If you have any questions, please contact us at 1-844-888-5862 (LUMA). "
, COSTA SUR S.P. - RADIAL (DEMACO),October 31 07:42',November 02 23:00',<500,Unplanned,Our power restoration team is onsite conducting critical repairs to restore power the area as quickly and safely as possible. 
,TRAMO > LLORENS > VILLAMAR,October 28 12:25',November 06 18:00',<500,Unplanned,Our power restoration team is onsite conducting critical repairs to restore power the area as quickly and safely as possible.
MOCA,"COMU. PALMAR, SECT. CORREA, SECT. LOS TORRES, URB. VILLA CORDERO, COMU. SABANA, COND. MOCA HOUSING, IND. ZONA INDUSTRIAL, PARC. ACEVEDO, RES. RESIDENCIAL DOCTOR JOSE N. GANDARA, SECT. CASCO URBANO, URB. LAS PALMAS, URB. LOS ROBLES",November 02 02:00',November 02 21:00',<500,Unplanned,Our power restoration team is onsite conducting critical repairs to restore power the area as quickly and safely as possible. 