Municipality,Sector,Outage Reported,Estimated Time of Restoration,Estimated Customers Impacted,Category,Current Status
,TRAMO DE PUERTA DE TIERRAS -COVADONGA GIS,March 12 10:39',April 14 18:00',<500,Unplanned,Our power restoration team is onsite conducting critical repairs to restore power the area as quickly and safely as possible.
HORMIGUEROS,"COM. CLUB DEPORTIVO DEL OESTE, COND. BAHIA SERENA, COND. CORAL BEACH, COND. PERLE DU MER, COND. PLAYA AZUL, COND. PUNTA ARENAS, COND. SEA VIEW, COND. SERENITY BY THE SEA , EDU. EASTERN UNIVERSITY, EDU. ESCUELA SEGUNDA UNIDAD BARRIO PUERTO REAL, HTL. MOTEL",April 05 15:05',April 05 21:00',4001-4500,Unplanned,Our local power restoration team is being dispatched to the area as soon as possible. 
PONCE,"BDA. CLAUSELLS, BDA. FERRAN, BDA. LOS CHINOS, BDA. TAMARINDO, CEM. CEMENTERIO CIVIL DE PONCE, EDU. ESCUELA FRANCISCO PARRA, EDU. ESCUELA THOMAS ARMSTRONG, RES. RESIDENCIAL SANTIAGO IGLESIAS, SECT. CASCO URBANO, URB. EXTENSION MORELL CAMPOS, URB. MORELL CA",April 05 10:11',April 05 21:00',501-1000,Scheduled Maintenance,Our power restoration team is onsite conducting critical repairs to restore power the area as quickly and safely as possible. 
PONCE,"COME. PLAZA LAS MONJITAS, SECT. LAS CANITAS, SECT. VILLA DOS RIOS, URB. ALTURAS DE JACARANDA, URB. EL MONTE, URB. GLENVIEW GARDENS, URB. JACARANDA, URB. LAS MONJITAS, URB. QUINTAS DE MONSERRATE, URB. VISTA POINT",April 05 08:41',April 05 21:00',1001-1500,Scheduled Maintenance,Our power restoration team is onsite conducting critical repairs to restore power the area as quickly and safely as possible. 
GUAYNABO,"EDU. WESLEYAN ACADEMY, RES. RESIDENCIAL RAFAEL MARTINEZ NADAL, SECT. MELIA, URB. EL ALAMO, URB. PARKVILLE, URB. VILLA AVILA, URB. VILLA CLEMENTINA, URB. ALTURAS DE SANTA MARIA, URB. COLLEGEVILLE, URB. MALLORCA, URB. SAN RAMON",April 05 07:14',April 05 21:00',<500,Scheduled Maintenance,Our power restoration team is onsite conducting critical repairs to restore power the area as quickly and safely as possible. 
MAYAGUEZ,"COND. EL CASTILLO, COND. VILLAS CENTROAMERICANAS, IND. ZONA INDUSTRIAL, SECT. CALLE LOS INGENIEROS, SECT. CALLE PERPETUO SOCORRO, SECT. CAMINO CRISTO DE LOS MILAGROS, SECT. EL SECO, SECT. PITILLO, URB. ALTURAS DE MAYAGUEZ, URB. JARDINES DEL OBISPADO, URB.",April 04 18:28',April 05 21:00',<500,Unplanned,Our power restoration team is onsite conducting critical repairs to restore power the area as quickly and safely as possible. 