Municipality,Sector,Outage Reported,Estimated Time of Restoration,Estimated Customers Impacted,Category,Current Status
SAN SEBASTIAN,"SECT. BEJUCO, SECT. EL PARAISO, SECT. LA VEGA, SECT. MUnIZ, SECT. RICARDO MORALES, URB. EXTENSION VILLA RITA, URB. JARDINES DE GUATEMALA, URB. LOS ALAMOS, URB. VILLA RITA",October 01 21:50',October 02 03:00',2501-3000,Unplanned,"LUMA has successfully completed repairs and restored power to the area. If you have any questions, please contact us at 1-844-888-5862 (LUMA). "
,YAUCO 2- ACB 1219A,September 30 13:39',October 02 16:00',<500,Unplanned,Our power restoration team is onsite conducting critical repairs to restore power the area as quickly and safely as possible.
TOA BAJA,"COM. AMERICAN PETROLEUM COMPANY, COMU. CAMPANILLAS, IND. INDUSTRIA LECHERA DE PUERTO RICO, SECT. VILLA HOSTOS, URB. RESIDENCIAL CAMPANILLA",October 02 00:15',October 01 06:00',2001-2500,Unplanned,Our power restoration team is onsite conducting critical repairs to restore power the area as quickly and safely as possible.
TOA BAJA,"ARE. PARQUE DE BEISBOL Y CANCHA, COME. PLAZA PRADERAS, COMU. COREA, COND. RIBERAS DE RIO HONDO, PARC. RIO PLANTATION, URB. ESTANCIAS DE RIO HONDO 1, URB. ESTANCIAS DE RIO HONDO 2, URB. ESTANCIAS DE RIO HONDO 3, URB. FRONTERAS DE BAYAMON, URB. LOS ALMENDRO",October 01 22:25',October 02 03:00',4501-5000,Unplanned,Our local power restoration team is being dispatched to the area as soon as possible. 
,LA RAMBLA - J. DIAZ,October 01 13:45',October 02 20:00',<500,Unplanned,Our power restoration team is onsite conducting critical repairs to restore power the area as quickly and safely as possible.