Municipality,Sector,Outage Reported,Estimated Time of Restoration,Estimated Customers Impacted,Category,Current Status
BAYAMON,"PARC. VAN SCOY, RES. RESIDENCIAL COLINAS DEL SOL 2, URB. BELLA VISTA GARDENS, URB. CANA, COMU. MUCARABONES, COND. TERRAZAS DEL CIELO, EDU. ESCUELA AGRICOLA DE BUCARABONES, EDU. ESCUELA JOSE M. DEL VALLE, SECT. BRISAS DEL ESTE, SECT. EXTENSION VILLA DEL RI",August 29 19:17',August 29 23:00',>5000,3rd Party Damage,"LUMA has successfully completed repairs and restored power to the area. If you have any questions, please contact us at 1-844-888-5862 (LUMA). "
TOA BAJA,"COMU. PAJAROS, SECT. REPARTO MOLINA, URB. SAN RAFAEL ESTATES 2, COME. BAYAMON OESTE SHOPPING CENTER, COMU. EL VOLCAN, COMU. ZAYA VERDE, COND. FLAMINGO APARTMENTS, COND. VICTORIA VILLAGES, COND. VILLAS DE HATO TEJAS, EDU. COLEGIO SANTO TOMAS DE AQUINO, EDU",August 29 19:17',August 29 23:00',>5000,3rd Party Damage,"LUMA has successfully completed repairs and restored power to the area. If you have any questions, please contact us at 1-844-888-5862 (LUMA). "
,TRAMO > DOS BOCAS > CIALES,August 29 19:46',August 30 12:00',<500,Unplanned,Our power restoration team is onsite conducting critical repairs to restore power the area as quickly and safely as possible.
GURABO,"CMPR. PRECIOSA, COND. PASEO GALES, PARC. NAVARRO, SECT. CIELITO, SECT. SANTA BARBARA, URB. ALTA PAZ EN PRECIOSA, URB. CHALETS DE SANTA BARBARA, URB. COLLEGE HEIGHTS, URB. EL PARAISO SANTA BARBARA, URB. ESTANCIAS DE SANTA BARBARA, URB. MANSIONES DE SANTA B",August 29 13:36',August 29 22:00',<500,Unplanned,Our power restoration team is onsite conducting critical repairs to restore power the area as quickly and safely as possible. 
,    TRAMO JUANA DIAZ TC – TORO NEGRO(0330 AL 11A  ),August 29 11:21',September 15 18:00',<500,Unplanned,Our power restoration team is onsite conducting critical repairs to restore power the area as quickly and safely as possible.
SANTA ISABEL,"PARC. JAUCA NUEVAS, PARC. JAUCA VIEJAS, SECT. CANTA SAPO, SECT. CASCO URBANO, SECT. EL MONTE, SECT. LA FLORIDA, SECT. LA PLAYA DE JAUCA, SECT. PLAYA TEXIDOR, SECT. YERVA DURA, URB. ALBORADA PARK, URB. LA HACIENDA, URB. VILLA JAUCA",August 29 08:43',August 29 21:00',1001-1500,Scheduled Maintenance,Our power restoration team is onsite conducting critical repairs to restore power the area as quickly and safely as possible. 
SAN JUAN,"CMPE. UNIVERSIDAD DE PUERTO RICO RECINTO RIO PIEDRAS, COM. DENTISTAS, COM. FARMACIA WALGREENS, COM. LA CUEVA DEL CHICKEN INN, COM. NEFROLOGIA, COM. SANTANDER, COND. EGIDA EMILIANO POL, COND. FRENCH PLAZA, EDU. COLEGIO LOURDES, FGE. CENTRO JUDICIAL DE SAN ",August 29 08:43',August 29 21:00',<500,Scheduled Maintenance,Our power restoration team is onsite conducting critical repairs to restore power the area as quickly and safely as possible. 