Municipality,Sector,Outage Reported,Estimated Time of Restoration,Estimated Customers Impacted,Category,Current Status
VILLALBA,"BDA. COOPERATIVA, BDA. NUEVA, COMU. HACIENDA EL MAYORAL, COMU. JARDINES DE VILLA BLANCA, COND. ESTANCIAS DEL MAYORAL, SECT. CASCO URBANO, SECT. EL CERCAO, SECT. EL CHICHON, SECT. EL COLLADO, SECT. EL HOYO, SECT. EL MAGUEY, SECT. EL PUENTE, SECT. EL SEMIL,",January 28 08:25',January 28 20:00',2001-2500,Unplanned,"LUMA has successfully completed repairs and restored power to the area. If you have any questions, please contact us at 1-844-888-5862 (LUMA). "
SAN JUAN,"COME. 65 DE INFANTERIA SHOPPING COURT, COME. VILLA PRADES SHOPPING CENTER, COND. CHALETS DE PARAISO, COND. LAGUNA VIEW TOWERS 1, COND. LAS CAMELIAS, COND. PORTAL DE LA REINA, COND. VALLES DEL PARAISO, COND. VILLAS DE MONTE CARLO, EDIF. STELLA PEREZ CELIA,",January 27 20:45',January 28 16:00',<500,Unplanned,"LUMA has successfully completed repairs and restored power to the area. If you have any questions, please contact us at 1-844-888-5862 (LUMA). "
MARICAO,"COMU. LA ISABEL, SECT. ACEITUNA, SECT. PALMARES, PARC. LA ISABEL, PARC. LAS CARMELITAS, PARC. ROLON, SECT. CALLE INES, SECT. CAMBALACHE, SECT. CAMINO DOMINGO BACO, SECT. LA ENVIDIADA, SECT. LAS VEGAS, SECT. REPARTO NARANJALES",January 28 08:00',January 28 18:00',501-1000,Scheduled Maintenance,Our power restoration team is onsite conducting critical repairs to restore power the area as quickly and safely as possible. 
MAYAGUEZ,"SECT. CAMINO LOS STRIKER, SECT. QUEBRADA GRANDE, URB. CUMBRE LAS MESAS, URB. MANSIONES LAS MESAS, URB. VISTA ALEGRE, URB. VISTA GARDENS",January 28 08:00',January 28 18:00',1001-1500,Scheduled Maintenance,Our power restoration team is onsite conducting critical repairs to restore power the area as quickly and safely as possible. 
,     TRAMO ACB'S 0335A - 0381B ,January 21 13:45',January 28 23:00',<500,Unplanned,Our power restoration team is onsite conducting critical repairs to restore power the area as quickly and safely as possible.