Municipality,Sector,Outage Reported,Estimated Time of Restoration,Estimated Customers Impacted,Category,Current Status
,         TRAMO DE DOS BOCAS HP - ACB 2327,October 14 19:15',October 15 18:00',<500,Unplanned,"LUMA has successfully completed repairs and restored power to the area. If you have any questions, please contact us at 1-844-888-5862 (LUMA). "
LUQUILLO,"COME. PLAZA DEL ORIENTE, COM. MCDONALD'S, COMU. RAMOS, EDU. ESCUELA ALEJANDRINO RIOS, HOSP. CENTRO DE DIAGNOSTICO Y TRATAMIENTO DE LUQUILLO, IND. URBANIZACION INDUSTRIAL PARK, RES. RESIDENCIAL PUBLICO DIEGO ZALDUONDO, SECT. SANTO DOMINGO, URB. ALAMAR, URB",October 15 08:43',October 15 18:00',501-1000,Scheduled Maintenance,Our power restoration team is onsite conducting critical repairs to restore power the area as quickly and safely as possible. 
AGUADA,"COMU. COMUNIDAD ESPECIAL CALLE SAN FRANCISCO, COMU. COMUNIDAD ESPECIAL CALLE SAN JOSE, RES. RESIDENCIAL FRANCISCO EGIPCIACO, RES. RESIDENCIAL LOS ROBLES, SECT. CASCO URBANO, SECT. JOSE CHEPE HERNANDEZ, SECT. POLO DIAZ, URB. ALTURAS DE AGUADA, URB. EXTENSI",October 15 08:33',October 15 19:00',<500,Scheduled Maintenance,Our power restoration team is onsite conducting critical repairs to restore power the area as quickly and safely as possible. 
AGUADILLA,"SECT. LENCHO PEREZ, SECT. LEO FORA, SECT. LOS CARDONA, SECT. MILITAR, SECT. MON RUIZ, SECT. NARANJO ABAJO, SECT. NARANJO ARRIBA, SECT. NARANJO CUCHILLAS, SECT. NARANJO MILITAR, SECT. SABANA, PARC. LUYANDO, SECT. ANGEL CHAPARRO, SECT. CARLOS CONCEPCION, SE",October 15 08:19',October 15 18:00',1501-2000,Scheduled Maintenance,Our power restoration team is onsite conducting critical repairs to restore power the area as quickly and safely as possible. 
SAN JUAN,"COME. PLAZA LAS AMERICAS, EDU. ESCUELA NEMESIO R. CANALES, IGL. IGLESIA PRESBITERIANA DE PUERTO NUEVO, IGL. PARROQUIA MARIA MADRE DEL MUNDO, RES. RESIDENCIAL NEMESIO R. CANALES, URB. PUERTO NUEVO",October 14 22:20',October 15 17:00',<500,Unplanned,Our power restoration team is onsite conducting critical repairs to restore power the area as quickly and safely as possible. 