Municipality,Sector,Outage Reported,Estimated Time of Restoration,Estimated Customers Impacted,Category,Current Status
GUAYANILLA,"CMPD. COMPLEJO DEPORTIVO DE GUAYANILLA, RES. RESIDENCIAL BAHIA, SECT. LOS SITIOS, SECT. MAGAS ABAJO, SECT. MAGAS ARRIBA, SECT. PLAYITA, SECT. SAN PEDRO DE MACORIS, SECT. VILLA DEL CARMEN, URB. BAHIA 2, URB. EXTENSION SANTA ELENA 3, URB. STELLA, SECT. LA M",July 03 10:23',July 03 16:00',1001-1500,Scheduled Maintenance,"LUMA has successfully completed repairs and restored power to the area. If you have any questions, please contact us at 1-844-888-5862 (LUMA). "
CAGUAS,"EDU.ESCUELA LUIS MUnOZ GRILLO, PARC. JURADO, PARC. MUnOZ GRILLO, SECT. LAS PInAS, SECT. LOS ORTIZ, URB. ALTURAS DE BEATRIZ, SECT. LAS CRUCES, SECT. REPARTO MARITZA",July 02 10:01',July 03 11:30',501-1000,Unplanned,"LUMA has successfully completed repairs and restored power to the area. If you have any questions, please contact us at 1-844-888-5862 (LUMA). "
GUAYANILLA,"COMU. VERDUN, EDU. ESCUELA FRANCISCO RODRIGUEZ LOPEZ, PARC. INDIOS, PARC. LOS SOLARES, RES. RESIDENCIAL PADRE NAZARIO, SECT. PIEDRAS BLANCAS, URB. LA CONCEPCION , URB. VILLA DEL RIO",July 03 10:23',July 03 16:00',1001-1500,Scheduled Maintenance,Our power restoration team is onsite conducting critical repairs to restore power the area as quickly and safely as possible. 
JUNCOS,"COME. JUNCOS PLAZA, COMU. EL MANGO, COMU. LAS CAMPInAS, COMU. ROSALIA, COMU. SANTANA, COMU. SANTANA 1, COMU. VILLA ALBIZU, COND. LA CIMA APARTMENTS, EDU. ESCUELA JOSE COLLAZO COLON, EDU. ESCUELA JUAN A. SANCHEZ, IND. CEIBA NORTE, IND. CENTRO INDUSTRIAL BA",July 03 09:05',July 03 14:00',501-1000,Unplanned,Our power restoration team is onsite conducting critical repairs to restore power the area as quickly and safely as possible. 
,           TRAMO DE GUANICA - SAN GERMAN,July 02 16:26',July 03 14:00',<500,Unplanned,Our power restoration team is onsite conducting critical repairs to restore power the area as quickly and safely as possible. 