Municipality,Sector,Outage Reported,Estimated Time of Restoration,Estimated Customers Impacted,Category,Current Status
TRUJILLO ALTO,"SECT. LOS COLONES, SECT. LOS MARQUEZ, SECT. MARIA ANTONIA HERNANDEZ, SECT. PEN, SECT. CULEBRA, SECT. GONZALO CORTEZ, SECT. LUISA SANCHEZ, URB. BRISAS DE LA GLORIA",September 17 14:14',September 17 20:00',<500,Unplanned,"LUMA has successfully completed repairs and restored power to the area. If you have any questions, please contact us at 1-844-888-5862 (LUMA). "
,,,,,,
,,,,,,
CEIBA,"URB. ROOSEVELT GARDENS, PARC. DAGUAO, PARC. NUEVAS DAGUAO, PARC. VIEJAS DAGUAO, URB. PROMISED LAND",September 17 09:52',September 17 19:00',501-1000,Scheduled Maintenance,Our power restoration team is onsite conducting critical repairs to restore power the area as quickly and safely as possible. 
SAN JUAN,"URB. SAN FRANCISCO, URB. SAN IGNACIO, URB. SANTA MARIA",September 17 09:19',September 17 19:00',501-1000,Scheduled Maintenance,Our power restoration team is onsite conducting critical repairs to restore power the area as quickly and safely as possible. 
,AGUAS BUENAS G.I.S. - SABANA LLANA T.C,September 17 07:45',September 17 20:00',<500,Unknown,Our power restoration team is onsite conducting critical repairs to restore power the area as quickly and safely as possible. 
,SAN JUAN S.P. - VIADUCTO T.C. -,September 17 06:24',September 17 19:00',<500,Scheduled Maintenance,Our power restoration team is onsite conducting critical repairs to restore power the area as quickly and safely as possible. 