Municipality,Sector,Outage Reported,Estimated Time of Restoration,Estimated Customers Impacted,Category,Current Status
RIO GRANDE,"COND. BOSQUE DEL MAR, COND. CASA DEL MAR RESORT 1, COND. CASA DEL MAR RESORT 2, COND. CONTINENTAL BEACH RESORT, COND. COSTA DORADA, COND. HILLSIDE VILLAGE, COND. LAS VISTAS DEL CACIQUE DE RIO MAR, COND. LAS VISTAS DE RIO MAR, COND. OCEAN VILLAS , COND. PL",February 28 14:02',February 28 18:00',2001-2500,Unplanned,"LUMA has successfully completed repairs and restored power to the area. If you have any questions, please contact us at 1-844-888-5862 (LUMA). "
MARICAO,"IND. HACIENDA CAFETELERA RIO PRIETO, SECT. EL 22, SECT. EL 30, SECT. LAS PARCELAS, SECT. LOS SAPOS, SECT. RENTAS",February 28 08:30',February 28 17:00',<500,Scheduled Maintenance,"LUMA has successfully completed repairs and restored power to the area. If you have any questions, please contact us at 1-844-888-5862 (LUMA). "
HATILLO,"SECT. CUESTA LOS MUDOS, SECT. LA PALOMA, SECT. LAS PLANAS PARC. CAPAEZ, PARC. CORCOVADO, SECT. AGUILAR, SECT. EL PALMAR, SECT. LA GALLERA, SECT. LA PALOMA, SECT. LOS MARTINEZ, SECT. PUNTA BRAVA, SECT. VERDUM, URB. ESTANCIAS DE VISTA VERDE, URB. LA ARBOLEDA, URB. VALLE VERDE, URB. VERDE LUZ, URB. VILLA CAMPO VERDE, URB. VILLA CRISTINA",February 28 09:45',February 28 17:00',>5000,Unplanned,Our power restoration team is onsite conducting critical repairs to restore power the area as quickly and safely as possible. 
SAN JUAN,"COND. MELIYAN, EDU. COLEGIO CONRAZON DE MARIA, SECT. TIERRA SANTA, URB. ALTAMESA, URB. COOPERATIVA YAMBELE, URB. LAS LOMAS, URB. SANTIAGO IGLESIAS",February 28 08:30',February 28 18:00',501-1000,Scheduled Maintenance,Our power restoration team is onsite conducting critical repairs to restore power the area as quickly and safely as possible. 
SAN JUAN,"CMPG. AUTORIDAD DE ENERGIA ELECTRICA, COND. BALCONES DE SAN JUAN, COND. DE DIEGO CHALETS, COND. PARQUE SAN AGUSTIN, COND. PRUDENCIO RIVERA MARTINEZ, EDIF. CARIBBEAN SIGN SUPPLY, EDU. ESCUELA ELEMENTAL LAS VIRTUDES, EDU. ESCUELA SECUNDARIA DR. CESAREO ROSA",February 28 08:30',February 28 18:00',<500,Scheduled Maintenance,Our power restoration team is onsite conducting critical repairs to restore power the area as quickly and safely as possible. 