Municipality,Sector,Outage Reported,Estimated Time of Restoration,Estimated Customers Impacted,Category,Current Status
QUEBRADILLAS,"EDU. ESCUELA ELEMENTAL JOSE DE DIEGO, PARC. SAN ANTONIO, SECT. EL FOSFORO, SECT. EL LLANO, SECT. LA HACIENDA, SECT. LOS MERCADO, SECT. LOS MUnIZ, SECT. MONTADERO, SECT. PALMARITO, SECT. PRIETO, URB. KENNEDY",July 17 08:25',July 17 14:00',2001-2500,Scheduled Maintenance,Our power restoration team is onsite conducting critical repairs to restore power the area as quickly and safely as possible. 
SALINAS,"COMU. EL LOMO, COMU. RABO DEL BUEY, COMU. REPARTO EXTENSION DEL MONTE, PARC. VAZQUEZ, SECT. MATTEI, SECT. MONTE GRANDE, SECT. NARANJO",July 17 08:25',July 17 15:30',501-1000,Scheduled Maintenance,Our power restoration team is onsite conducting critical repairs to restore power the area as quickly and safely as possible. 
BARRANQUITAS,"EDU. ESCUELA FEDERICO DEGETAU, SECT. BEJUCO, SECT. CAnABON, SECT. CRUCE LA TIZA, SECT. LA CUCHILLA, SECT. LA TORRE, SECT. LOS MUnOZ, SECT. MOGOTE, URB. PASEOS DE TORRE ALTA, URB. VISTAS DE MONTECIELO, SECT. CHU VAZQUEZ, SECT. EL PUENTE, SECT. LA MEDICA",July 17 08:07',July 17 17:00',501-1000,Scheduled Maintenance,Our power restoration team is onsite conducting critical repairs to restore power the area as quickly and safely as possible. 
COROZAL,"SECT. MAVILLA, URB. EXTENSION MARIA DEL CARMEN, SECT. ARTURO MORALES, SECT. CUCHILLAS, SECT. CUCHILLAS PACHECO, SECT. LOS GUAYABOS, SECT. LOS QUILES, SECT. SICO MARTINEZ, COME. PLAZA AQUARIUM MALL, SECT. CHARRIEZ, SECT. LOMAS GARCIA, SECT. LOS SANCHEZ",July 17 07:00',July 17 17:00',1001-1500,Scheduled Maintenance,Our power restoration team is onsite conducting critical repairs to restore power the area as quickly and safely as possible. 
LAS PIEDRAS,"CMPA. HACIENDA 8A, EDU. ESCUELA LUIS MUnOZ RIVERA, PARC. BOQUERON, SECT. BERNARDO SOTO, SECT. CHENCHO FELIZ, SECT. COSME VAZQUEZ, SECT. EL BADEN, SECT. EL CERRITO, SECT. LAS TORRES, SECT. LOS CASTRO, SECT. LOS DAVILA, SECT. MONCHE SOTO, SECT. REPARTO AREN",July 17 06:40',July 17 18:00',>5000,Scheduled Maintenance,Our power restoration team is onsite conducting critical repairs to restore power the area as quickly and safely as possible. 
RINCON,"EDU. ESCUELA GREGORIO RODRIGUEZ ORAMA, EDU. ESCUELA JOSE GONZALES RUIZ, SECT. CABO DIAZ, SECT. CARLOS CONCEPCION, SECT. CARLOS RUIZ, SECT. CHELE FIGUEROA, SECT. CLOTILDE CHAPARRO, SECT. COLOMBANI, SECT. CORDERO, SECT. CUESTA BEATRIZ, SECT. CUEVA DEL INDIO",July 16 22:18',July 17 12:00',1001-1500,Unplanned,Our power restoration team is onsite conducting critical repairs to restore power the area as quickly and safely as possible. 