Municipality,Sector,Outage Reported,Estimated Time of Restoration,Estimated Customers Impacted,Category,Current Status
RIO GRANDE,"PARC. CAROLA, SECT. MABI, SECT. MUnIZ MUnIZ, SECT. PALMER. COME. RIO GRANDE ESTATES SHOPPING CENTER, COMU. VILLAS REALIDAD, COND. RIO GRANDE ESTATES, COND. TRUMO FOUNDERS RESIDENCES, HTL. EL RIO, HTL. LAS PALMAS, SECT. EL VERDE, SECT. HACIENDA LAS GARZAS, SECT. JUAN GONZALEZ, SECT. LAS TRES T, SECT. MUnIZ MUnIZ, URB. COCO BEACH, URB. COLINAS LAS TRES T, URB. COSTA DEL SOL, URB. HACIENDA JIMENEZ, URB. LOS ARBOLES, URB. MANSIONES DE HACIENDA JIMENEZ, URB. RIO GRANDE ESTATES, URB. RIO GRANDE ESTATES 2, URB. RIO GRANDE ESTATES 3, URB. RIO GRANDE ESTATES 5, URB. VILLAS DE VIZCAY, URB. VILLAS DE VIZCAY I COME. RIO GRANDE ESTATES SHOPPING CENTER, COMU. VIETNAM, PARC. CAROLA, SECT. CAROLA, SECT. JUAN GONZALEZ, URB. ESTANCIAS DEL MADRIGAL, URB. MIRADOR DE PALMER , URB. MIRADOR DE PALMER 2, URB. RIO GRANDE ESTATES 3, URB. RIO GRANDE ESTATES 4",May 19 11:00',May 19 17:00',4001-4500,Unplanned,Our local power restoration team is being dispatched to the area as soon as possible. 
SAN JUAN,"SUPERINTENDENCIA DEL CAPITOLIO, NATIONAL GUARD MUSEO",May 19 10:00',May 19 19:00',<500,Scheduled Maintenance,Our power restoration team is onsite conducting critical repairs to restore power the area as quickly and safely as possible. 
,      TRAMO-BARCELONETA - RADIAL,May 19 02:00',May 19 14:00',<500,Unplanned,Our local power restoration team is being dispatched to the area as soon as possible. 
,    TRAMO DE BARCELONETA T.C. - FACTOR SECT.,May 17 15:30',May 19 21:00',<500,Unplanned,Our power restoration team is onsite conducting critical repairs to restore power the area as quickly and safely as possible.
,MAYAGUEZ-MORA-CAMBALACHE ,May 07 21:36',June 03 18:00',<500,Unknown,Our power restoration team is onsite conducting critical repairs to restore power the area as quickly and safely as possible.