Municipality,Sector,Outage Reported,Estimated Time of Restoration,Estimated Customers Impacted,Category,Current Status
,TRAMO > MAYAGUEZ PLANTA > ACACIA,February 25 17:20',February 25 22:00',<500,Unplanned,"LUMA has successfully completed repairs and restored power to the area. If you have any questions, please contact us at 1-844-888-5862 (LUMA). "
ARECIBO,"CMPD. COLISEO MUNICIPAL, COM. EL BUEN CAFE, PARC. CARRIZALES, RES. RESIDENCIAL PUERTA DEL MAR, RES. RESIDENCIAL VILLA DEL MAR, RES. RESIDENCIAL VILLA ESPERANZA, SECT. MANSIONES TOLEDO, SECT. QUInONES, URB. ALTURAS DE HATILLO, URB. BRISAS DEL ATLANTICO, UR",February 25 17:20',February 25 20:00',<500,Unplanned,"LUMA has successfully completed repairs and restored power to the area. If you have any questions, please contact us at 1-844-888-5862 (LUMA). "
CIDRA,"COME. PLAZA CIDRA, COMU. CERTENEJAS 1, PARC. GANDARA 1, PARC. GANDARA 2, SECT. CERTENEJAS 1, SECT. LA PALOMA, SECT. LA PENINSULA, URB. CAMPO LAGO, URB. VISTA MONTE",February 25 14:30',February 25 19:00',501-1000,Unplanned,"LUMA has successfully completed repairs and restored power to the area. If you have any questions, please contact us at 1-844-888-5862 (LUMA). "
,    TRAMO ENTRE YAUCO 2 - ACB 1237,February 25 13:50',February 26 12:00',<500,Unplanned,Our power restoration team is onsite conducting critical repairs to restore power the area as quickly and safely as possible.
PONCE,"SECT. AJI, SECT. BARRIO ALGARROBO, SECT. CAMINO VIEJO, SECT. FACIO, SECT. LA JURADA, SECT. LA MONTAnA, SECT. LA URSULA, SECT. SANTA CLARA, SECT. VEGA",February 25 06:06',February 25 19:30',<500,Scheduled Maintenance,Our power restoration team is onsite conducting critical repairs to restore power the area as quickly and safely as possible. 