Municipality,Sector,Outage Reported,Estimated Time of Restoration,Estimated Customers Impacted,Category,Current Status
,BUS VENEZUELA,April 15 07:53',April 15 16:00',1001-1500,Unplanned,"LUMA has successfully completed repairs and restored power to the area. If you have any questions, please contact us at 1-844-888-5862 (LUMA). "
,VILLA PRADES - CAPUCHINO,April 15 07:53',April 15 17:00',1001-1500,Unplanned,Our local power restoration team is being dispatched to the area as soon as possible. 
,MTC - SABANA LLANA,April 15 06:08',April 15 18:00',501-1000,Unplanned,Our local power restoration team is being dispatched to the area as soon as possible. 
TOA BAJA,"CMPG. PARQUE DE LAS CIENCIAS, COME. CANTON MALL, COME. PLAZA DEL SOL, COME. PLAZOLETA DEL CANTON, COND. SIERRA BAYAMON APARTMENTS, COND. SIERRA BAYAMON APARTMENTS 750, EDU. ESCUELA INTERMEDIA CACIQUE AGUEYBANA, RES. RESIDENCIAL SIERRA BAYAMON APARTMENTS, ",April 15 05:45',April 15 14:00',1501-2000,Unplanned,Our power restoration team is onsite conducting critical repairs to restore power the area as quickly and safely as possible. 
,"MIRADOR >HATILLO  SUB 8013 SECT. BARRANCAS, SECT. LAS CANELAS, SECT. LOS MORA, URB. CIUDAD ATLANTIS, COME. PLAZA DEL NORTE SHOPPING CENTER, PARC. CARRIZALES, PARC. CARRIZALES 2, SECT. BETANCOURT, SECT. VIETNAM, SECT. VILLA GARCIA, URB. COLINAS DEL NORTE, URB. ESTANCIAS DE PALMA GORDA, URB. GARDEN VIEW, URB. LAS CUMBRES, CMPD. COLISEO MUNICIPAL, COM. EL BUEN CAFE, PARC. CARRIZALES, RES. RESIDENCIAL PUERTA DEL MAR, RES. RESIDENCIAL VILLA DEL MAR, RES. RESIDENCIAL VILLA ESPERANZA, SECT. MANSIONES TOLEDO, SECT. QUInONES, URB. ALTURAS DE HATILLO, URB. BRISAS DEL ATLANTICO, URB. CORALES, URB. COSTA NORTE, URB. ESTANCIAS DE CARRIZALES, URB. LAS PALMAS, URB. LAS PRADERAS, URB. MONTEMAR, URB. VALLE VERDE, URB. VILLA BONITA, COM. ARECIBO CINEMA, SECT. LAS CANELAS, SECT. SAN DANIEL , URB. ALTURAS DE SAN DANIEL, URB. REPARTO SAN MIGUEL, COM. BANCO VILBAO VIZCAYA, COME. PLAZA DEL NORTE SHOPPING CENTER, COM. TOYS'R'US PLAZA DEL NORTE, CALLE TRUNCADO, SAN DANIEL",April 14 20:00',April 15 12:00',<500,Unplanned,Our power restoration team is onsite conducting critical repairs to restore power the area as quickly and safely as possible.
SAN JUAN,"CMPE. UNIVERSIDAD DE PUERTO RICO RECINTO RIO PIEDRAS, COME. 65 DE INFANTERIA SHOPPING CENTER, COND. VICTORIA APARTMENTS, EDU. COLEGIO SAN ANTONIO, IGL. IGLESIA, IGL. IGLESIA CATOLICA APOSTOLICA Y ROMANA EN PR, IGL. IGLESIA PARROQUIA NUESTRA SEnORA DEL PIL",April 13 19:20',April 15 23:00',<500,Unplanned,Our power restoration team is onsite conducting critical repairs to restore power the area as quickly and safely as possible. 
,MORA TC - ISABELA TC,April 13 13:00',April 15 23:00',<500,Unknown,Our power restoration team is onsite conducting critical repairs to restore power the area as quickly and safely as possible.