Municipality,Sector,Outage Reported,Estimated Time of Restoration,Estimated Customers Impacted,Category,Current Status
CAMUY,"EDU. ESCUELA ELEMENTAL PEDRO AMADOR, SECT. ESTANCIAS SAN JOSE, SECT. LA PRA, SECT. LOS CORDEROS, SECT. LOS MENDEZ, SECT. PALMARITO, URB. CAMPO MAR, URB. COLINAS DEL MAR, URB. ESTANCIAS DE MEMBRILLO, URB. ESTANCIAS DE MEMBRILLO 2, URB. JARDINES DE CAMUY, U",September 14 20:19',September 15 02:00',1001-1500,Unplanned,"LUMA has successfully completed repairs and restored power to the area. If you have any questions, please contact us at 1-844-888-5862 (LUMA). "
SAN JUAN,"CMPD. FRAIGCOMAR, CMPG. AUTORIDAD METROPOLITANA DE AUTOBUSES, FGM. DEFENSA CIVIL MUNICIPAL, IND. URBANIZACION INDUSTRIAL EL CINCO, RES. RESIDENCIAL LAS AMAPOLAS, RES. RESIDENCIAL SAN FERNANDO, URB. ALTURAS DE SANTA MARIA, URB. BELISA, URB. CARIBE, URB. CH",September 14 18:37',September 14 23:00',<500,Unplanned,"LUMA has successfully completed repairs and restored power to the area. If you have any questions, please contact us at 1-844-888-5862 (LUMA). "
TOA BAJA,"COND. PRIMAVERA APARTMENTS, IND. URBANIZACION INDUSTRIAL CORUJO, URB. QUINTAS DEL NORTE, COM. TOYOTA DE PUERTO RICO, COMU. CANDELARIA ARENAS, COMU. VILLA DAVILA, IGL. IGLESIA CRISTIANA DISCIPULOS DE CRISTO, SECT. MARIA LACEN, SECT. REPARTO ANAMAR, URB. EL",September 14 16:11',September 14 21:00',4001-4500,Unplanned,"LUMA has successfully completed repairs and restored power to the area. If you have any questions, please contact us at 1-844-888-5862 (LUMA). "
,JOBOS - HORIZON ,September 14 14:27',September 14 23:00',<500,Unplanned,"LUMA has successfully completed repairs and restored power to the area. If you have any questions, please contact us at 1-844-888-5862 (LUMA). "
CABO ROJO,"CAMINO EL BRUJO, CARR 312, CABO ROJO",September 14 10:25',September 14 21:00',501-1000,Scheduled Maintenance,"LUMA has successfully completed repairs and restored power to the area. If you have any questions, please contact us at 1-844-888-5862 (LUMA). "