Municipality,Sector,Outage Reported,Estimated Time of Restoration,Estimated Customers Impacted,Category,Current Status
,,,,,,
NARANJITO,"EDU. ESCUELA ROSA LUZ ZAYAS, SECT. CAMINO MERO MORALES, SECT. CAMINO TOnO NIEVES, SECT. CASCO URBANO, SECT. EL BLANCO, SECT. EL BRONCO, SECT. EL CERRO, SECT. EL PALMAR, SECT. FEIJO, SECT. FERRER, SECT. HIGUILLALES, SECT. LA MAYA, SECT. LAS CRUCES, SECT. L",October 03 09:00',October 03 18:00',2501-3000,Scheduled Maintenance,"LUMA has successfully completed repairs and restored power to the area. If you have any questions, please contact us at 1-844-888-5862 (LUMA). "
SAN JUAN,"CMPC. CORPORATE OFFICE PARK, CMPG. ESTACION SAN FRANCISCO DEL TREN URBANO, COM. GASOLINERA TOTAL EXCELLIUM, COM. NATIONAL LUMBER &amp; HARDWARE, COM. SUIZA DAIRY, COM. TREN URBANO MARTINEZ NADAL, EDU. ESCUELA ANA ROQUE DE DUPREY, HOSP. METROPOLITANO, IGL.",October 03 07:57',October 03 18:00',1501-2000,Scheduled Maintenance,"LUMA has successfully completed repairs and restored power to the area. If you have any questions, please contact us at 1-844-888-5862 (LUMA). "
, San GermAn TC – ACB 1219A,September 30 13:39',October 04 16:00',<500,Unplanned,Our power restoration team is onsite conducting critical repairs to restore power the area as quickly and safely as possible.
,,,,,,
SAN JUAN,"COM. BANCO POPULAR DE PUERTO RICO, COM. SAGRADO CORAZON, EDU. ESCUELA ELEMENTAL CARMEN SANABRIA DE FIGUEROA, URB. ESTANCIAS DE SAN GERARDO, URB. NOSTALGIA DE SAN GERARDO, URB. SAGRADO CORAZON, URB. SAN GERARDO",October 03 11:15',October 03 20:00',<500,Unplanned,Our power restoration team is onsite conducting critical repairs to restore power the area as quickly and safely as possible. 
COROZAL,"COMU. GUARICO, PARC. MEDINA, SECT. BRUGUERA, SECT. GUARICO, SECT. JULIAN MARRERO, SECT. LOS GUARDIAS, SECT. LOS LLANOS, SECT. PANCHO FEBUS, SECT. POMITO, SECT. TONO PATENTE, URB. ESTANCIAS DE PALMAREJO, URB. MONTERREY",October 03 07:00',October 03 20:00',<500,Scheduled Maintenance,Our power restoration team is onsite conducting critical repairs to restore power the area as quickly and safely as possible. 