Municipality,Sector,Outage Reported,Estimated Time of Restoration,Estimated Customers Impacted,Category,Current Status
,,,,,,
SAN SEBASTIAN,"EDU. ESCUELA JULIO BABILONIA, SECT. BARRETO HERNANDEZ, SECT. BOSQUES, SECT. SABANA, SECT. SAN LORENZO, SECT. SEGUI, EDU. ESCUELA NARCISO RABELL CABRERO, SECT. AGAPITO ROSADO, SECT. BEJUCO, SECT. GELO RAMOS, SECT. LABERINTO, SECT. LA PIEDRA, SECT. LA VEGA,",December 20 09:39',December 20 18:00',>5000,Scheduled Maintenance,Our power restoration team is onsite conducting critical repairs to restore power the area as quickly and safely as possible. 
MARICAO,"EDU. ESCUELA INTERMEDIA RAUL IBARRA, FGM. ALCALDIA DE MARICAO, HTL. PARADOR HACIENDA JUANITA, RES. RESIDENCIAL COLINAS DE MARICAO, RES. RESIDENCIAL JUAN FERRER, SECT. ALERTA, SECT. CASCO URBANO, SECT. CUCHILLAS, SECT. CUESTA MARIN, SECT. EL FLAMBOYAN, SEC",December 20 09:00',December 20 18:00',1001-1500,Scheduled Maintenance,Our power restoration team is onsite conducting critical repairs to restore power the area as quickly and safely as possible. 
SAN JUAN,"COME. CENTRO COMERCIAL CONCORDIA GARDENS, COND. TOWN HOUSES, EDIF. CARIBBEAN SIGN SUPPLY, PARC. HILL BROTHERS, PARC. HILL BROTHERS SUR, SECT. LOS PEnA, URB. EXTENSION TOWN PARK, URB. GONZALEZ SEIJO, URB. VILLA CAPRI, URB. VILLA NAVARRA, URB. VILLA ROSALES",December 20 08:53',December 20 18:00',<500,Scheduled Maintenance,Our power restoration team is onsite conducting critical repairs to restore power the area as quickly and safely as possible. 
COROZAL,"BDA. ALDEA VAZQUEZ, SECT. LA MINA, SECT. MARRERO, SECT. ROLO BARRERA, URB. ALTURAS DE CIBUCO, URB. CIBUCO, URB. COLINAS DE COROZAL, URB. ESTANCIAS DE CIBUCO, URB. EXTENSION SILVIA, URB. LOMA LINDA, URB. LOS PROCERES, URB. SAN FELIZ, URB. SILVIA, URB. SOBR",December 20 08:30',December 20 19:00',>5000,Scheduled Maintenance,Our power restoration team is onsite conducting critical repairs to restore power the area as quickly and safely as possible. 
YABUCOA,"EDU. ESCUELA MARTA SANCHEZ, PARC. PLAYITA, SECT. QUEBRADILLAS, URB. JAIME C. RODRIGUEZ, URB. SANTA MARIA, CEM. CEMENTERIO REPARTO HORIZONTE YABUCOA, EDU. ESCUELA JUAN B. HUYKE, EDU. ESCUELA LOS COLEGIOS, FGE. ESTACION DE BOMBEROS DE YABUCOA, HOSP. HOSPITA",December 20 06:06',December 20 19:00',>5000,Scheduled Maintenance,Our power restoration team is onsite conducting critical repairs to restore power the area as quickly and safely as possible. 
TRUJILLO ALTO,"COMU. SAINT JUST, COMU. MATIENZO CINTRON, SECT. BETANIA, SECT. LAS CRUCES, SECT. MARQUEZ, URB. EXTENSION ROUND HILLS, URB. NUESTRA SEnORA DE LOURDES, URB. ROUND HILLS, URB. ROUND HILLS COURTS, URB. WONDERVILLE",December 20 06:06',December 20 18:00',<500,Scheduled Maintenance,Our power restoration team is onsite conducting critical repairs to restore power the area as quickly and safely as possible. 