Municipality,Sector,Outage Reported,Estimated Time of Restoration,Estimated Customers Impacted,Category,Current Status
,TRAMO DE PUERTA DE TIERRAS -COVADONGA GIS,March 12 10:39',April 14 18:00',<500,Unplanned,Our power restoration team is onsite conducting critical repairs to restore power the area as quickly and safely as possible.
LAS MARIAS,"COMU. ACEVEDO, COMU. GUILLERMO MARTINEZ, COMU. REPARTO SANTALIZ, COMU. SANTA ROSA, PARC. LAVERGNE, PARC. SANTA ROSA, SECT. EL LLANO, SECT. LA GUAJANA, SECT. LAS JUANITAS, SECT. LOS VEGA, SECT. PEPE TRABAL, SECT. SECTOR CALLE PALMER, URB. ESTANCIAS DE SANT",April 05 10:18',April 05 19:00',1501-2000,Scheduled Maintenance,Our power restoration team is onsite conducting critical repairs to restore power the area as quickly and safely as possible. 
PONCE,"BDA. CLAUSELLS, BDA. FERRAN, BDA. LOS CHINOS, BDA. TAMARINDO, CEM. CEMENTERIO CIVIL DE PONCE, EDU. ESCUELA FRANCISCO PARRA, EDU. ESCUELA THOMAS ARMSTRONG, RES. RESIDENCIAL SANTIAGO IGLESIAS, SECT. CASCO URBANO, URB. EXTENSION MORELL CAMPOS, URB. MORELL CA",April 05 10:11',April 05 17:30',501-1000,Scheduled Maintenance,Our power restoration team is onsite conducting critical repairs to restore power the area as quickly and safely as possible. 
AGUADILLA,"CMPA. BORINQUEN GOLF CLUB, EDU. ESCUELA FRIEDRICH FROEBEL BILINGUAL SCHOOL, SECT. LOS CIRCULOS, URB. LAS VILLAS, URB. BASE RAMEY , URB. BASE RAMEY , URB. BASE RAMEY , URB. BASE RAMEY , CMPG. COAST GUARD, COME. PUNTA BORINQUEN SHOPPING CENTER, EDU. RAMEY S",April 05 09:11',April 05 17:00',501-1000,Scheduled Maintenance,Our power restoration team is onsite conducting critical repairs to restore power the area as quickly and safely as possible. 
PONCE,"COME. PLAZA LAS MONJITAS, SECT. LAS CANITAS, SECT. VILLA DOS RIOS, URB. ALTURAS DE JACARANDA, URB. EL MONTE, URB. GLENVIEW GARDENS, URB. JACARANDA, URB. LAS MONJITAS, URB. QUINTAS DE MONSERRATE, URB. VISTA POINT",April 05 08:41',April 05 17:30',1001-1500,Scheduled Maintenance,Our power restoration team is onsite conducting critical repairs to restore power the area as quickly and safely as possible. 
NARANJITO,"SECT. POMITO, CEM. CEMENTERIO MUNICIPAL DE NARANJITO, EDU. ESCUELA ELEMENTAL JOSEFINA MARRERO FEBUS, EDU. ESCUELA FIDEL G. PADILLA, EDU. ESCUELA MERCEDES ROSADO, RES. RESIDENCIAL CANDELARIO TORRES, SECT. ARTURO MORALES, SECT. CAMINO CHANGO VAZQUEZ, SECT. ",April 05 07:14',April 05 17:00',<500,Scheduled Maintenance,Our power restoration team is onsite conducting critical repairs to restore power the area as quickly and safely as possible. 
GUAYNABO,"EDU. WESLEYAN ACADEMY, RES. RESIDENCIAL RAFAEL MARTINEZ NADAL, SECT. MELIA, URB. EL ALAMO, URB. PARKVILLE, URB. VILLA AVILA, URB. VILLA CLEMENTINA, URB. ALTURAS DE SANTA MARIA, URB. COLLEGEVILLE, URB. MALLORCA, URB. SAN RAMON",April 05 07:14',April 05 17:00',<500,Scheduled Maintenance,Our power restoration team is onsite conducting critical repairs to restore power the area as quickly and safely as possible. 
,MANATI TC - VEGA BAJA TC ,April 04 22:08',April 05 17:00',<500,3rd Party Damage,Our local power restoration team is being dispatched to the area as soon as possible. 
MAYAGUEZ,"COND. EL CASTILLO, COND. VILLAS CENTROAMERICANAS, IND. ZONA INDUSTRIAL, SECT. CALLE LOS INGENIEROS, SECT. CALLE PERPETUO SOCORRO, SECT. CAMINO CRISTO DE LOS MILAGROS, SECT. EL SECO, SECT. PITILLO, URB. ALTURAS DE MAYAGUEZ, URB. JARDINES DEL OBISPADO, URB.",April 04 18:28',April 05 18:00',501-1000,Unplanned,Our power restoration team is onsite conducting critical repairs to restore power the area as quickly and safely as possible. 