Municipality,Sector,Outage Reported,Estimated Time of Restoration,Estimated Customers Impacted,Category,Current Status
GUAYAMA,"BDA. MOSQUITO, CMPG. COMPLEJO CORRECCIONAL DE GUAYAMA, COMU. BARRANCA, COMU. MIRAMAR, COMU. NUEVO AMANECER, COMU. POZUELO, COMU. SAN MARTIN, COMU. SANTA ANA, COND. EL LEGADO CHICHI RODRIGUEZ GOLF RESORT, EDU. ESCUELA JOSE MUnOZ VAZQUEZ, IND. PLANTA DE HOR",February 26 14:15',February 26 20:00',4001-4500,Unplanned,Our power restoration team is onsite conducting critical repairs to restore power the area as quickly and safely as possible. 
SAN JUAN,"COND. LUISA 55, COND. PICCIONI 1125, COND. VENETIAN TOWER. COND. WASHINGTON 111, COND. WILSON 1223, COND. WILSON 1314, SECT. CAMPO ALEGRE, SECT. CONDADITO, SECT. ALTO DEL CABRO, SECT. CAMPO ALEGRE, BDA. FIGUEROA, COND. DUFFAUTT 271, COND. METRO PLAZA TOWERS, DOT. ESTACION DE TRANSFORMADORES MINILLAS, SECT. CAMPO ALEGRE, SECT. CONDADITO, SECT. HIPODROMO",February 26 11:00',February 26 17:00',2001-2500,Unplanned,Our power restoration team is onsite conducting critical repairs to restore power the area as quickly and safely as possible. 
SAN JUAN,"COND. MIRAMAR 609, IND. ISLA GRANDE, SECT. PUERTA DE TIERRA",February 26 09:40',February 26 16:00',501-1000,Unplanned,Our power restoration team is onsite conducting critical repairs to restore power the area as quickly and safely as possible. 
SANTA ISABEL,"PARC. JAUCA NUEVAS, PARC. JAUCA VIEJAS, SECT. CANTA SAPO, SECT. CASCO URBANO, SECT. EL MONTE, SECT. LA FLORIDA, SECT. LA PLAYA DE JAUCA, SECT. PLAYA TEXIDOR, SECT. YERVA DURA, URB. ALBORADA PARK, URB. LA HACIENDA, URB. VILLA JAUCA",February 26 07:25',February 26 17:00',<500,Scheduled Maintenance,Our power restoration team is onsite conducting critical repairs to restore power the area as quickly and safely as possible. 
,    TRAMO ENTRE YAUCO 2 - ACB 1237,February 25 13:50',February 26 16:00',<500,Unplanned,Our local power restoration team is being dispatched to the area as soon as possible. 