Municipality,Sector,Outage Reported,Estimated Time of Restoration,Estimated Customers Impacted,Category,Current Status
TOA ALTA,"CMPR. LOS PALACIOS, COND. PALACIOS DE VERSALLES, COND. VEREDAS DE LA REINA, RES. RESIDENCIAL MIRADOR DEL TOA, RES. RESIDENCIAL TORRES DEL PLATA 1, RES. RESIDENCIAL TORRES DEL PLATA 2, SECT. LA CAMPINA, SECT. LAS LOMAS, SECT. LOS RODRIGUEZ, SECT. PARCELAS ",July 22 15:20',July 22 21:00',3501-4000,Unplanned,"LUMA has successfully completed repairs and restored power to the area. If you have any questions, please contact us at 1-844-888-5862 (LUMA). "
VEGA ALTA,"COMU. LOS PUERTOS, EDU. ESCUELA ELEMENTAL ECOLOGICA, PARC. EL COTTO, SECT. COTTO MARTELL, SECT. LA ALDEA, SECT. LA POZA, SECT. LA PRA, SECT. MAYSONET 1, SECT. MAYSONET 2, URB. PAISAJES DE DORADO, CEM. MAUSOLEO MUNICIPAL DE VEGA ALTA, COMU. MONTE REY, COND",July 22 13:40',July 22 18:00',1001-1500,Unplanned,"LUMA has successfully completed repairs and restored power to the area. If you have any questions, please contact us at 1-844-888-5862 (LUMA). "
GUANICA,"BDA. ESPERANZA, COMU. BELGICA, COMU. EXTENSION ALTURAS DE BELGICA , COMU. EXTENSION BELGICA , COMU. FRATERNIDAD, COMU. LA MAFAFA, COMU. MARIA ANTONIA, COMU. SANTA JUANITA, COMU. SANTA RITA, COND. PITIRRE, PARC. ARENA, RES. RESIDENCIAL JARDINES DE GUANICA,",July 22 09:00',July 22 18:00',<500,Scheduled Maintenance,"LUMA has successfully completed repairs and restored power to the area. If you have any questions, please contact us at 1-844-888-5862 (LUMA). "
JAYUYA,"COMU. MARQUEZ, COMU. SANTA CLARA, SECT. HOYO FRIO, SECT. LA SALSA, SECT. LOS AJOS, SECT. VISTA ALEGRE, URB. ALTURAS DE JAYUYA, URB. JARDINES DE JAYUYA, PARC. ISOLINA",July 22 15:40',July 22 21:00',1001-1500,Unplanned,Our local power restoration team is being dispatched to the area as soon as possible. 
CAGUAS,"EDU.ESCUELA LUIS MUnOZ GRILLO, PARC. JURADO, PARC. MUnOZ GRILLO, SECT. LAS PInAS, SECT. LOS ORTIZ, URB. ALTURAS DE BEATRIZ, SECT. LAS CRUCES, SECT. REPARTO MARITZA",July 22 14:30',July 22 20:00',1501-2000,Unplanned,Our local power restoration team is being dispatched to the area as soon as possible. 
SAN JUAN,"URB. CROWN HILLS, URB. PARADISE HILLS, URB. RIO PIEDRAS HEIGHTS",July 22 12:40',July 22 18:00',<500,Scheduled Maintenance,Our power restoration team is onsite conducting critical repairs to restore power the area as quickly and safely as possible. 
SAN JUAN,"URB. CAPARRA HEIGHTS, URB. PUERTO NUEVO, URB. VILLA BORINQUEN, COME. CAPARRA SHOPPING CENTER, IND. MARIO JULIA, URB. PARQUE SAN PATRICIO, COM. FRIVOLA, COM. FULLER STORE, COM. GASOLINERA TOTAL EXCELLIUM, COM. GO PRINT, COM. MESA 364, COM. MIRANDA &amp; SO",July 22 11:50',July 22 17:00',501-1000,Unplanned,Our power restoration team is onsite conducting critical repairs to restore power the area as quickly and safely as possible. 
SAN JUAN,"COME. 65 DE INFANTERIA SHOPPING COURT, COME. VILLA PRADES SHOPPING CENTER, COND. CHALETS DE PARAISO, COND. LAGUNA VIEW TOWERS 1, COND. LAS CAMELIAS, COND. PORTAL DE LA REINA, COND. VALLES DEL PARAISO, COND. VILLAS DE MONTE CARLO, EDIF. STELLA PEREZ CELIA,",July 22 11:30',July 22 17:00',2501-3000,Unplanned,Our power restoration team is onsite conducting critical repairs to restore power the area as quickly and safely as possible. 
,         TRAMO DE MANATI TC - COSTA SUR,July 21 13:10',July 22 23:00',<500,Unplanned,Our power restoration team is onsite conducting critical repairs to restore power the area as quickly and safely as possible. 