Municipality,Sector,Outage Reported,Estimated Time of Restoration,Estimated Customers Impacted,Category,Current Status
SAN JUAN,"IND. AREA INDUSTRIAL RIO CAnAS, SECT. BARRANCO, SECT. BAYAMONESA, SECT. LA CHANGA, SECT. LA PONDEROSA, URB. QUINTAS DE LAS AMERICAS, URB. SAN PEDRO ESTATES, SECT. GUELE PEREZ, SECT. LOS NUnEZ, URB. CAMINOS DEL BOSQUE, URB. LADERAS DE SAN JUAN",November 22 20:15',November 22 23:00',2501-3000,Unplanned,Our local power restoration team is being dispatched to the area as soon as possible. 
SALINAS,"COMU. GONZALEZ, HTL. MOTEL VILLAS DEL ABEY, HTL. VILLAS DEL HABEY, IND. CENTRAL TERMOELECTRICA DEL CARIBE, IND. HACIENDA YASMIN, PARC. EL COCO, SECT. BRISAS DE SALINAS, SECT. COLONIA ESPERANZA, SECT. JULIA, SECT. LANAUSSE, URB. ESTANCIAS LAS TRINITARIAS ,",November 22 18:40',November 22 23:00',<500,Unplanned,Our power restoration team is onsite conducting critical repairs to restore power the area as quickly and safely as possible. 
TOA BAJA,"URB. DOS RIOS, URB. MANSION DEL NORTE, URB. MANSION DEL SUR, COME. LOS DOMINICOS SHOPPING CENTER, COM. FLOR DE MAYO, COND. CENTURY GARDENS, COND. PASEO ABRIL, COND. PASEO RIO HONDO, EDU. PRIMER CENTRO EDUCATIVO LAICO DE LEVITTOWN , URB. EL NARANJAL, URB. ",November 22 17:45',November 22 23:00',1501-2000,Unplanned,Our power restoration team is onsite conducting critical repairs to restore power the area as quickly and safely as possible. 
,"    TRAMO GAUTIER BENITEZ-VILLAS DE CASTRO URB. PARQUE LAS MERCEDES, COND. LAS VISTAS DE GURABO, EDU. ESCUELA SEGUNDA UNIDAD VIDAL SERRANO, PARC. NAVARRO, SECT. CIELITO, SECT. FLORES, SECT. LA PACHANGA, SECT. LOS BEZARES, SECT. LOS FLAMBOYANES, SECT. LOS PINOS, URB. COLINAS DE NAVARRO, URB. ESTANCIAS SIERVAS DE MARIA, SECT. BRUCELES, SECT. LOS BEZARES, SECT. LOS GOMEZ, SECT. EL CINCO, SECT. LA LOMA, SECT. LOS CLAUDIO, SECT. LOS MULEROS, SECT. TOMAS DE CASTRO 2, EDU. ESCUELA EL PARQUE, PARC. HATO, SECT. LA SAMARITANA, SECT. LOS BUXO, SECT. LOS MONTAnEZ, SECT. LOS SANCHEZ, SECT. ZAVALA, URB. EL PARQUE, URB. HACIENDAS DE SAN LORENZO, URB. MANSIONES DE MONTE SERENO, URB. PARQUE INDUSTRIAL APONTE, URB. PORTAL DEL SOL, URB. VILLAS DEL HATO, DOT. RIO TURABO, PARC. TOMAS DE CASTRO 1, PARC. TOMAS DE CASTRO 2, SECT. HACIENDAS DEL REY, SECT. LOS ADORNO, SECT. LOS MONTAnESES, SECT. LOS ROBLES, SECT. LOS SOLA, SECT. LOS VELEZ, SECT. MACANEA, SECT. PALMERAS, SECT. TAMARINDO, SECT. TOMAS DE CASTRO 1, SECT. TOMAS DE CASTRO 2, SECT. VALLE HERMOSO, SECT. VILLA CARInO, URB. JOSE MERCADO, URB. PARQUE LAS MERCEDES, URB. VILLA BORINQUEN, URB. VILLAS DE CASTRO, COND. VILLAS DE CASTRO GARDENS APARTMENTS, URB. ALTURAS DEL TURABO, URB. SAN RAFAEL",November 22 12:25',November 22 21:00',<500,3rd Party Damage,Our local power restoration team is being dispatched to the area as soon as possible. 
,CATAnO A AMELIA ,November 22 07:03',November 22 21:00',<500,Unplanned,Our power restoration team is onsite conducting critical repairs to restore power the area as quickly and safely as possible. 