Municipality,Sector,Outage Reported,Estimated Time of Restoration,Estimated Customers Impacted,Category,Current Status
PEÑUELAS,"SECT. FORNES, SECT. LOS PEREZ, SECT. MARTILLO",June 11 06:14',June 11 18:00',<500,Scheduled Maintenance,"LUMA has successfully completed repairs and restored power to the area. If you have any questions, please contact us at 1-844-888-5862 (LUMA). "
SANTA ISABEL,"BDA. MONSERRATE, BDA. SAN FELIPE, COMU. PLAYA, SECT. CASCO URBANO, SECT. VILLA DEL MAR , URB. SAN MIGUEL, URB. VILLA DEL CARIBE",June 11 18:35',June 11 23:00',501-1000,Unplanned,Our power restoration team is onsite conducting critical repairs to restore power the area as quickly and safely as possible.
SAN LORENZO,"COME. PLAZA BUXO, SECT. ARILL, SECT. ASIA, SECT. BEZARES, SECT. SALVATIERRA, SECT. LA REPRESA, SECT. LOS ALVERIOS, SECT. LOS CARRASQUILLO, SECT. LOS VELAZQUEZ, SECT. MARIA VALLEJO, SECT. MIGUEL SANCHEZ, SECT. OROSCO, SECT. RAFAEL COLON, SECT. RANCHO QUINT",June 11 12:44',June 11 18:00',>5000,Unplanned,Our power restoration team is onsite conducting critical repairs to restore power the area as quickly and safely as possible. 
SAN JUAN,"SECT. PAJILLAS, COND. BEVERLY HILLS COURT, COND. EGIDA ASOCIACION DE MIEMBROS DE LA POLICIA DE PUERTO RICO, COND. VISTA DE LOS FRAILES, EDU. ESCUELA ALEJANDRO JUNIOR CRUZ, PARC. LOPEZ CASES, SECT. ANTONIO GONZALEZ, SECT. CAMINO NUEVO HORIZONTE, SECT. CORE",June 11 09:11',June 11 18:00',1001-1500,Scheduled Maintenance,Our power restoration team is onsite conducting critical repairs to restore power the area as quickly and safely as possible. 
CAROLINA,"COND. RIO VISTA, COND. VEREDAS DEL RIO, IND. CAROLINA INDUSTRIAL PARK, IND. INDUSTRIAL VICTORIA, IND. LEDERLE INDUSTRIAL PARK, RES. RESIDENCIAL CATAnITO GARDENS, SECT. CASCO URBANO, URB. JARDINES DE CAROLINA, URB. JOSE SEVERO QUInONES, URB. LOMAS DE CAROL",June 10 15:08',June 11 19:00',<500,Unplanned,Our power restoration team is onsite conducting critical repairs to restore power the area as quickly and safely as possible. 
PEÑUELAS,"SECT. FORNES, SECT. LOS PEREZ, SECT. MARTILLO, EDU. ESCUELA FELIPE QUInONES, SECT. EL LLANO",June 05 10:00',June 11 23:00',<500,Unplanned,Our power restoration team is onsite conducting critical repairs to restore power the area as quickly and safely as possible.