Municipality,Sector,Outage Reported,Estimated Time of Restoration,Estimated Customers Impacted,Category,Current Status
,,,,,,
LAJAS,"EDU. JUAN CACIO ORTIZ DE LA RENTA, PARC. PALMAREJO 1, PARC. PALMAREJO 2, SECT. CERRO ALTO, SECT. CHRISTIAN, SECT. JOVILLOS, SECT. LA HAYA, SECT. LOS PARDOS, SECT. PAULINA MORALES, SECT. REPARTO VILLA CAROLINA, SECT. TOKIO, URB. RIVERA, SECT. QUEBRADA HOND",September 25 09:02',September 25 20:00',2001-2500,Unplanned,Our power restoration team is onsite conducting critical repairs to restore power the area as quickly and safely as possible. 
ARECIBO,"CEM. CEMENTERIO EL 3, CEM. CEMENTERIO LA SANTA CRUZ, COMU. NAVAS, SECT. COMBATE, SECT. CUNETAS, SECT. EL TRES, SECT. LA CEIBA, SECT. LOS MORA, URB. ALTAMIRA, URB. COLINAS DE VILLA TOLEDO, URB. EL MONTE, URB. EL PARAISO, URB. ESTANCIAS EL VERDE, URB. JARDI",September 25 09:02',September 25 16:00',1501-2000,Scheduled Maintenance,Our power restoration team is onsite conducting critical repairs to restore power the area as quickly and safely as possible. 
,,,,,,
,TRAMO YAHUECAS-ADJUNTAS  ,September 17 15:09',September 26 19:00',<500,Unplanned,Our power restoration team is onsite conducting critical repairs to restore power the area as quickly and safely as possible.