Municipality,Sector,Outage Reported,Estimated Time of Restoration,Estimated Customers Impacted,Category,Current Status
SAN JUAN,"CMPA. LOS PASEOS CLUB HOUSE, COM. CENTRO DE CONVECIONES LOS PASEOS, COND. CHURCHILL PARK, COND. COLINA REAL, COND. GARDEN VALLEY CLUB, COND. PARQUE EL SEnORIAL 251, COND. PASEO DEL BOSQUE, COND. PASEO DEL ROCIO, COND. PASEO MONTE, COND. VILLAS DEL SEnORIA",October 14 14:07',October 14 20:00',1001-1500,Unplanned,"LUMA has successfully completed repairs and restored power to the area. If you have any questions, please contact us at 1-844-888-5862 (LUMA). "
RINCON,"SECT. LAS CRUCES, SECT. LOS MANGOS, URB. ESTANCIA DE RIO GRANDE, URB. PALMA REAL",October 14 18:21',October 14 23:00',1001-1500,Unplanned,Our local power restoration team is being dispatched to the area as soon as possible. 
TOA ALTA,"CMPR. LOS PALACIOS, COND. PALACIOS DE VERSALLES, COND. VEREDAS DE LA REINA, RES. RESIDENCIAL MIRADOR DEL TOA, RES. RESIDENCIAL TORRES DEL PLATA 1, RES. RESIDENCIAL TORRES DEL PLATA 2, SECT. LA CAMPINA, SECT. LAS LOMAS, SECT. LOS RODRIGUEZ, SECT. PARCELAS ",October 14 17:49',October 14 23:00',3501-4000,Unplanned,Our local power restoration team is being dispatched to the area as soon as possible. 
,TRES MONJITAS - PUERTO NUEVO,October 14 16:53',October 14 20:00',<500,Unplanned,Our power restoration team is onsite conducting critical repairs to restore power the area as quickly and safely as possible. 
SAN JUAN,"COM. DYNAPHONE, COM. GASOLINERA PUMA, COM. GASOLINERA TOTAL EXCELLIUM, COM. JUAN PAN PIZZA, COM. NRC COMPUTER + SUPPLIES, COM. SPINNING, EDU. ESCUELA ELEMENTAL ISAAC GONZALEZ MARTINEZ, URB. CAPARRA TERRACE, URB. PUERTO NUEVO",October 14 16:16',October 14 22:00',501-1000,Unplanned,Our local power restoration team is being dispatched to the area as soon as possible. 
TOA ALTA,"CMPR. LOS PALACIOS, COND. PALACIOS DE VERSALLES, COND. VEREDAS DE LA REINA, RES. RESIDENCIAL MIRADOR DEL TOA, RES. RESIDENCIAL TORRES DEL PLATA 1, RES. RESIDENCIAL TORRES DEL PLATA 2, SECT. LA CAMPINA, SECT. LAS LOMAS, SECT. LOS RODRIGUEZ, SECT. PARCELAS ",October 14 15:40',October 14 21:00',3001-3500,Unplanned,Our local power restoration team is being dispatched to the area as soon as possible. 
AGUADA,"COMU. COMUNIDAD ESPECIAL CALLE SAN JOSE, SECT. CASCO URBANO, COMU. COMUNIDAD ESPECIAL CALLE SAN FRANCISCO, COMU. COMUNIDAD ESPECIAL CALLE SAN JOSE, RES. RESIDENCIAL FRANCISCO EGIPCIACO, RES. RESIDENCIAL LOS ROBLES, SECT. CASCO URBANO, SECT. JOSE CHEPE HER",October 14 09:00',October 14 20:00',>5000,Scheduled Maintenance,Our power restoration team is onsite conducting critical repairs to restore power the area as quickly and safely as possible. 
JUNCOS,"URB. JARDINES DE GURABO, SECT. CRISTOBAL CASUL, SECT. DON GEO GONZALEZ, SECT. PABLO HERNANDEZ, BDA. FLORES, CEM. CEMENTERIO MUNICIPAL VIEJO DE JUNCOS, RES. RESIDENCIAL ANTULIO LOPEZ FLECHA, RES. RESIDENCIAL NARCISO VARONA, SECT. CASCO URBANO, SECT. CUATRO",October 14 06:20',October 14 21:00',>5000,Scheduled Maintenance,Our power restoration team is onsite conducting critical repairs to restore power the area as quickly and safely as possible. 