Municipality,Sector,Outage Reported,Estimated Time of Restoration,Estimated Customers Impacted,Category,Current Status
YAUCO,"SECT. TROCHE, BDA. ARTURO LLUBERAS, BDA. GALARZA, COMU. EL CERRO, COND. BRISAS DE YAUCO, COND. MONTERREY APARTMENTS, EDU. ESCUELA SUPERIOR LOAIZA CORDERO DEL ROSARIO, PARC. LAS PELAS, RES. RESIDENCIAL MONT BLANC GARDENS, RES. RESIDENCIAL YAUCO HOUSING, SE",April 15 11:36',April 15 23:00',>5000,Unplanned,"LUMA has successfully completed repairs and restored power to the area. If you have any questions, please contact us at 1-844-888-5862 (LUMA). "
,MTC - SABANA LLANA,April 15 06:08',April 15 21:00',<500,Unplanned,"LUMA has successfully completed repairs and restored power to the area. If you have any questions, please contact us at 1-844-888-5862 (LUMA). "
QUEBRADILLAS,"EDU. ESCUELA SEGUNDA UNIDAD JOAQUIN VAZQUEZ CRUZ, EDU. ESCUELA VOCACIONAL AGRICOLA SOLLER, SECT. LOS ALAMEDA, SECT. LOS MENDEZ, SECT. LOS ROMANES, SECT. OCASIO, SECT. PARCELAS CIBAO, EDU. ESCUELA SEGUNDA UNIDAD EUGENIO MARIA DE HOSTOS, SECT. EL RIEGO, SEC",April 15 11:57',April 15 23:00',1001-1500,Unplanned,Our power restoration team is onsite conducting critical repairs to restore power the area as quickly and safely as possible. 
QUEBRADILLAS,SECT. EL CANAL,April 15 11:57',April 15 23:00',1001-1500,Unplanned,Our power restoration team is onsite conducting critical repairs to restore power the area as quickly and safely as possible. 
SAN JUAN,"CMPE. UNIVERSIDAD DE PUERTO RICO RECINTO RIO PIEDRAS, COME. 65 DE INFANTERIA SHOPPING CENTER, COND. VICTORIA APARTMENTS, EDU. COLEGIO SAN ANTONIO, IGL. IGLESIA, IGL. IGLESIA CATOLICA APOSTOLICA Y ROMANA EN PR, IGL. IGLESIA PARROQUIA NUESTRA SEnORA DEL PIL",April 13 19:20',April 16 23:00',<500,Unplanned,Our power restoration team is onsite conducting critical repairs to restore power the area as quickly and safely as possible.
,MORA TC - ISABELA TC,April 13 13:00',April 15 23:00',<500,Unknown,Our power restoration team is onsite conducting critical repairs to restore power the area as quickly and safely as possible. 