Municipality,Sector,Outage Reported,Estimated Time of Restoration,Estimated Customers Impacted,Category,Current Status
,"BAYVIEW A AMELIA COMU. AMELIA, COND. MIRADORES DE SABANA, EDU. ESCUELA LUIS MUnOZ RIVERA 1, EDU. ESCUELA LUIS MUnOZ RIVERA 2, IND. AMELIA INDUSTRIAL PARK, IND. CENTRO MERCANTIL, SECT. BARRIO SABANA, URB. VILLA ELSIE, SECT. CASCO URBANO, COMU. AMELIA, EDU. ESCUELA ROSALINA C. MARTINEZ, IND. CENTRO MERCANTIL, RES. RESIDENCIAL ZENON DIAZ VALCARCEL, SECT. JERUSALEM, URB. VILLA ELSIE, SECT. BARRIO SABANA, SECT. VIETNAM, URB. VILLA CONCEPCION 3, SECT. CASCO URBANO, SECT. LA PUNTILLA, COMU. AMELIA, URB. VILLA CONCEPCION 1, URB. VILLA CONCEPCION 2",June 12 15:33',June 12 23:00',<500,Unplanned,"LUMA has successfully completed repairs and restored power to the area. If you have any questions, please contact us at 1-844-888-5862 (LUMA). "
,"COM. EDICIONES SANTILLANA, COME. SAN PATRICIO PLAZA, COND. EL CORDOVES, COND. L'HERMITAGE, COND. PORTALES DE SAN PATRICIO, COND. SAN PATRICIO CHALETS, COND. THE VILLAGE, EDIF. TELEFONICA EMPRESAS, EDIF. TRIPLE-S PLAZA, URB. CAPARRA HILLS, URB. LOS CAOBOS, URB. PARKSIDE, URB. SAN PATRICIO, COM. BURGER KING, COM. GASOLINERA PUMA, COM. REFRICENTRO, URB. CAPARRA TERRACE, URB. LAS LOMAS, URB. SUMMIT HILLS, COND. MANSIONES DE GARDEN HILLS SUR, URB. GARDEN HILLS , URB. GARDEN HILLS ESTATES, URB. MANSIONES DE GARDEN HILLS, URB. VILLA CAPARRA, COME. ALTAMIRA SHOPPING CENTER, COND. CAMINO REAL, EDIF. POMPINA INVESTMENT, RES. RESIDENCIAL VILLA ESPAnA, URB. ALTAMIRA, COM. BASKIN-ROBBINS, COM. KENTUCKY FRIED CHICKEN, COM. PARTY CITY, COM. PIZZA HUT, COND. PLAZA ATHENEE, URB. ALTURAS DE SAN PATRICIO, URB. CAPARRA HILLS, URB. CAPARRA HILLS VILLAGE, CMPC. CORPORATE OFFICE PARK, CMPG. ESTACION SAN FRANCISCO DEL TREN URBANO, COM. GASOLINERA TOTAL EXCELLIUM, COM. NATIONAL LUMBER & HARDWARE, COM. SUIZA DAIRY, COM. TREN URBANO MARTINEZ NADAL, EDU. ESCUELA ANA ROQUE DE DUPREY, HOSP. METROPOLITANO, IGL. IGLESIA EVANGELICA MINISTERIO SANADOR, IGL. IGLESIA FUENTE DE SALVACION, RES. RESIDENCIAL SANTA ELENA, SECT. EL POLVORIN, SECT. TIERRA SANTA, URB. LA RIVIERA, URB. LAS LOMAS, URB. PARQUE MEDITERRANEO, URB. REPARTO LANDRAU, URB. SUMMIT HILLS",June 12 14:17',June 12 23:00',>5000,Unplanned,"LUMA has successfully completed repairs and restored power to the area. If you have any questions, please contact us at 1-844-888-5862 (LUMA). "
YABUCOA,"JACANAS, LIMONES, CAMINO NUEVO, JARDINES DE YABUCOA, VALLE DE YABUCOA, CENTRO COMERCIAL RALPHS, BPPR, WALGREENS, UNIVERSIDAD DEL TURABO",June 12 07:32',June 12 23:00',501-1000,Scheduled Maintenance,"LUMA has successfully completed repairs and restored power to the area. If you have any questions, please contact us at 1-844-888-5862 (LUMA). "
,TRAMO > AGUAS BUENAS GIS A HACIENDA SAN JOSE ,June 12 21:42',June 13 06:00',>5000,Unplanned,Our local power restoration team is being dispatched to the area as soon as possible. 
,TRAMO > QUEDRADA NEGRITO > VILLA BETINA,June 12 18:31',June 13 17:00',<500,Unplanned,Our power restoration team is onsite conducting critical repairs to restore power the area as quickly and safely as possible.
SAN JUAN,"CMPD. FRAIGCOMAR, CMPG. AUTORIDAD METROPOLITANA DE AUTOBUSES, FGM. DEFENSA CIVIL MUNICIPAL, IND. URBANIZACION INDUSTRIAL EL CINCO, RES. RESIDENCIAL LAS AMAPOLAS, RES. RESIDENCIAL SAN FERNANDO, URB. ALTURAS DE SANTA MARIA, URB. BELISA, URB. CARIBE, URB. CH",June 11 21:35',June 13 12:00',<500,Unplanned,Our power restoration team is onsite conducting critical repairs to restore power the area as quickly and safely as possible.
PEÑUELAS,"SECT. FORNES, SECT. LOS PEREZ, SECT. MARTILLO, EDU. ESCUELA FELIPE QUInONES, SECT. EL LLANO",June 05 10:00',June 13 23:00',<500,Unplanned,Our power restoration team is onsite conducting critical repairs to restore power the area as quickly and safely as possible.