Municipality,Sector,Outage Reported,Estimated Time of Restoration,Estimated Customers Impacted,Category,Current Status
,LA MUDA-CAGUAS TC,February 15 07:21',February 15 18:00',4001-4500,Unplanned,Our local power restoration team is being dispatched to the area as soon as possible. 
SAN JUAN,"COND. CARRION COURT 5, RES. RESIDENCIAL LUIS LLORENS TORRES, SECT. PARQUE, URB. OCEAN PARK",February 15 06:27',February 15 18:00',<500,Scheduled Maintenance,Our power restoration team is onsite conducting critical repairs to restore power the area as quickly and safely as possible. 
SAN JUAN,"COND. ISLA NENA 1511, COND. KINGS COURT 76, EDU. SAINT JOHN'S SCHOOL, SECT. BAYOLA, SECT. MINILLAS, SECT. PARQUE, SECT. SAN JUAN MODERNO, SECT. SAN MATEO",February 15 06:14',February 15 18:00',<500,Scheduled Maintenance,Our power restoration team is onsite conducting critical repairs to restore power the area as quickly and safely as possible. 
SAN JUAN,"SECT. MACHUCHAL, SECT. PARQUE, URB. OCEAN PARK",February 15 06:00',February 15 18:00',<500,Scheduled Maintenance,Our power restoration team is onsite conducting critical repairs to restore power the area as quickly and safely as possible. 
TOA ALTA,"CMPR. LOS PALACIOS, COND. PALACIOS DE VERSALLES, COND. VEREDAS DE LA REINA, RES. RESIDENCIAL MIRADOR DEL TOA, RES. RESIDENCIAL TORRES DEL PLATA 1, RES. RESIDENCIAL TORRES DEL PLATA 2, SECT. LA CAMPINA, SECT. LAS LOMAS, SECT. LOS RODRIGUEZ, SECT. PARCELAS ",February 14 22:41',February 15 14:00',<500,Unplanned,Our power restoration team is onsite conducting critical repairs to restore power the area as quickly and safely as possible.