Municipality,Sector,Outage Reported,Estimated Time of Restoration,Estimated Customers Impacted,Category,Current Status
,TRAMO DE PUERTA DE TIERRAS -COVADONGA GIS,March 12 10:39',April 14 18:00',<500,Unplanned,Our power restoration team is onsite conducting critical repairs to restore power the area as quickly and safely as possible.
,"LAS CUEVAS, CARRAIZO, SECT. LOS COLONES, SECT. LOS MARQUEZ, SECT. MARIA ANTONIA HERNANDEZ, SECT. CULEBRA, SECT. GONZALO CORTEZ, SECT. LUISA SANCHEZ, URB. BRISAS DE LA GLORIA, CAMINO LOS POZO, CAMINO CRUZ ALEMAN, CAMINO PELLIN CRUZ",April 07 15:30',April 07 20:00',501-1000,Unplanned,Enroute
GUAYNABO,"COM. BURGUER KING, COME. LOC GAS, COND. LA CIMA DE TORRIMAR, COND. LINCOLN PARK, COND. THE FALLS, COND. VALLE DE TORRIMAR, COND. VILLA LOS FILTROS, IGL. IGLESIA METODISTA TORRIMAR, URB. ALTURAS DE TORRIMAR, URB. ESTANCIAS DE TORRIMAR, URB. LAS VILLAS, URB",April 07 15:20',April 07 20:00',2001-2500,Unplanned,Our power restoration team is onsite conducting critical repairs to restore power the area as quickly and safely as possible.
SAN JUAN,"COND. MANSIONES DE GARDEN HILLS SUR, URB. GARDEN HILLS , URB. GARDEN HILLS ESTATES, URB. MANSIONES DE GARDEN HILLS, URB. VILLA CAPARRA, COME. ALTAMIRA SHOPPING CENTER, COND. CAMINO REAL, EDIF. POMPINA INVESTMENT, RES. RESIDENCIAL VILLA ESPAnA, URB. ALTAMI",April 07 08:04',April 07 20:00',1501-2000,Unplanned,Our power restoration team is onsite conducting critical repairs to restore power the area as quickly and safely as possible.
MARICAO,"IND. HACIENDA CAFETALERA DELFINA, IND. HACIENDA CAFETALERA LLANADAS, IND. HACIENDA CARACOLILLO, SECT. CARRIZALES, SECT. CHAGO MENDEZ, SECT. EL 22, SECT. EL QUEMAO, SECT. INDIO URAYON, SECT. JUSTINIANO, SECT. LA SALVACION, SECT. LAS SESENTA, SECT. LAS TORR",April 07 08:04',April 07 18:30',1001-1500,Scheduled Maintenance,Our power restoration team is onsite conducting critical repairs to restore power the area as quickly and safely as possible. 