Municipality,Sector,Outage Reported,Estimated Time of Restoration,Estimated Customers Impacted,Category,Current Status
ADJUNTAS,"BDA. RODRIGUEZ, EDU. ESCUELA DOMINGO MASSOL, RES. RESIDENCIAL ALTURAS DE ADJUNTAS, RES. RESIDENCIAL VILLA VALLE VERDE, SECT. CASCO URBANO, SECT . JUAN ORTIZ, SECT. LAGO GARZAS, SECT. LA OLIMPIA, SECT. PALOMO, SECT. PARCELAS IRIZARRY, SECT. SALTILLO VACAS,",October 25 15:33',October 25 20:00',1001-1500,Unknown,"LUMA has successfully completed repairs and restored power to the area. If you have any questions, please contact us at 1-844-888-5862 (LUMA). "
YAUCO,"BDA. ARTURO LLUBERAS, HTL. EL CAFETAL, PARC. LAS PELAS, SECT. EL LAGO, SECT. LA PALMITA, SECT. LOMA DEL VIENTO, SECT. RIO CAnAS, URB. ALTURAS DEL CAFETAL, URB. MONTE VERDE, URB. VILLAS DEL CAFETAL, URB. VILLAS DEL CAFETAL 2",October 25 10:04',October 25 20:00',1501-2000,Scheduled Maintenance,"LUMA has successfully completed repairs and restored power to the area. If you have any questions, please contact us at 1-844-888-5862 (LUMA). "
SAN JUAN,"CMPE. UNIVERSIDAD DEL SAGRADO CORAZON, COND. ANGELICA, COND. DHARMA, COND. EGIDA ALTURAS DE SAN JUAN, COND. HABITAT DE CANTERA, COND. IMPERIAL SUITES, COND. PARQUE VICTORIA, COND. THE LOFTS AT 2014, EDU. ESCUELA ELEMENTAL FRAY BARTOLOME DE LAS CASAS, EDU.",October 25 17:18',October 25 20:00',2501-3000,Unplanned,Our local power restoration team is being dispatched to the area as soon as possible. 
RIO GRANDE,"URB. PRADERA DEL YUNQUE, URB. QUINTAS DEL VERDE, URB. VILLAS DEL RIO, URB. VILLAS DE RIO GRANDE, COMU. BARTOLO, COMU. JOSE PH HERNANDEZ, COMU. VILLA CALZADA, PARC. BELLA VISTA, PARC. MALPICA, PARC. SAMUEL DAVILA, SECT. CARA DEL INDIO, SECT. CASCO URBANO, ",October 25 15:19',October 25 20:00',1001-1500,Unplanned,Our power restoration team is onsite conducting critical repairs to restore power the area as quickly and safely as possible. 
CANOVANAS,"PARC. NUEVAS SAN ISIDRO, PARC. SAN ISIDRO, PARC. VIEJAS SAN ISIDRO, SECT. CASCO URBANO, SECT. MONTE VERDE, SECT. VALLE HILLS, URB. COUNTRY VIEW, URB. INDUSTRIAL CANOVANAS",October 25 14:40',October 25 20:00',<500,Unplanned,Our power restoration team is onsite conducting critical repairs to restore power the area as quickly and safely as possible. 
SAN JUAN,"ARE. PARQUE LA MERCED, COM. GASOLINERA SHELL, COM. MCDONALD'S, COM. SPRINT, COND. MIRADOR DEL PARQUE, COND. TORRE CIBELES, URB. BALDRICH, URB. EXTENSION ROOSEVELT, URB. ROOSEVELT",October 25 14:37',October 25 20:00',1501-2000,Unplanned,Our local power restoration team is being dispatched to the area as soon as possible. 