Municipality,Sector,Outage Reported,Estimated Time of Restoration,Estimated Customers Impacted,Category,Current Status
,"HATILLO T/O > MIRADOR AZUL  8013 SECT. BARRANCAS, SECT. LAS CANELAS, SECT. LOS MORA, URB. CIUDAD ATLANTIS, COME. PLAZA DEL NORTE SHOPPING CENTER, PARC. CARRIZALES, PARC. CARRIZALES 2, SECT. BETANCOURT, SECT. VIETNAM, SECT. VILLA GARCIA, URB. COLINAS DEL NORTE, URB. ESTANCIAS DE PALMA GORDA, URB. GARDEN VIEW, URB. LAS CUMBRES, CMPD. COLISEO MUNICIPAL, COM. EL BUEN CAFE, PARC. CARRIZALES, RES. RESIDENCIAL PUERTA DEL MAR, RES. RESIDENCIAL VILLA DEL MAR, RES. RESIDENCIAL VILLA ESPERANZA, SECT. MANSIONES TOLEDO, SECT. QUInONES, URB. ALTURAS DE HATILLO, URB. BRISAS DEL ATLANTICO, URB. CORALES, URB. COSTA NORTE, URB. ESTANCIAS DE CARRIZALES, URB. LAS PALMAS, URB. LAS PRADERAS, URB. MONTEMAR, URB. VALLE VERDE, URB. VILLA BONITA, COM. ARECIBO CINEMA, SECT. LAS CANELAS, SECT. SAN DANIEL , URB. ALTURAS DE SAN DANIEL, URB. REPARTO SAN MIGUEL, COM. BANCO VILBAO VIZCAYA, COME. PLAZA DEL NORTE SHOPPING CENTER, COM. TOYS'R'US PLAZA DEL NORTE, CALLE TRUNCADO, SAN DANIEL",December 10 19:08',December 11 03:00',4001-4500,Unplanned,Our local power restoration team is being dispatched to the area as soon as possible. 
JAYUYA,URB. LA MONSERRATE,December 10 19:08',December 10 23:00',2001-2500,Unplanned,Our local power restoration team is being dispatched to the area as soon as possible. 
SAN JUAN,"BUEN PASTOR, SECT. PAJILLAS, COND. BEVERLY HILLS COURT, COND. EGIDA ASOCIACION DE MIEMBROS DE LA POLICIA DE PUERTO RICO, COND. VISTA DE LOS FRAILES, EDU. ESCUELA ALEJANDRO JUNIOR CRUZ, PARC. LOPEZ CASES, SECT. ANTONIO GONZALEZ, SECT. CAMINO NUEVO HORIZONT",December 10 13:36',December 10 23:00',>5000,Unplanned,Our power restoration team is onsite conducting critical repairs to restore power the area as quickly and safely as possible. 
,TRAMO- MIRADOR AZUL SECT - ACB 6905B  ,December 07 20:20',December 12 19:00',<500,Unplanned,Our power restoration team is onsite conducting critical repairs to restore power the area as quickly and safely as possible.
,YAUCO 2 - ACB 1237,December 07 12:33',December 12 19:00',<500,Unplanned,Our power restoration team is onsite conducting critical repairs to restore power the area as quickly and safely as possible.