Municipality,Sector,Outage Reported,Estimated Time of Restoration,Estimated Customers Impacted,Category,Current Status
SAN JUAN,SECT. PUERTA DE TIERRA,June 13 02:10',June 13 13:00',<500,Unplanned,"LUMA has successfully completed repairs and restored power to the area. If you have any questions, please contact us at 1-844-888-5862 (LUMA). "
CIDRA,"COMU. CERTENEJAS 2, EDU. ESCUELA BEATRIZ ADVENTRO, EDU. ESCUELA JUAN STUBBE, PARC. JUAN DEL VALLE, SECT. ALTURA DE ARENAS, SECT. BRISAS DEL CAMPO, SECT. BRISAS DEL PLATA, SECT. CAMINO CARMEN SANTIAGO, SECT. CAMPAMENTO EBENEZER, SECT. CENTENO QUILES, SECT.",June 13 08:23',June 13 13:30',1001-1500,Unplanned,Our local power restoration team is being dispatched to the area as soon as possible. 
LAJAS,"COMU. JARDINES DE CUESTA BLANCA, COM. WINSTON TRAILER CAMP, COND. VILLAS DEL SOL RESORT, COND. VISTA HORIZONTE, COND. VISTAS DE LA BAHIA, PARC. LA PARGUERA, PARC. SALINAS FORTUNA, SECT. PAPAYO, URB. BRISAS DEL MAR, URB. CARIBBEAN VIEW , URB. CAYO ENRIQUE ",June 13 06:55',June 13 13:00',3001-3500,Unplanned,Our local power restoration team is being dispatched to the area as soon as possible. 
,TRAMO > LAS LOMAS > MONACILLOS,June 13 03:35',June 13 13:00',<500,Unplanned,Our power restoration team is onsite conducting critical repairs to restore power the area as quickly and safely as possible.
SAN JUAN,SECT. PUERTA DE TIERRA,June 13 02:10',June 13 13:00',<500,Unplanned,Our local power restoration team is being dispatched to the area as soon as possible. 
,TRAMO > AGUAS BUENAS GIS A HACIENDA SAN JOSE ,June 12 21:42',June 13 13:00',<500,Unplanned,Our local power restoration team is being dispatched to the area as soon as possible. 
,TRAMO > QUEDRADA NEGRITO > VILLA BETINA,June 12 18:31',June 13 17:00',<500,Unplanned,Our power restoration team is onsite conducting critical repairs to restore power the area as quickly and safely as possible.
SAN JUAN,"CMPD. FRAIGCOMAR, CMPG. AUTORIDAD METROPOLITANA DE AUTOBUSES, FGM. DEFENSA CIVIL MUNICIPAL, IND. URBANIZACION INDUSTRIAL EL CINCO, RES. RESIDENCIAL LAS AMAPOLAS, RES. RESIDENCIAL SAN FERNANDO, URB. ALTURAS DE SANTA MARIA, URB. BELISA, URB. CARIBE, URB. CH",June 11 21:35',June 13 13:00',<500,Unplanned,Our power restoration team is onsite conducting critical repairs to restore power the area as quickly and safely as possible. 
PEÑUELAS,"SECT. FORNES, SECT. LOS PEREZ, SECT. MARTILLO, EDU. ESCUELA FELIPE QUInONES, SECT. EL LLANO",June 05 10:00',June 13 23:00',<500,Unplanned,Our power restoration team is onsite conducting critical repairs to restore power the area as quickly and safely as possible.