Municipality,Sector,Outage Reported,Estimated Time of Restoration,Estimated Customers Impacted,Category,Current Status
AGUADA,"COMU. COMUNIDAD ESPECIAL CALLE SAN FRANCISCO, COMU. COMUNIDAD ESPECIAL CALLE SAN JOSE, RES. RESIDENCIAL FRANCISCO EGIPCIACO, RES. RESIDENCIAL LOS ROBLES, SECT. CASCO URBANO, SECT. JOSE CHEPE HERNANDEZ, SECT. POLO DIAZ, URB. ALTURAS DE AGUADA, URB. EXTENSI",May 28 15:34',May 29 23:00',<500,Unplanned,"LUMA has successfully completed repairs and restored power to the area. If you have any questions, please contact us at 1-844-888-5862 (LUMA). "
SAN JUAN,"ONG. HOGAR MI ADORADA CASITA, URB. CAPARRA TERRACE, URB. PUERTO NUEVO, URB. REPARTO METROPOLITANO",May 29 22:00',May 30 02:00',<500,Unplanned,Enroute
BAYAMON,"CMPE. ESCUELA DE MEDICINA SAN JUAN BAUTISTA, RES. RESIDENCIAL VIRGILIO DAVILA, SECT. CASCO URBANO, URB. SANTA CRUZ",May 29 21:47',May 30 02:00',1001-1500,Unplanned,Our power restoration team is onsite conducting critical repairs to restore power the area as quickly and safely as possible.
TRUJILLO ALTO,"SECT. LAS CUCHILLAS, SECT. MONTE LAGO, COME. GALERIAS PACIFICO DE CUPEY, COND. ALTURAS DEL BOSQUE, COND. CAMINOS VERDES, COND. CAMINOS VERDES 2, COND. MONTE ATENAS, EDU. ESCUELA SEGUNDA UNIDAD JUAN ANTONIO CORRETJER, PARC. CARRAIZO, RES. RESIDENCIAL ALTUR",May 28 20:10',May 29 23:00',<500,Unplanned,Our power restoration team is onsite conducting critical repairs to restore power the area as quickly and safely as possible. 
SAN JUAN,"PARC. CARRAIZO, SECT. CAMINO EL MUDO, SECT. CAMINO LOS CALOCA, SECT. LOS AYALAS, URB. EL VIGIA, URB. REPARTO VILLA OLGA, SECT. EL MUDO, SECT. LOS POMALES, URB. COLINAS DE FAIR VIEW",May 28 18:20',May 29 23:00',<500,Unplanned,Our power restoration team is onsite conducting critical repairs to restore power the area as quickly and safely as possible. 