Municipality,Sector,Outage Reported,Estimated Time of Restoration,Estimated Customers Impacted,Category,Current Status
,DOS BOCAS > CIALES.,June 20 10:48',June 23 18:00',<500,Unplanned,"LUMA has successfully completed repairs and restored power to the area. If you have any questions, please contact us at 1-844-888-5862 (LUMA). "
,    TRAMO DOS BOCAS A JAYUYA,June 19 16:12',June 23 21:00',<500,Unplanned,"LUMA has successfully completed repairs and restored power to the area. If you have any questions, please contact us at 1-844-888-5862 (LUMA). "
,TRAMO > BUENA VISTA > PONCE TC,June 15 19:10',June 23 21:00',<500,Unplanned,"LUMA has successfully completed repairs and restored power to the area. If you have any questions, please contact us at 1-844-888-5862 (LUMA). "
,"FLORIDA 8602   COMU. ALTURAS DE PAJONAL, COMU. SELGAS, PARC. ALTURAS DE YANES 1RA SECCION, PARC. ALTURAS DE YANES 2DA SECCION, PARC. ALTURAS DE YANES 3RA SECCION, PARC. ARROYO, PARC. PAJONAL, PARC. SELGAS, SECT. CEIBA, SECT. LA VAZQUEZ, SECT. PUERTO BLANCO, SECT. RIACHUELO, SECT. VALLE ENCANTADO, URB. ALTURAS DE YANES, URB. LAS FLORES, URB. LAS VEGAS, URB. REPARTO MARTINEZ, URB. REPARTO SEOANE, SECT. RIACHUELO, SECT. VALLE ENCANTADO, SECT. ASOMANTE, SECT. CAROLINA, SECT. LOS MUERTOS, SECT. RIACHUELO, SECT. VILLISLA, URB. ESTANCIAS DE LA SABANA, COND. FLORIDA GARDENS APARTMENTS, SECT. LA MALDONADO, URB. ALTOS DE FLORIDA, URB. ALTURAS DE FLORIDA, URB. EXTENSION ALTOS DE FLORIDA, URB. HACIENDA DE FLORIDA, URB. JARDINES DE FLORIDA, URB. RESIDENCIAL LA FUENTE",June 23 13:52',June 23 19:00',>5000,Unplanned,Enroute
,TRAMO > VIADUCTO > PARQUES Y RECREOS,June 14 03:55',June 28 15:00',<500,Unplanned,Our power restoration team is onsite conducting critical repairs to restore power the area as quickly and safely as possible.