Municipality,Sector,Outage Reported,Estimated Time of Restoration,Estimated Customers Impacted,Category,Current Status
,LA MUDA-SJ INDUSTRIAL PARK ,February 15 07:21',February 15 18:00',<500,Unplanned,"LUMA has successfully completed repairs and restored power to the area. If you have any questions, please contact us at 1-844-888-5862 (LUMA). "
COROZAL,"SECT. HERMITA, PARC. RAMON PABON, SECT. PATRON, URB. JOHN DIAZ, URB. MATOS, URB. QUINTAS DEL RIO, URB. RIBERAS DE UNIBON, URB. ROSE VALLEY",February 15 09:27',February 15 18:00',<500,Scheduled Maintenance,Our power restoration team is onsite conducting critical repairs to restore power the area as quickly and safely as possible. 
FLORIDA,"SECT. ASOMANTE, SECT. CAROLINA, SECT. LOS MUERTOS, SECT. RIACHUELO, SECT. VILLISLA, URB. ESTANCIAS DE LA SABANA, COND. FLORIDA GARDENS APARTMENTS, SECT. LA MALDONADO, URB. ALTOS DE FLORIDA, URB. ALTURAS DE FLORIDA, URB. EXTENSION ALTOS DE FLORIDA, URB. HA",February 15 09:20',February 15 18:00',2501-3000,Scheduled Maintenance,Our power restoration team is onsite conducting critical repairs to restore power the area as quickly and safely as possible. 
LAS MARIAS,"COMU. MUnOZ TORRUELLAS, SECT. BRYAN, SECT. LA JOSEFA, SECT. PALO PRIETO, SECT. SECTOR CALLE PALMER, SECT. SECTOR CALLE SAN BENITO, URB. EL BOSQUE, URB. FRANCISCO SERRANO, SECT. MAGUEYES",February 15 09:02',February 15 18:00',1001-1500,Scheduled Maintenance,Our power restoration team is onsite conducting critical repairs to restore power the area as quickly and safely as possible. 
ARROYO,"BDA. LAS MERCEDES, COMU. BUENA VISTA, COMU. EXTENSION BUENA VISTA, COMU. LAS 500, EDU. ESCUELA EDMUNDO DEL VALLE, PARC. NUEVAS DE LA BARRIADA MARIN, SECT. ANTIGUA, SECT. CHARDON, SECT. EL MULTAR, SECT. EL PIOJO, SECT. EMAJAGUAL, SECT. JACANA, SECT. LAS 25",February 15 08:28',February 15 18:00',501-1000,Scheduled Maintenance,Our power restoration team is onsite conducting critical repairs to restore power the area as quickly and safely as possible. 
SAN JUAN,"COND. CARRION COURT 5, RES. RESIDENCIAL LUIS LLORENS TORRES, SECT. PARQUE, URB. OCEAN PARK",February 15 06:27',February 15 18:00',<500,Scheduled Maintenance,Our power restoration team is onsite conducting critical repairs to restore power the area as quickly and safely as possible. 
SAN JUAN,"COND. ISLA NENA 1511, COND. KINGS COURT 76, EDU. SAINT JOHN'S SCHOOL, SECT. BAYOLA, SECT. MINILLAS, SECT. PARQUE, SECT. SAN JUAN MODERNO, SECT. SAN MATEO",February 15 06:14',February 15 18:00',<500,Scheduled Maintenance,Our power restoration team is onsite conducting critical repairs to restore power the area as quickly and safely as possible. 
SAN JUAN,"SECT. MACHUCHAL, SECT. PARQUE, URB. OCEAN PARK",February 15 06:00',February 15 18:00',<500,Scheduled Maintenance,Our power restoration team is onsite conducting critical repairs to restore power the area as quickly and safely as possible. 
TOA ALTA,"CMPR. LOS PALACIOS, COND. PALACIOS DE VERSALLES, COND. VEREDAS DE LA REINA, RES. RESIDENCIAL MIRADOR DEL TOA, RES. RESIDENCIAL TORRES DEL PLATA 1, RES. RESIDENCIAL TORRES DEL PLATA 2, SECT. LA CAMPINA, SECT. LAS LOMAS, SECT. LOS RODRIGUEZ, SECT. PARCELAS ",February 14 22:41',February 15 16:00',<500,Unplanned,Our power restoration team is onsite conducting critical repairs to restore power the area as quickly and safely as possible. 