Municipality,Sector,Outage Reported,Estimated Time of Restoration,Estimated Customers Impacted,Category,Current Status
SAN JUAN,"CMPE. UNIVERSIDAD DEL SAGRADO CORAZON, COND. ANGELICA, COND. DHARMA, COND. EGIDA ALTURAS DE SAN JUAN, COND. HABITAT DE CANTERA, COND. IMPERIAL SUITES, COND. PARQUE VICTORIA, COND. THE LOFTS AT 2014, EDU. ESCUELA ELEMENTAL FRAY BARTOLOME DE LAS CASAS, EDU.",October 25 17:18',October 25 20:00',2501-3000,Unplanned,"LUMA has successfully completed repairs and restored power to the area. If you have any questions, please contact us at 1-844-888-5862 (LUMA). "
CANOVANAS,"PARC. NUEVAS SAN ISIDRO, PARC. SAN ISIDRO, PARC. VIEJAS SAN ISIDRO, SECT. CASCO URBANO, SECT. MONTE VERDE, SECT. VALLE HILLS, URB. COUNTRY VIEW, URB. INDUSTRIAL CANOVANAS",October 25 14:40',October 25 20:00',<500,Unplanned,"LUMA has successfully completed repairs and restored power to the area. If you have any questions, please contact us at 1-844-888-5862 (LUMA). "
SAN JUAN,"COND. BAHIA, COND. CASA BLANCA 652, HOSP. GUALBERTO RABELL, IND. ISLA GRANDE, SECT. GANDUL, SECT. TRAS TALLERES",October 25 19:12',October 25 23:00',2501-3000,Unplanned,Our power restoration team is onsite conducting critical repairs to restore power the area as quickly and safely as possible.
SAN JUAN,"CMPE. UNIVERSIDAD DEL SAGRADO CORAZON, COND. ANGELICA, COND. DHARMA, COND. EGIDA ALTURAS DE SAN JUAN, COND. HABITAT DE CANTERA, COND. IMPERIAL SUITES, COND. PARQUE VICTORIA, COND. THE LOFTS AT 2014, EDU. ESCUELA ELEMENTAL FRAY BARTOLOME DE LAS CASAS, EDU.",October 25 19:12',October 25 23:00',2001-2500,Unplanned,Our power restoration team is onsite conducting critical repairs to restore power the area as quickly and safely as possible.
MAYAGUEZ,,October 25 18:56',October 25 23:00',<500,Unplanned,Our power restoration team is onsite conducting critical repairs to restore power the area as quickly and safely as possible.
SAN JUAN,"CMPA. LOS PASEOS CLUB HOUSE, COM. CENTRO DE CONVECIONES LOS PASEOS, COND. CHURCHILL PARK, COND. COLINA REAL, COND. GARDEN VALLEY CLUB, COND. PARQUE EL SEnORIAL 251, COND. PASEO DEL BOSQUE, COND. PASEO DEL ROCIO, COND. PASEO MONTE, COND. VILLAS DEL SEnORIA",October 25 18:15',October 25 23:00',3001-3500,Unplanned,Our power restoration team is onsite conducting critical repairs to restore power the area as quickly and safely as possible.
RIO GRANDE,"URB. PRADERA DEL YUNQUE, URB. QUINTAS DEL VERDE, URB. VILLAS DEL RIO, URB. VILLAS DE RIO GRANDE, COMU. BARTOLO, COMU. JOSE PH HERNANDEZ, COMU. VILLA CALZADA, PARC. BELLA VISTA, PARC. MALPICA, PARC. SAMUEL DAVILA, SECT. CARA DEL INDIO, SECT. CASCO URBANO, ",October 25 15:19',October 25 23:00',1001-1500,Unplanned,Our power restoration team is onsite conducting critical repairs to restore power the area as quickly and safely as possible. 
SAN JUAN,"ARE. PARQUE LA MERCED, COM. GASOLINERA SHELL, COM. MCDONALD'S, COM. SPRINT, COND. MIRADOR DEL PARQUE, COND. TORRE CIBELES, URB. BALDRICH, URB. EXTENSION ROOSEVELT, URB. ROOSEVELT",October 25 14:37',October 25 23:00',1501-2000,Unplanned,Our local power restoration team is being dispatched to the area as soon as possible. 