Municipality,Sector,Outage Reported,Estimated Time of Restoration,Estimated Customers Impacted,Category,Current Status
YABUCOA,"COMU. MARTORELL, PARC. ROSA SANCHEZ, SECT. LOS SANCHEZ, SECT. SODOMA, URB. VALLE DE LAS CALABAZAS",May 02 08:04',May 02 14:00',1001-1500,Unplanned,Our power restoration team is onsite conducting critical repairs to restore power the area as quickly and safely as possible. 
BARRANQUITAS,"EDU. ESCUELA FEDERICO DEGETAU, SECT. BEJUCO, SECT. CAnABON, SECT. CRUCE LA TIZA, SECT. LA CUCHILLA, SECT. LA TORRE, SECT. LOS MUnOZ, SECT. MOGOTE, URB. PASEOS DE TORRE ALTA, URB. VISTAS DE MONTECIELO, SECT. CHU VAZQUEZ, SECT. EL PUENTE, SECT. LA MEDICA",May 02 07:15',May 02 18:00',501-1000,Scheduled Maintenance,Our power restoration team is onsite conducting critical repairs to restore power the area as quickly and safely as possible. 
YABUCOA,"COME. PLAZA YABUCOA SHOPPING CENTER, COM. GARAJE SHELL, COMU. EL NEGRO CAMINO NUEVO, EDU. ESCUELA FRANCISCO SUSTACHE, IND. PUERTO RICO SUN OIL COMPANY, IND. ZONA INDUSTRIAL BARRIO JUAN MARTIN, PARC. EL NEGRO, SECT. EL GUANO, SECT. EL NEGRO, SECT. POBLADO ",May 02 06:46',May 02 18:00',<500,Scheduled Maintenance,Our power restoration team is onsite conducting critical repairs to restore power the area as quickly and safely as possible. 
SAN JUAN,"CMPC. CORPORATE OFFICE PARK, CMPG. ESTACION SAN FRANCISCO DEL TREN URBANO, COM. GASOLINERA TOTAL EXCELLIUM, COM. NATIONAL LUMBER &amp; HARDWARE, COM. SUIZA DAIRY, COM. TREN URBANO MARTINEZ NADAL, EDU. ESCUELA ANA ROQUE DE DUPREY, HOSP. METROPOLITANO, IGL.",May 02 06:46',May 02 18:00',501-1000,Scheduled Maintenance,Our power restoration team is onsite conducting critical repairs to restore power the area as quickly and safely as possible. 
,DOS BOCAS- CIALES,April 29 17:45',May 03 20:00',<500,Unplanned,Our power restoration team is onsite conducting critical repairs to restore power the area as quickly and safely as possible.