Municipality,Sector,Outage Reported,Estimated Time of Restoration,Estimated Customers Impacted,Category,Current Status
," TRAMO DE Monacillos TC - Villa Betina (Radial) CEM. CEMENTERIO BUXEDA MEMORIAL, CEM. CEMENTERIO EL SEnORIAL, COND. ALTURAS DE SAN JUAN, COND. ARCOS DE CUPEY, COND. EL MARIA, COND. ESTANCIAS DEL BOULEVARD, COND. GARDEN VALLEY CLUB, COND. SAN JUAN CHALETS, COND. TROPICAL COURT, COND. VAZQUEZ APARTMENTS, COND. VILLA UNIVERSITARIA, RES. RESIDENCIAL BRISAS DE CUPEY, RES. RESIDENCIAL JARDINES DE CUPEY, SECT. CAMINO DON DIEGO, SECT. CAMINO ESQUILIN, SECT. CAMINO LOS PIZARRO, SECT. CAMINO PEDRO CASTRO, SECT. DOCTOR JULIA, SECT. LA GRUA, SECT. LAS CURIAS, SECT. LOS ANDINOS, URB. CIUDAD SEnORIAL, URB. COLINAS DE CUPEY, URB. CUPEY GARDENS, URB. EL MIRADOR, URB. EL SEnORIAL, URB. FAIR VIEW, URB. LA ALBORADA, URB. LAKEVIEW, URB. LAS ROSAS, URB. LITHEDA HEIGHTS, URB. MANSIONES DE RIO PIEDRAS, URB. PASEO DEL PRADO, URB. PASEO MAYOR, URB. PORTAL DE LAS CUMBRES, URB. REPARTO TULIPAN, URB. RIVIERAS DE CUPEY, URB. VILLA HUCAR, URB. VILLAS DEL LAGO, URB. VILLAS DEL MONTE",March 04 15:26',March 04 21:00',<500,Unplanned,Our local power restoration team is being dispatched to the area as soon as possible. 
TRUJILLO ALTO,"COMU. SAINT JUST, URB. COLINAS DE MONTEBELLO, URB. PARQUE MONTEBELLO, BDA. GONZALEZ, CMPD. ENCANTADA, CMPR. ENCANTADA, COME. LAGO ALTO PLAZA, COME. LAGO ALTO PLAZA SHOPPING CENTER, COM. EMPACADORA HILL BROTHERS, COME. PLAZA TRUJILLO SHOPPING CENTER, COME.",March 04 09:15',March 04 18:00',501-1000,Scheduled Maintenance,Our power restoration team is onsite conducting critical repairs to restore power the area as quickly and safely as possible. 
TRUJILLO ALTO,"ARE. PARQUE VILLA ANDALUCIA, COND. MONTE REAL, URB. VILLA ANDALUCIA, BDA. TOTTI, SECT. PUEBLO SECO, URB. NUESTRA SEnORA DE LOURDES, URB. ROUND HILLS, URB. ROUND HILLS COURTS, URB. VILLA BLANCA",March 04 08:45',March 04 18:00',501-1000,Scheduled Maintenance,Our power restoration team is onsite conducting critical repairs to restore power the area as quickly and safely as possible. 
ADJUNTAS,"CMPD. COMPLEJO RECREATIVO GUARIONEX POLIDEPORTIVO, COM. SUPERMERCADO SELECTOS, SECT. ACUEDUCTO, SECT. COLISEO, SECT. COMUNIDAD YAYALES, SECT. LOS CALABOZOS",March 04 07:03',March 04 18:00',501-1000,Unplanned,Our power restoration team is onsite conducting critical repairs to restore power the area as quickly and safely as possible. 
,TRAMO DE ARECIBO-ACB 2387A    8004-01,March 03 15:22',March 04 18:00',<500,Unplanned,Our power restoration team is onsite conducting critical repairs to restore power the area as quickly and safely as possible. 