Municipality,Sector,Outage Reported,Estimated Time of Restoration,Estimated Customers Impacted,Category,Current Status
SAN JUAN,"ARE. PARQUE LUIS MUnOZ MARIN, COND. SEGOVIA, URB. EXTENSION ROOSEVELT, URB. PARQUE CENTRAL",October 04 18:09',October 04 22:00',501-1000,Unplanned,"LUMA has successfully completed repairs and restored power to the area. If you have any questions, please contact us at 1-844-888-5862 (LUMA). "
TOA BAJA,"CEM. CEMENTERIO PORTA COELI, CEM. PUERTO RICO NATIONAL CEMETERY, COME. PLAZA DEL PARQUE SHOPPING CENTER, COM. SUPERMERCADO LOS HERMANOS, EDU. COLEGIO LA SALLE, SECT. PUNTA BRAVA, URB. CHALETS DEL RIO, URB. ESTANCIAS DE RIO HONDO 1, URB. PARQUE LA SALLE, U",October 04 09:00',October 04 23:00',501-1000,Scheduled Maintenance,"LUMA has successfully completed repairs and restored power to the area. If you have any questions, please contact us at 1-844-888-5862 (LUMA). "
,YAUCO 1 A YAUCO 2,October 04 12:41',October 04 23:00',<500,Unplanned,Our power restoration team is onsite conducting critical repairs to restore power the area as quickly and safely as possible.
PONCE,"COND. LA CEIBA, URB. SALAZAR",October 04 12:41',October 04 23:00',<500,Unplanned,Our power restoration team is onsite conducting critical repairs to restore power the area as quickly and safely as possible. 
BARCELONETA,"URB. VILLA BARCELONA 1, URB. VILLA BARCELONA 2, URB. VILLA GEORGETTI, SECT. VIBORA, URB. COSTA DE ORO, ARE. PARQUE JOSE I. MACHADO, CMPD. ESTADIO RAUL ESCUDERO COTTE, CMPD. VILLA GEORGETTI, COMU. EXTENSION PUNTA PALMAS, FGM. OBRAS PUBLICAS MUNICIPAL, IND.",October 04 09:35',October 04 23:00',2501-3000,Scheduled Maintenance,Our power restoration team is onsite conducting critical repairs to restore power the area as quickly and safely as possible. 
BARCELONETA,"PARC. LOARTE, SECT. BARRIO LLANADAS, SECT. CATAnITO, SECT. CERRO MORALES, SECT. CITE, SECT. LOS MENDEZ, SECT. MATOS, SECT. NO VEO, SECT. PARCELAS GARROCHALES, SECT. PASO NIVEL GARROCHALES, URB. CATALANA, URB. VILARPE",October 04 09:00',October 04 23:00',1001-1500,Scheduled Maintenance,Our power restoration team is onsite conducting critical repairs to restore power the area as quickly and safely as possible. 
TOA BAJA,"CMPG. PARQUE DE LAS CIENCIAS, COME. CANTON MALL, COME. PLAZA DEL SOL, COME. PLAZOLETA DEL CANTON, COND. SIERRA BAYAMON APARTMENTS, COND. SIERRA BAYAMON APARTMENTS 750, EDU. ESCUELA INTERMEDIA CACIQUE AGUEYBANA, RES. RESIDENCIAL SIERRA BAYAMON APARTMENTS, ",October 04 07:57',October 04 23:00',1501-2000,Scheduled Maintenance,Our power restoration team is onsite conducting critical repairs to restore power the area as quickly and safely as possible. 