Municipality,Sector,Outage Reported,Estimated Time of Restoration,Estimated Customers Impacted,Category,Current Status
GUAYAMA,"ARE. AREA RECREATIVA, CMPD. COMPLEJO DEPORTIVO MUNICIPAL DE GUAYAMA, CMPE. INSTITUTO TECNOLOGICO DE PUERTO RICO RECINTO GUAYAMA, COME. LA FUENTE TOWN CENTER, COME. PLAZA DEL MERCADO DE GUAYAMA, COME. SAN VICENTE MALL, EDU. ACADEMIA SAN ANTONIO, EDU. ESCUE",May 27 13:00',May 27 17:00',1501-2000,Unplanned,"LUMA has successfully completed repairs and restored power to the area. If you have any questions, please contact us at 1-844-888-5862 (LUMA). "
PONCE,"URB. HACIENDA JULIANA, URB. LAUREL SUR",May 26 20:21',May 27 17:00',<500,Unplanned,"LUMA has successfully completed repairs and restored power to the area. If you have any questions, please contact us at 1-844-888-5862 (LUMA). "
ARECIBO,"COMU. BUENOS AIRES, COMU. NAVAS, COMU. PARCELAS NUEVAS, COMU. VICTOR ROJAS 1, COMU. VICTOR ROJAS 2, COND. VISTAS DEL MAR ELDERLY (EGIDA), RES. RESIDENCIAL EXTENSION MANUEL ZENO GANDIA, RES. RESIDENCIAL RAMON MARIN , RES. RESIDENCIAL TRINA PADILLA DE SANZ,",May 27 14:15',May 27 20:00',3001-3500,Unplanned,Our local power restoration team is being dispatched to the area as soon as possible. 
,            TRAMO VEGA BAJA - DORADO,May 27 07:00',May 27 17:00',<500,Scheduled Maintenance,Our power restoration team is onsite conducting critical repairs to restore power the area as quickly and safely as possible. 
,YAUCO 2 - ACB 1237 ,May 26 07:47',May 27 20:00',<500,Unplanned,Our power restoration team is onsite conducting critical repairs to restore power the area as quickly and safely as possible.