Municipality,Sector,Outage Reported,Estimated Time of Restoration,Estimated Customers Impacted,Category,Current Status
HORMIGUEROS,"ARE. PARQUE DE PELOTA TUTO MENDOZA, COME. CABO ROJO SHOPPING COURT, COME. GALERIA 100 SHOPPING CENTER, COM. MCDONALD'S, SECT. CAMINO LOS MERCADO, SECT. CAMINO OLIVERAS, SECT. CASCO URBANO, SECT. COLACHO, SECT. CONDE AVILA, SECT. EL COQUI, SECT. EL SANTUAR",November 15 08:11',November 15 14:00',501-1000,3rd Party Damage,"LUMA has successfully completed repairs and restored power to the area. If you have any questions, please contact us at 1-844-888-5862 (LUMA). "
,TRAMO > LLORENS > VILLAMAR,October 28 12:25',November 18 23:00',<500,Unplanned,Our power restoration team is onsite conducting critical repairs to restore power the area as quickly and safely as possible.
PONCE,"CEM. CEMENTERIO MUNICIPAL DE JUANA DIAZ, COMU. BAYOAN, COMU. EXTENSION LUIS LLORENS TORRES, COMU. LUCIANA, COMU. LUIS LLORENS TORRES, SECT. CERRITO, SECT. LAS VIUDAS, SECT. OLLA HONDA, URB. ESTANCIAS DEL SOL, URB. JARDINES DE JACAGUAX, URB. LAGO HORIZONTE",November 15 09:28',November 15 18:00',2001-2500,Scheduled Maintenance,Our power restoration team is onsite conducting critical repairs to restore power the area as quickly and safely as possible. 
LARES,"COME. LARES MEDICAL CENTER, COND. LARES GARDENS, EDU. ESCUELA DOMINGO APONTE COLLAZO, EDU. ESCUELA IGNACIO DICUPE GONZALEZ, SECT. LA SIERRA, URB. BUENA VISTA, URB. VILLA SERAL",November 15 08:03',November 15 19:00',2001-2500,Scheduled Maintenance,Our power restoration team is onsite conducting critical repairs to restore power the area as quickly and safely as possible. 
,BARCELONETA - CAMBALACHE,November 13 12:41',November 15 14:00',<500,Unplanned,Our power restoration team is onsite conducting critical repairs to restore power the area as quickly and safely as possible. 