Municipality,Sector,Outage Reported,Estimated Time of Restoration,Estimated Customers Impacted,Category,Current Status
TOA BAJA,"URB. QUINTAS DEL NORTE, COND. TERRAZAS DE MONTE CASINO, COND. VISTAS DE MONTECASINO, URB. MADELAINE, URB. MONTECASINO HEIGHTS, URB. VILLA DEL MONTE, COM. PEGO INVESTMENT, COM. POPULAR AUTO, COM. TRINITY ELECTRIC INC., COMU. MACUN, COMU. PAJAROS, COND. QUI",November 29 07:30',November 29 23:00',<500,Scheduled Maintenance,"LUMA has successfully completed repairs and restored power to the area. If you have any questions, please contact us at 1-844-888-5862 (LUMA). "
SAN SEBASTIAN,"EDU. ESCUELA JULIO BABILONIA, SECT. BARRETO HERNANDEZ, SECT. BOSQUES, SECT. SABANA, SECT. SAN LORENZO, SECT. SEGUI, EDU. ESCUELA NARCISO RABELL CABRERO, SECT. AGAPITO ROSADO, SECT. BEJUCO, SECT. GELO RAMOS, SECT. LABERINTO, SECT. LA PIEDRA, SECT. LA VEGA,",November 29 07:13',November 29 23:00',1001-1500,Scheduled Maintenance,"LUMA has successfully completed repairs and restored power to the area. If you have any questions, please contact us at 1-844-888-5862 (LUMA). "
SAN JUAN,"COND. THE RITZ, SECT. ALTO DEL CABRO",November 29 12:12',November 29 23:00',<500,Unplanned,Our power restoration team is onsite conducting critical repairs to restore power the area as quickly and safely as possible. 
ARECIBO,"URB. MARTELL, URB. OCEAN VIEW, URB. REPARTO MARQUEZ, URB. SAN LORENZO, COMU. BUENOS AIRES, COMU. RODRIGUEZ OLMO, RES. RESIDENCIAL ANTONIO MARQUEZ ARBONA, RES. RESIDENCIAL EXTENSION MANUEL ZENO GANDIA, SECT. CASCO URBANO, URB. EXTENSION SAN LORENZO",November 29 07:13',November 29 23:00',<500,Unplanned,Our power restoration team is onsite conducting critical repairs to restore power the area as quickly and safely as possible. 
,BAYAMON PUEBLO - ACB 4905B.,November 23 10:04',November 30 17:00',<500,Unplanned,Our power restoration team is onsite conducting critical repairs to restore power the area as quickly and safely as possible.
,  TRAMOS CANAS TC -  PORTUGUEZ ,November 22 11:15',November 30 21:00',<500,Unknown,Our power restoration team is onsite conducting critical repairs to restore power the area as quickly and safely as possible.
,   TRAMO DE TAPIA A VILLAMAR,November 21 14:46',November 30 15:00',<500,Unplanned,Our power restoration team is onsite conducting critical repairs to restore power the area as quickly and safely as possible.
,TRAMO > ENTRE LOS ACB'S 7911A - 7925B. ,November 16 20:20',November 30 15:00',<500,Unplanned,Our power restoration team is onsite conducting critical repairs to restore power the area as quickly and safely as possible.