Municipality,Sector,Outage Reported,Estimated Time of Restoration,Estimated Customers Impacted,Category,Current Status
CAROLINA,"COMU. EL RESBALON Y SAN NICOLAS, COND. BALCONES DE CAROLINA, COND. CHALETS DE LA FUENTE, COND. ESTANCIAS DE METROPOLIS, COND. LOMA ALTA VILLAGE, COND. METRO MONTE, COND. MIRAFLORES, COND. PASEO DEL REY, COND. THOMAS VILLE PARK, EDIF. POWER INTERPRISES, IN",December 12 07:55',December 12 14:00',>5000,Unplanned,"LUMA has successfully completed repairs and restored power to the area. If you have any questions, please contact us at 1-844-888-5862 (LUMA). "
, JOBOS T.C. > MAUNABO T.C.,November 30 21:14',December 13 19:00',<500,Unplanned,Our power restoration team is onsite conducting critical repairs to restore power the area as quickly and safely as possible.
,TRAMO > ENTRE LOS ACB'S 7911A - 7925B. ,November 16 20:20',December 13 18:00',<500,Unplanned,Our power restoration team is onsite conducting critical repairs to restore power the area as quickly and safely as possible.
DORADO,,December 12 07:55',December 12 18:00',2001-2500,Scheduled Maintenance,Our power restoration team is onsite conducting critical repairs to restore power the area as quickly and safely as possible. 
SAN JUAN,"COM. CAYO CARIBE, COM. LIGHTS &amp; MORE, COM. LOS CHAVALES, COM. VIVA CARPETS &amp; HOME, COM. YUM YUM TREE, URB. EL VEDADO, URB. HUYKE, URB. ROOSEVELT, AVE. CHARDON, HATO REY NORTE",December 12 07:55',December 12 16:00',501-1000,Scheduled Maintenance,Our power restoration team is onsite conducting critical repairs to restore power the area as quickly and safely as possible. 
CAROLINA,"COND. RIO VISTA, COND. VEREDAS DEL RIO, IND. CAROLINA INDUSTRIAL PARK, IND. INDUSTRIAL VICTORIA, IND. LEDERLE INDUSTRIAL PARK, RES. RESIDENCIAL CATAnITO GARDENS, SECT. CASCO URBANO, URB. JARDINES DE CAROLINA, URB. JOSE SEVERO QUInONES, URB. LOMAS DE CAROL",December 12 07:55',December 12 14:00',1001-1500,Unplanned,Enroute
CAGUAS,"CEM. CEMENTERIO BORINQUEN MEMORIAL PARK 2, CMPG. CENTRAL AUTORIDAD DE ENERGIA ELECTRICA, CMPR. CIUDAD JARDIN DE BAIROA, CMPR. LA SERRANIA, COM. CARIBBEAN CONTAINERS, COME. PLAZA CAGUITAS, COME. VILLA BLANCA PLAZA, COND. LOS PINOS , COND. WINDGATE APARTMEN",December 12 07:55',December 12 17:00',<500,Scheduled Maintenance,Our power restoration team is onsite conducting critical repairs to restore power the area as quickly and safely as possible. 