Municipality,Sector,Outage Reported,Estimated Time of Restoration,Estimated Customers Impacted,Category,Current Status
SAN JUAN,"CMPE. COLEGIO UNIVERSITARIO DE SAN JUAN, CMPG. FEDERAL COURT BUILDINGS, COND. PARQUE CENTRO, COND. SAN JUAN CHATEAU, IND. URBANIZACION INDUSTRIAL TRES MONJITAS, PLAZA LAS AMERICAS, PLAZA LAS AMERICAS, ARTERIAL HOSTOS, HATO REY CENTRO, NEW SAN JUAN, HATO R",July 24 10:30',July 24 16:00',1001-1500,Unplanned,"LUMA has successfully completed repairs and restored power to the area. If you have any questions, please contact us at 1-844-888-5862 (LUMA). "
ISABELA,"CARR #2, WALGREENS",July 24 10:36',July 24 18:00',<500,Scheduled Maintenance,Our power restoration team is onsite conducting critical repairs to restore power the area as quickly and safely as possible. 
GUAYAMA,"VERT. VERTEDERO DE GUAYAMA, BDA. BLONDET, CEM. CEMENTERIO MUNICIPAL VIEJO DE GUAYAMA, CMPD. COMPLEJO DEPORTIVO MUNICIPAL DE GUAYAMA, CMPG. OBRAS PUBLICAS, COMU. CIMARRONA, COND. EGIDA BRISAS DEL MAR ELDERLY, COND. EL LEGADO CHICHI RODRIGUEZ GOLF RESORT, E",July 24 08:54',July 24 18:00',2001-2500,Scheduled Maintenance,Our power restoration team is onsite conducting critical repairs to restore power the area as quickly and safely as possible. 
SAN SEBASTIAN,"EDU. ESCUELA JULIO BABILONIA, SECT. BARRETO HERNANDEZ, SECT. BOSQUES, SECT. SABANA, SECT. SAN LORENZO, SECT. SEGUI, EDU. ESCUELA NARCISO RABELL CABRERO, SECT. AGAPITO ROSADO, SECT. BEJUCO, SECT. GELO RAMOS, SECT. LABERINTO, SECT. LA PIEDRA, SECT. LA VEGA,",July 24 08:45',July 24 18:00',501-1000,Scheduled Maintenance,Our power restoration team is onsite conducting critical repairs to restore power the area as quickly and safely as possible. 
,TRAMO > YAUCO 2 > SAN GERMAN,July 24 08:18',July 24 15:00',<500,Unplanned,Our power restoration team is onsite conducting critical repairs to restore power the area as quickly and safely as possible.
,MANATI TC - VEGA BAJA TC ,July 23 11:47',July 24 10:00',<500,Unplanned,Our power restoration team is onsite conducting critical repairs to restore power the area as quickly and safely as possible.