Municipality,Sector,Outage Reported,Estimated Time of Restoration,Estimated Customers Impacted,Category,Current Status
,"BO. FULLADOZA, PUEBLO, FLAMENCO, PLAYA SARDINAS, BDA. CLARK, BDA. VILLA MUnECO, CEM. CEMENTERIO MUNICIPAL DE CULEBRA, COMU. VILLA FLAMENCO, COND. COSTA BONITA RESOT, SECT. LA ROMANA, URB. ALTURAS DE ZONI, URB. LA PERLA, URB. PLAYA CLARA, URB. PUNTA VIENTO ESTATES",October 31 10:37',November 01 17:00',<500,Unplanned,Our power restoration team is onsite conducting critical repairs to restore power the area as quickly and safely as possible.
COROZAL,"COMU. ANTONIO BERIO, COMU. PADILLA, EDU. ESCUELA ANTONIO RIVERA, EDU. ESCUELA DEMETRIO RIVERA, EDU. ESCUELA PORFIRIO CRUZ GARCIA, IGL. IGLESIA CRISTIANA DISCIPULOS DE CRISTO PALMARITO, SECT. ALTURAS DE PADILLA, SECT. EL ALMENDRO, SECT. EL LLANO, SECT. HOR",October 31 09:46',November 01 19:00',501-1000,Scheduled Maintenance,Our power restoration team is onsite conducting critical repairs to restore power the area as quickly and safely as possible. 
, COSTA SUR S.P. - RADIAL (DEMACO),October 31 07:42',November 01 17:00',<500,Unplanned,Our power restoration team is onsite conducting critical repairs to restore power the area as quickly and safely as possible.
,TRAMO > LLORENS > VILLAMAR,October 28 12:25',November 01 18:00',<500,Unplanned,Our power restoration team is onsite conducting critical repairs to restore power the area as quickly and safely as possible.
JAYUYA,"COMU. MARQUEZ, COMU. SANTA CLARA, SECT. HOYO FRIO, SECT. LA SALSA, SECT. LOS AJOS, SECT. VISTA ALEGRE, URB. ALTURAS DE JAYUYA, URB. JARDINES DE JAYUYA, PARC. ISOLINA",November 01 09:59',November 01 16:15',501-1000,Unplanned,Our power restoration team is onsite conducting critical repairs to restore power the area as quickly and safely as possible. 
GUAYAMA,"COMU. CORAZON, COMU. OLIMPO, SECT. CAIMITAL, SECT. CAIMITAL ALTO, SECT. FINCA LA DESEADA, SECT. SAN MARTIN, URB. ALTURAS DEL OLIMPO, URB. BELLO HORIZONTE, URB. JARDINES DE MONTE OLIVO, URB. PARQUE SAN ANTONIO",November 01 09:00',November 01 17:00',<500,Scheduled Maintenance,Our power restoration team is onsite conducting critical repairs to restore power the area as quickly and safely as possible. 
SABANA GRANDE,"EDU. ESCUELA DAVID ANTONGIORGI CORDOVA, PARC. LIBORIO NEGRON, PARC. RAYO GUARAS, SECT. CERRO GORDO, URB. REPARTO LAS TUNAS, URB. SANTA MARIA",November 01 08:30',November 01 18:00',2501-3000,Scheduled Maintenance,Our power restoration team is onsite conducting critical repairs to restore power the area as quickly and safely as possible. 