Municipality,Sector,Outage Reported,Estimated Time of Restoration,Estimated Customers Impacted,Category,Current Status
,TRAMO > LLORENS > VILLAMAR,October 28 12:25',November 21 23:00',<500,Unplanned,Our power restoration team is onsite conducting critical repairs to restore power the area as quickly and safely as possible.
,"  TRAMO BAYAMON-MAGNOLIA SECT. CHICHARO, SECT. COLLORES, SECT. CRUZ VERGARA, SECT. EL GANDUL, SECT. EL PUNTO, SECT. GOVEO, SECT. ISAAC VERGARA, SECT. LAS NIEVES, SECT. LOS BARROS, SECT. LOS BRAnAS, SECT. LOS FONSECA, SECT. LOS GONZALES, SECT. LOS MULEROS, SECT. PASTO SECO, SECT. PEPIN CABRERA, SECT. PLAYITA, COMU. DAJAOS, SECT. ALGARIN, SECT. CHICHARO, SECT. EL GANDUL, SECT. EL PUEBLITO, SECT. GASCOT, SECT. LA TROCHA, SECT. LOMA DEL VIENTO, SECT. LOS BURGOS, SECT. QUEBRADA HONDA, SECT. RIITO, SECT. LOS JUANES, SECT. LOS COROZOS. URB. ALTURAS DE FLAMBOYAN, URB. GOLDEN HILLS, URB. LOMAS VERDES 4, URB. ROYAL PALM, URB. SANTA JUANITA 3, SECT. TORTUGUERO, URB. BRAULIO DUEnO COLON, URB. EXTENSION FOREST HILLS, URB. FLAMBOYAN GARDENS, URB. ROYAL PALM, URB. VILLA CONTESSA, URB. EXTENSION FOREST HILLS, URB. FOREST VIEW, URB. LOMAS VERDES 4, URB. VILLA CONTESSA. COND. SANTA JUANITA HOUSING, URB. FOREST VIEW, URB. SANTA JUANITA 1, URB. SANTA JUANITA 2, URB. SANTA JUANITA 3, CMPD. BAYAMON SOCCER COMPLEX, SECT. ESTEBAN CRUZ, SECT. LA LOMITA, URB. EL CORTIJO, URB. SANTA JUANITA 1, URB. SANTA JUANITA 5, URB. SANTA JUANITA 6, URB. SANTA JUANITA 7, URB. SANTA JUANITA 8, URB. SUNNY HILLS, EDU. ESCUELA CARLOS ORAMA PADILLA, URB. FOREST VIEW, URB. MAGNOLIA GARDENS, URB. VILLA CONTESSA, COND. PASEO SANTA JUANITA, RES. RESIDENCIAL MAGNOLIA GARDENS, URB. CAMPO ALEGRE, URB. COUNTRY ESTATES, URB. EXTENSION CAMPO ALEGRE, URB. EXTENSION FRANCISCO OLLER, URB. FRANCISCO OLLER, URB. MAGNOLIA GARDENS COND. SANTA JUANITA HOUSING, URB. FOREST VIEW, URB. SANTA JUANITA 1, URB. SANTA JUANITA 2, URB. SANTA JUANITA 3, CMPD. BAYAMON SOCCER COMPLEX, SECT. ESTEBAN CRUZ, SECT. LA LOMITA, URB. EL CORTIJO, URB. SANTA JUANITA 1, URB. SANTA JUANITA 5, URB. SANTA JUANITA 6, URB. SANTA JUANITA 7, URB. SANTA JUANITA 8, URB. SUNNY HILLS, EDU. ESCUELA CARLOS ORAMA PADILLA, URB. FOREST VIEW, URB. MAGNOLIA GARDENS, URB. VILLA CONTESSA, COND. PASEO SANTA JUANITA, RES. RESIDENCIAL MAGNOLIA GARDENS, URB. CAMPO ALEGRE, URB. COUNTRY ESTATES, URB. EXTENSION CAMPO ALEGRE, URB. EXTENSION FRANCISCO OLLER, URB. FRANCISCO OLLER, URB. MAGNOLIA GARDENS",November 19 11:50',November 19 17:00',1001-1500,Unplanned,Enroute
BAYAMON,"CMPD. BAYAMON SOCCER COMPLEX, SECT. ESTEBAN CRUZ, SECT. LA LOMITA, URB. EL CORTIJO, URB. SANTA JUANITA 1, URB. SANTA JUANITA 5, URB. SANTA JUANITA 6, URB. SANTA JUANITA 7, URB. SANTA JUANITA 8, URB. SUNNY HILLS",November 19 11:25',November 19 17:00',1001-1500,Unplanned,Our local power restoration team is being dispatched to the area as soon as possible. 
SAN JUAN,"SECT. LOS NAVARROS, SECT. LOS SANTA, SECT. PEDRO RAMOS, SECT. TOME, EDU. ESCUELA SUPERIOR INES MARIA MENDOZA, SECT. AVELINO LOPEZ, SECT. CAMINO LOS BENITEZ 1, SECT. CAMINO LOS SERRANO, SECT. CAMINO LOS SOLA, SECT. CAMINO PILAR FERREIRA, SECT. CAMINO TABON",November 19 09:09',November 19 18:00',<500,Scheduled Maintenance,Our power restoration team is onsite conducting critical repairs to restore power the area as quickly and safely as possible. 
,TRAMO > MONACILLOS  > PLANTA SAN JUAN,November 18 18:35',November 19 15:00',<500,Unplanned,Our power restoration team is onsite conducting critical repairs to restore power the area as quickly and safely as possible. 
,TRAMO > ENTRE LOS ACB'S 7911A - 7925B. ,November 16 20:20',November 19 22:00',<500,Unplanned,Our power restoration team is onsite conducting critical repairs to restore power the area as quickly and safely as possible.