Municipality,Sector,Outage Reported,Estimated Time of Restoration,Estimated Customers Impacted,Category,Current Status
SAN JUAN,"URB. ATLANTIC VIEW, URB. EXTENSION VILLAMAR, URB. VILLAMAR, URB. VILLAS DEL PALMAR SUR, RES. RESIDENCIAL LUIS LLORENS TORRES, COND. CARRION COURT 5, RES. RESIDENCIAL LUIS LLORENS TORRES, SECT. PARQUE, URB. OCEAN PARK, URB. ATLANTIC VIEW, COND. AZURE BEACH",June 18 17:21',June 18 23:00',2501-3000,3rd Party Damage,"LUMA has successfully completed repairs and restored power to the area. If you have any questions, please contact us at 1-844-888-5862 (LUMA). "
JUANA DIAZ,"COMU. EXTENSION GUAYABAL, COMU. GUAYABAL, EDU. ESCUELA JUANITA RIVERA, SECT. CERRO, SECT. CUEVITAS, SECT. LA COLONIA, SECT. LAS MAGAS, SECT. PASO HONDO, SECT. RINCON, URB. ESTANCIA DEL GUAYABAL, URB. RESIDENCIAL LOMAS, URB. URSULA MILAN, URB. VALLE ESMERA",June 18 07:33',June 18 23:00',1501-2000,Scheduled Maintenance,"LUMA has successfully completed repairs and restored power to the area. If you have any questions, please contact us at 1-844-888-5862 (LUMA). "
GUAYNABO,"BDA. CRUZ MELENDEZ, COND. GRANADA PARK, COND. PORTALES DE ALHELÃ, RES. RESIDENCIAL MARTINEZ NADAL, RES. RESIDENCIAL ROSALEDA, SECT. EL ULTIMO CHANCE, SECT. PEnAGARICANO, URB. EL JARDIN, URB. EXTENSION PARKVILLE TOWN HOUSE, URB. HIGHLAND GARDENS, URB. LOS ",June 18 20:03',June 18 23:00',4001-4500,Unplanned,Our power restoration team is onsite conducting critical repairs to restore power the area as quickly and safely as possible.
SANTA ISABEL,"URB. HACIENDA MIRAFLORES, URB. LAS FUENTES DE COAMO, URB. MANSIONES DE COAMO, URB. PARAISO DE COAMO, URB. PARQUE DE LAS FLORES, URB. REPARTO EL PRADO, URB. REPARTO LOMAS, SECT. LA PICA, SECT. LOMAS DEL EXPRESO, SECT. USERAS, URB. HACIENDA ISABEL, COME. CO",June 18 18:55',June 18 23:00',>5000,Unplanned,Our local power restoration team is being dispatched to the area as soon as possible. 
MAYAGUEZ,URB. VISTA VERDE,June 18 18:14',June 18 23:00',<500,Unplanned,Our local power restoration team is being dispatched to the area as soon as possible. 
,TRAMO > BUENA VISTA > PONCE TC,June 15 19:10',June 19 20:00',<500,Unplanned,Our power restoration team is onsite conducting critical repairs to restore power the area as quickly and safely as possible.
,TRAMO > VIADUCTO > PARQUES Y RECREOS,June 14 03:55',June 20 13:00',<500,Unplanned,Our power restoration team is onsite conducting critical repairs to restore power the area as quickly and safely as possible.