Municipality,Sector,Outage Reported,Estimated Time of Restoration,Estimated Customers Impacted,Category,Current Status
SAN JUAN,"COM. GASOLINERA PUMA, EDU. COLEGIO SANTA MARIA, EDU. ESCUELA SUPERIOR GABRIELA MISTRAL, URB. CAPARRA TERRACE, URB. LA RIVIERA",September 17 23:28',September 18 04:00',1501-2000,Unplanned,Our power restoration team is onsite conducting critical repairs to restore power the area as quickly and safely as possible. 
BARRANQUITAS,"EDU. ESCUELA CAnABON ABAJO, SECT. BARRANCAS PARCELAS NUEVAS, SECT. BARRANCAS PARCELAS VIEJAS, SECT. CAnABON, SECT. EL COLLAO, SECT. LAJITAS, SECT. ORTIZ, SECT. LA PAJONA, SECT. LOS ALVARADO, SECT. MANA",September 17 22:54',September 18 05:00',2001-2500,Unplanned,Our local power restoration team is being dispatched to the area as soon as possible. 
,TRAMO > BARRANQUITAS > OROCOVIS,September 17 19:57',September 18 17:00',<500,Unplanned,Our power restoration team is onsite conducting critical repairs to restore power the area as quickly and safely as possible.
,TRAMO YAHUECAS-ADJUNTAS  ,September 17 15:09',September 18 17:00',<500,Unplanned,Our power restoration team is onsite conducting critical repairs to restore power the area as quickly and safely as possible.
,AGUAS BUENAS G.I.S. - SABANA LLANA T.C,September 17 07:45',September 18 17:00',<500,Unknown,Our power restoration team is onsite conducting critical repairs to restore power the area as quickly and safely as possible.