Municipality,Sector,Outage Reported,Estimated Time of Restoration,Estimated Customers Impacted,Category,Current Status
MAYAGUEZ,"EDU. ESCUELA MARIA LUISA ARCELAY, RES. RESIDENCIAL SABALOS GARDENS, URB. EXTENSION VILLAS DEL OESTE, URB. VILLAS DEL OESTE, HOSP. CENTRO MEDICO DOCTOR RAMON EMETERIO BETANCES",May 24 12:25',May 24 18:00',4501-5000,Unplanned,"LUMA has successfully completed repairs and restored power to the area. If you have any questions, please contact us at 1-844-888-5862 (LUMA). "
RINCON,"COND. RINCON BAY VILLAS, COND. VISTA DEL MAR Y SOL, FGM. EL FARO DE RINCON, URB. COLINAS DE ENSENADA, COME. RINCON SHOPPING CENTER, COMU. STELLA, COND. CHALET DEL MAR, COND. COCONUT COURT, COND. EL DELFIN, COND. LAS CORONAS, COND. LOS ALMENDROS, COND. RIN",May 24 10:34',May 24 16:00',<500,Unplanned,"LUMA has successfully completed repairs and restored power to the area. If you have any questions, please contact us at 1-844-888-5862 (LUMA). "
ARECIBO,"SECT. JARDINES DE FACTOR, URB. LOS JARDINES, SECT. ANIMAS, URB. ESTANCIAS BALSEIRO, URB. PASEOS REALES, COMU. NUEVAS SABANA HOYOS 2, EDU. ESCUELA SABANA HOYOS, SECT. ALLENDE, SECT. ANIMAS, SECT. BALLAJA, SECT. CAROLINA, SECT. JARDINES DE CANDELARIA, SECT.",May 24 14:05',May 24 19:00',3501-4000,Unplanned,Our local power restoration team is being dispatched to the area as soon as possible. 
SAN GERMAN,CAIN ALTO,May 24 08:40',May 24 17:00',1001-1500,Scheduled Maintenance,Our power restoration team is onsite conducting critical repairs to restore power the area as quickly and safely as possible. 
FAJARDO,"BDA. VEVE CALZADA, PARC. LUIS M CINTRON, SECT. CASCO URBANO, URB. LA ALHAMBRA",May 24 08:15',May 24 15:00',501-1000,Unknown,Our power restoration team is onsite conducting critical repairs to restore power the area as quickly and safely as possible. 
SAN JUAN,"ARE. FACILIDADES RECREATIVAS PARQUE ESCORIAL, CMPR. PARQUE ESCORIAL, COMU. SAINT JUST, COND. ALTURAS DE PARQUE ESCORIAL, COND. COLINAS DE SAN JUAN, COND. JARDINES DE PARQUE ESCORIAL, COND. PAISAJES DEL ESCORIAL, COND. PALACIOS DEL ESCORIAL, COND. PARQUE D",May 24 06:27',May 24 19:00',<500,Scheduled Maintenance,Our power restoration team is onsite conducting critical repairs to restore power the area as quickly and safely as possible. 
SAN JUAN,"EDU. COLEGIO SAN ANTONIO, EDU. COLEGIO SAN JOSE, URB. EXTENSION SAN AGUSTIN, URB. PARK GARDENS, URB. REPARTO UNIVERSITARIO",May 24 01:15',May 24 16:00',<500,Unplanned,Our power restoration team is onsite conducting critical repairs to restore power the area as quickly and safely as possible. 
,"YAUCO 1 - ADJUNTAS T.O. INDIERA A BARTOLO FUERA DE SERVICIO   IND. HACIENDA CAFETELERA RIO PRIETO, SECT. EL 22, SECT. EL 30, SECT. LAS PARCELAS, SECT. LOS SAPOS, SECT. RENTAS, IND. HACIENDA CAFETALERA DELFINA, IND. HACIENDA CAFETALERA LLANADAS, IND. HACIENDA CARACOLILLO, SECT. CARRIZALES, SECT. CHAGO MENDEZ, SECT. EL 22, SECT. EL QUEMAO, SECT. INDIO URAYON, SECT. JUSTINIANO, SECT. LA SALVACION, SECT. LAS SESENTA, SECT. LAS TORRES, SECT. LA UNION, SECT. LLANADAS, SECT. LOS SAPOS, SECT. ORANGE, SECT. PEDRO JUSTINIANO, SECT. SANTA TERESA, SECT. CARRIZALES, SECT. LA SALVACION, SECT. SANTA CRUZ, SECT. SANTA TERESA  EDU. ESCUELA MANUAL ROJAS LUZARDO, HACIENDA PONS, CALVACHE, VISTA EL LAGO, SECT. CATAnO, SECT. EL MANGO, EDU. ESCUELA JULIO LEBRON SOTO, SECT. CERRO LAS AVISPAS, SECT. POBLADO CASTAnER  CEM. CEMENTERIO ADJUNTAS, COMU. GUILARTE, EDU. ESCUELA FRANCISCO PIETRI MARIANI, SECT. CERRO NOVILLO, SECT. CUESTA LOS HERNANDEZ, SECT. CUESTA MALDONADO, SECT. EL MAJAGUAL, SECT. EL VALLE, SECT. HELECHALES, SECT. LA LLOROSA, SECT. LAS CASITAS, SECT. PARCELAS TITULO QUINTO, SECT. SALICETTI Y BATISTA, SECT. VILLA PEREZ, SECT. HELECHALES, SECT . LOMA SANTA, SECT. PALO SECO, SECT. YAHUECAS ARRIBA   ",May 24 00:36',May 24 16:00',<500,Unknown,Our power restoration team is onsite conducting critical repairs to restore power the area as quickly and safely as possible.