Municipality,Sector,Outage Reported,Estimated Time of Restoration,Estimated Customers Impacted,Category,Current Status
ARECIBO,"COMU. JUAN A. DIAZ CRESPO, COMU. VILLA ROSA, PARC. MATTEI, SECT. BOQUERON, SECT. CANTA GALLO, SECT. CIENEGUETA, SECT. COMBATE, SECT. CUATRO CALLES, SECT. CUCHI 1, SECT. GUAYABOTA, SECT. JOYA LOS YAMBO, SECT. JUEGO DE BOLAS, SECT. LA GUINEA, SECT. LOS CACA",January 18 14:01',January 18 20:00',2501-3000,Unplanned,Our local power restoration team is being dispatched to the area as soon as possible. 
TRUJILLO ALTO,"URB. ALAMEIN, URB. EXTENSION VILLA CAPRI, URB. PARK GARDENS, URB. VENUS GARDENS SUR, URB. VILLA ANDALUCIA, URB. VILLA CAPRI, URB. VILLA CAPRI COURT, URB. VILLA ROSALES, COME. UNIVERSAL PLAZA, COND. CAMINO TERRA VERDE, COND. COOPERATIVA JARDINES DE TRUJILL",January 18 10:58',January 18 17:00',501-1000,Scheduled Maintenance,Our power restoration team is onsite conducting critical repairs to restore power the area as quickly and safely as possible. 
AGUADILLA,"COMU. PALMAR, RES. RESIDENCIAL JOSE AGUSTIN APONTE, SECT. AGUADILLA PUEBLO, SECT. AVENIDA LOS CORAZONES, SECT. CERRO VISBAL, SECT. GONZALO, SECT. MONTE BRUJO",January 18 07:40',January 18 18:00',1501-2000,Scheduled Maintenance,Our power restoration team is onsite conducting critical repairs to restore power the area as quickly and safely as possible. 
SAN JUAN,"COND. HACIENDA LAS CEIBAS, SECT. LOS ROMEROS, URB. LA MAGA DE MONTEHIEDRA, URB. MONTEHIEDRA",January 18 06:24',January 18 17:00',<500,Scheduled Maintenance,Our power restoration team is onsite conducting critical repairs to restore power the area as quickly and safely as possible. 
SAN JUAN,"SECT. PAJILLAS, COND. BEVERLY HILLS COURT, COND. EGIDA ASOCIACION DE MIEMBROS DE LA POLICIA DE PUERTO RICO, COND. VISTA DE LOS FRAILES, EDU. ESCUELA ALEJANDRO JUNIOR CRUZ, PARC. LOPEZ CASES, SECT. ANTONIO GONZALEZ, SECT. CAMINO NUEVO HORIZONTE, SECT. CORE",January 18 06:24',January 18 17:00',501-1000,Scheduled Maintenance,Our power restoration team is onsite conducting critical repairs to restore power the area as quickly and safely as possible. 
HUMACAO,"COND. AQUABELLA, COND. BEACH VILLAGE, COND. CRESCENT BEACH, COND. CRESCENT COVE, COND. FAIRLAKES 3, COND. FAIRLAKES VILLAGE, COND. FAIRWAY COURTS, COND. FAIRWAY COURTS VILLAS, COND. HACIENDAS DE PALMAS, COND. HARBOUR LAKES, COND. LA JOLLA, COND. LAS VILLA",January 17 23:03',January 18 18:00',<500,Unplanned,Our local power restoration team is being dispatched to the area as soon as possible. 