Municipality,Sector,Outage Reported,Estimated Time of Restoration,Estimated Customers Impacted,Category,Current Status
MOCA,"PARC. LASSALLE, SECT. AVILES, SECT. BARRETO HERNANDEZ, SECT. CALLEJON LORENZO, SECT. CARDONA, SECT. CORTADERA, SECT. EL EMPALME, SECT. EL TAMARINDO, SECT. ILLAS, SECT. LASSALLE, SECT. MAGUEYES, SECT. NIEVES, SECT. PUNTA BRAVA, SECT. SABANA, SECT. VARGAS, ",April 26 08:52',April 26 15:00',501-1000,Unplanned,Our power restoration team is onsite conducting critical repairs to restore power the area as quickly and safely as possible. 
COROZAL,"COMU. GUARICO, PARC. MEDINA, SECT. BRUGUERA, SECT. GUARICO, SECT. JULIAN MARRERO, SECT. LOS GUARDIAS, SECT. LOS LLANOS, SECT. PANCHO FEBUS, SECT. POMITO, SECT. TONO PATENTE, URB. ESTANCIAS DE PALMAREJO, URB. MONTERREY",April 26 08:27',April 26 15:00',2501-3000,Unplanned,Our local power restoration team is being dispatched to the area as soon as possible. 
VEGA BAJA,BO. ALMIRANTE NORTE PR 160 A PARTIR DEL KM 4.9 Y BO. ALMIRANTE SUR DE VEGA BAJA,April 26 08:23',April 26 16:30',501-1000,Scheduled Maintenance,Our power restoration team is onsite conducting critical repairs to restore power the area as quickly and safely as possible. 
NARANJITO,"EDU. ESCUELA ROSA LUZ ZAYAS, SECT. CAMINO MERO MORALES, SECT. CAMINO TOnO NIEVES, SECT. CASCO URBANO, SECT. EL BLANCO, SECT. EL BRONCO, SECT. EL CERRO, SECT. EL PALMAR, SECT. FEIJO, SECT. FERRER, SECT. HIGUILLALES, SECT. LA MAYA, SECT. LAS CRUCES, SECT. L",April 26 07:32',April 26 19:00',<500,Scheduled Maintenance,Our power restoration team is onsite conducting critical repairs to restore power the area as quickly and safely as possible. 
,BALDRICH-ACB 3201B MAPFRE,April 21 05:33',April 30 19:00',<500,Unknown,Our power restoration team is onsite conducting critical repairs to restore power the area as quickly and safely as possible.
,TRAMO > MONACILLOS > CENTRO MEDICO,April 17 18:10',April 30 21:00',<500,Unplanned,Our power restoration team is onsite conducting critical repairs to restore power the area as quickly and safely as possible.