Municipality,Sector,Outage Reported,Estimated Time of Restoration,Estimated Customers Impacted,Category,Current Status
AGUADILLA,"COME. BORINQUEN TOWN PLAZA, COND. PUERTA DEL MAR, HOSP. HOSPITAL BUEN SAMARITANO, HTL. HOTEL EL FARO, RES. RESIDENCIAL AGUSTIN STAHL, RES. RESIDENCIAL JOSE DE DIEGO, SECT. EL COBO, SECT. LOS ROBLES CUESTA VIEJA, SECT. PLAYUELA, SECT. REPARTO RAMOS, SECT. ",March 17 07:49',March 17 17:00',1001-1500,Scheduled Maintenance,"LUMA has successfully completed repairs and restored power to the area. If you have any questions, please contact us at 1-844-888-5862 (LUMA). "
SAN JUAN,"COM. BASKIN-ROBBINS, COME. SAN PATRICIO PLAZA, COM. KENTUCKY FRIED CHICKEN, COM. PARTY CITY, COM. PIZZA HUT, COND. PLAZA ATHENEE, URB. ALTURAS DE SAN PATRICIO, URB. CAPARRA HILLS, URB. CAPARRA HILLS VILLAGE",March 17 14:36',March 17 20:00',<500,Unplanned,Our local power restoration team is being dispatched to the area as soon as possible. 
,"BALDRICH A ESCUELA INDUSTRIAL   BDA. ALDEA DEL BIEN, COND. CALLE GUAYAMA 136, URB. QUINTANA, COND. PARQUE REAL, IGL. PARROQUIA ESPIRITU SANTO, URB. FLORAL PARK, URB. QUINTANA, CMPE. UNIVERSIDAD POLITECNICA DE PUERTO RICO, EDIF. SANTANDER MORTGAGE PLAZA, BDA. ALDEA DEL BIEN, COND. JARDINES DE GUAYAMA, SECT. HATO REY, SECT. JURUTUNGO (ALDEA DEL BIEN), URB. QUINTANA, RES. RESIDENCIAL JARDINES DE QUINTANA, BDA. BITUMUL, BDA. ISRAEL, COM. GASOLINERA TEXACO, COND. VIRGINIA 214, EDU. ESCUELA JUANITA GARCIA PERAZA, URB. DAVILA LLENZA, URB. QUINTANA  COND. COOPERATIVA DE VIVIENDA JARDINES DE VALENCIA, URB. SAN JOSE, URB. VALENCIA, CMPE. UNIVERSIDAD DE PUERTO RICO RECINTO RIO PIEDRAS, EDU. ESCUELA VOCACIONAL METROPOLITANA MIGUEL SUCH, RES. RESIDENCIAL MANUEL A. PEREZ, URB. VILLA CADIZ, BDA. ALDEA DEL BIEN, COM. GASOLINERA GULF, EDU. ESCUELA GUSTAVO ADOLFO BECQUER, SECT. JURUTUNGO (ALDEA DEL BIEN), URB. PEREZ MORRIS, URB. PEREZ MORRIS, CMPE. UNIVERSIDAD DE PUERTO RICO RECINTO RIO PIEDRAS, COND. DOS PINOS, COND. LOS ANGELES HOUSING, RES. RESIDENCIAL LOPEZ SICARDO, SECT. CAPETILLO, SECT. SABANA LLANA, SECT. VICTORIA, URB. COOPERATIVA, URB. VALLE UNIVERSITARIO   ",March 17 12:22',March 17 18:00',2501-3000,Unplanned,Our power restoration team is onsite conducting critical repairs to restore power the area as quickly and safely as possible. 
SAN JUAN,"BDA. BUEN CONSEJO, BDA. VENEZUELA, CEM. CEMENTERIO VILLA NEVAREZ, CMPE. JARDIN BOTANICO, COND. EL PARAISO, COND. PARADISE COURT, COND. PARADISE COURT 2, COND. PARK GARDENS COURT, EDU. COLEGIO SAN JOSE, IND. SAN JOSE, IND. URBANIZACION INDUSTRIAL EL CINCO,",March 16 03:55',March 17 17:00',<500,Unplanned,Our power restoration team is onsite conducting critical repairs to restore power the area as quickly and safely as possible. 
,TRAMO DE PUERTA DE TIERRAS -COVADONGA GIS,March 12 10:39',March 17 16:00',<500,Unplanned,Our power restoration team is onsite conducting critical repairs to restore power the area as quickly and safely as possible.