Municipality,Sector,Outage Reported,Estimated Time of Restoration,Estimated Customers Impacted,Category,Current Status
GUAYAMA,"SECT. BUENOS AIRES, URB. BRISAS DEL MAR, URB. JARDINES DE LAFAYETTE, URB. MINIMA, URB. PARQUES DE GUASIMAS, URB. VILLAS DE LAFAYETT , URB. VISTAS DE ARROYO, URB. BRISAS DE COSTA REAL, URB. COSTA REAL, URB. MONTE REAL, URB. PALMAR DEL REY, URB. VILLA REAL,BDA. MOSQUITO, CMPG. COMPLEJO CORRECCIONAL DE GUAYAMA, COMU. BARRANCA, COMU. MIRAMAR, COMU. NUEVO AMANECER, COMU. POZUELO, COMU. SAN MARTIN, COMU. SANTA ANA, COND. EL LEGADO CHICHI RODRIGUEZ GOLF RESORT, EDU. ESCUELA JOSE MUnOZ VAZQUEZ, IND. PLANTA DE HORMIGON, IND. ZONA INDUSTRIAL, SECT. COLONIA REUNION, SECT. FINCA LA JUANA, SECT. LAS MAREAS, SECT. PUERTO JOBOS, SECT. VILLODAS, URB. BRISAS DE FLAMBOYAN, URB. CARIBE MAR, URB. ESTANCIA DE ADELA, URB. ESTANCIAS DE VISTA HERMOSA, URB. HACIENDA GUAMANI, URB. JARDINES DE LA REINA, URB. VILLA DEL MAR CARIBE, URB. VILLA PARAISO, COMU. CIMARRONA, BDA. SAN FELIPE, ARE. AREA RECREATIVA, CMPD. COMPLEJO DEPORTIVO MUNICIPAL DE GUAYAMA, CMPE. INSTITUTO TECNOLOGICO DE PUERTO RICO RECINTO GUAYAMA, COME. LA FUENTE TOWN CENTER, COME. PLAZA DEL MERCADO DE GUAYAMA, COME. SAN VICENTE MALL, EDU. ACADEMIA SAN ANTONIO, EDU. ESCUELA SUPERIOR DOCTOR RAFAEL LOPEZ LANDRON, RES. RESIDENCIAL CALIMANO, RES. RESIDENCIAL EL COQUI, RES. RESIDENCIAL JARDINES DE GUAMANI, RES. RESIDENCIAL LUIS PALES MATOS, SECT. CASCO URBANO, SECT. CENTRAL MACHETE, SECT. LOMA DEL VIENTO, SECT. ZONA INDUSTRIAL SECTOR MELANIA, URB. BRISAS DEL MAR, URB. CHALETS DE BRISAS DEL MAR, URB. CIUDAD UNIVERSITARIA, URB. CIUDAD UNIVERSITARIA 4, URB. EXTENSION VALLES DE GUAYAMA, URB. GIBRALTAR, URB. GUAYAMA VALLEY, URB. HACIENDA VISTA HERMOSA, URB. JARDINES DE GUAMANI, URB. LA HACIENDA, URB. LA PRADERA, URB. PARQUE DE LA INTERAMERICANA, URB. VALLES DE GUAYAMA, URB. VILLA MAR, URB. VILLA ROSA 1, URB. VILLA UNIVERSITARIA, URB. VISTA DEL SOL, URB. VIVES, VERT. VERTEDERO DE GUAYAMA, BDA. BLONDET, CEM. CEMENTERIO MUNICIPAL VIEJO DE GUAYAMA, CMPD. COMPLEJO DEPORTIVO MUNICIPAL DE GUAYAMA, CMPG. OBRAS PUBLICAS, COMU. CIMARRONA, COND. EGIDA BRISAS DEL MAR ELDERLY, COND. EL LEGADO CHICHI RODRIGUEZ GOLF RESORT, EDU. ESCUELA LUIS A. RIVERA, FGM. CENTRO DE CONVENCIONES DE GUAYAMA, HTL. MOLINO INN, RES. RESIDENCIAL CALIMANO, RES. RESIDENCIAL VALLES DE GUAYAMA, SECT. CASCO URBANO, SECT. PASEO DEL PUEBLO, URB. BRISAS DEL MAR, URB. CAMINO DE LA PRINCESA, URB. ESTANCIAS DE DULCE SUEnO, URB. GUAYAMA VALLEY, URB. HACIENDA LOS RECREOS, URB. VILLA CARIBE",May 04 11:50',May 04 16:00',>5000,Unplanned,Our power restoration team is onsite conducting critical repairs to restore power the area as quickly and safely as possible. 
VEGA ALTA,"COME. PLAZA DORADA SHOPPING CENTER, COM. GASOLINERA PUMA, COND. FAIRWAYS VILLAGE, COND. THE GREENS, IGL. IGLESIA NORTH POINT BAPTIST CHURCH, URB. DORADO BEACH COTTAGES, URB. DORADO BEACH EAST, URB. DORADO BEACH ESTATES, URB. DORADO COUTRY STATE, URB. DORA",May 04 10:38',May 04 17:00',501-1000,Unplanned,Our power restoration team is onsite conducting critical repairs to restore power the area as quickly and safely as possible. 
CAGUAS,"CEM. CEMENTERIO BORINQUEN MEMORIAL PARK 1, SECT. EL COQUI, SECT. GUASABARA, SECT. LA BARRA, SECT. LA GUASABARA, SECT. LA LIGA, SECT. LA MESA, SECT. LA PONDEROSA, SECT. LOS CURAS, SECT. LOS MUCHOS, SECT. REPARTO SOLANO, SECT. SUR DE LAS AMERICAS, URB. LAKE",May 04 10:38',May 04 16:00',2001-2500,Unplanned,Our local power restoration team is being dispatched to the area as soon as possible. 
HUMACAO,"CEM. CEMENTERIO VERDE MAR, COMU. JUNQUITO, EDU. ESCUELA JOSE TORO RIOS, IND. BRISTOL MYERS SQUIBB, PARC. BAJANDAS, SECT. ALTURAS DE JUNQUITO, SECT. PARCELAS EL BATEY, URB. ALTURAS DE BUSO, URB. ALTURAS DEL ESTE, URB. CIUDAD CRISTIANA, URB. EL RETIRO, URB.",May 04 08:15',May 04 18:00',<500,Scheduled Maintenance,Our power restoration team is onsite conducting critical repairs to restore power the area as quickly and safely as possible. 
MAYAGUEZ,"URB. ALTURAS DE MAYAGUEZ, URB. PASEO LOS ROBLES, SECT. MILLO COTES, SECT. QUEBRADA LARGA, COM. RESTAURANTE EL COCHE, COND. PLAYA ALMIRANTE, EDU. ESCUELA MARIANA BRACETTI, PARC. LAS MARIAS, SECT. AJIES, SECT. JUAN VEGA, SECT. LA CHOZA, SECT. LA TOSCA, URB.",May 04 07:48',May 04 17:00',>5000,Scheduled Maintenance,Our power restoration team is onsite conducting critical repairs to restore power the area as quickly and safely as possible. 
ARROYO,"ARE. PARQUE DE PELOTA, CMPT. VILLAS DE PUNTA GUILARTE, COND. ARROYO BEACH RESORT, COND. CAMPO MAR, COND. MAR DEL SUR, COND. VILLA DE PUNTA GUILARTE, COND. VILLA PHI DELTA, PARC. NUEVAS LA PALMA, PARC. VIEJAS LA PALMA, SECT. ACUEDUCTO, SECT. CONCORDIA, SEC",May 04 07:48',May 04 13:00',2001-2500,Unplanned,Our local power restoration team is being dispatched to the area as soon as possible. 
MOCA,"EDU. ESCUELA NARCISO BOSQUE SOTO, SECT. AVILES, SECT. BOSQUES, SECT. LOS FIGUEROA, SECT. BRISAS DE CAMPO ALEGRE",May 04 01:35',May 04 17:00',<500,Unplanned,Our power restoration team is onsite conducting critical repairs to restore power the area as quickly and safely as possible. 
GUAYAMA,"CMPA. CLUB DE TROTAMUNDOS, COMU. AMELIA MARIN, COMU. BRANDERI, EDU. ACADEMIA ADVENTISTA, HTL. BRANDEMAR, URB. JARDINES DE MONTE OLIVO",May 03 22:36',May 04 13:00',4501-5000,Unplanned,Our local power restoration team is being dispatched to the area as soon as possible. 
GUAYNABO,"BDA. ROMERO, COND. ALAMANDA, COND. EL BOSQUE, COND. EMERALD COURT, COND. MONTE DE LOS FRAILES, COND. MONTE VERDE, COND. PARCKVILLE PLAZA, COND. PRADOS DEL MONTE, COND. QUINTA VALLE, COND. RIDGE TOP LUXURY APARTMENTS, COND. VILLAS DE GUAYNABO, COND. VILLAS",May 03 13:10',May 04 18:00',<500,Unplanned,Our power restoration team is onsite conducting critical repairs to restore power the area as quickly and safely as possible. 