Municipality,Sector,Outage Reported,Estimated Time of Restoration,Estimated Customers Impacted,Category,Current Status
PONCE,"COND. ESTANCIAS DEL MADRIGAL, EDU. ESCUELA ELEMENTAL AUREA E. RIVERA COLLAZO, PARC. MAGUEYES, PARC. NUEVAS MAGUEYES, SECT. CAMINO VIEJO, URB. EL MADRIGAL, URB. ESTANCIAS DEL GOLF CLUB, URB. EXTENSION EL MADRIGAL, URB. LAS DELICIAS, URB. LAS DELICIAS 2DA S",April 06 06:47',April 06 13:00',<500,Unplanned,"LUMA has successfully completed repairs and restored power to the area. If you have any questions, please contact us at 1-844-888-5862 (LUMA). "
,TRAMO DE PUERTA DE TIERRAS -COVADONGA GIS,March 12 10:39',April 14 18:00',<500,Unplanned,Our power restoration team is onsite conducting critical repairs to restore power the area as quickly and safely as possible.
RINCON,"EDU. ESCUELA GREGORIO RODRIGUEZ ORAMA, EDU. ESCUELA JOSE GONZALES RUIZ, SECT. CABO DIAZ, SECT. CARLOS CONCEPCION, SECT. CARLOS RUIZ, SECT. CHELE FIGUEROA, SECT. CLOTILDE CHAPARRO, SECT. COLOMBANI, SECT. CORDERO, SECT. CUESTA BEATRIZ, SECT. CUEVA DEL INDIO",April 06 10:20',April 06 17:00',501-1000,Scheduled Maintenance,Our power restoration team is onsite conducting critical repairs to restore power the area as quickly and safely as possible. 
GUAYNABO,"BDA. ROMERO, COM. DEYA ELEVATOR SERVICES, SECT. BO. SANTA ROSA I, SECT. ELENO RENTAS, SECT. EL HOYO, SECT. EL LLANO, SECT. ENSANCHEZ  LOPEZ, SECT. LA APAMA I, SECT. LA TRINCHERA, SECT. LOS LOPEZ, SECT. LOS LOSADA, SECT. LOS MARREROS, SECT. LOS RESTOS, SEC",April 06 10:00',April 06 18:00',4501-5000,Scheduled Maintenance,Our power restoration team is onsite conducting critical repairs to restore power the area as quickly and safely as possible. 
SAN JUAN,"URB. CAPARRA TERRACE COM. ALMACENES, COM. CENTRO DE BATERIAS AC DELCO, COM. FARMACIA PROFESSIONAL DRUG, COM. MOZZARELLA, COM. OLBM REPARACION & DESBLOQUEO, COM. RUMMY FASHION, COM. TACO BELL/PIZZA HUT, URB. CAPARRA TERRACE, URB. PUERTO NUEVO",April 06 09:40',April 06 15:00',1001-1500,Unplanned,Our local power restoration team is being dispatched to the area as soon as possible. 
ARECIBO,"COMU. VICTOR ROJAS 1, RES. RESIDENCIAL EXTENSION MANUEL ZENO GANDIA, RES. RESIDENCIAL MANUEL ZENO GANDIA, SECT. COMBATE, URB. ALTURAS DE JUNCOS, URB. ALTURAS DE SAN FELIPE, URB. JARDINES DE JUNCOS, URB. PASEO SAN FELIPE, URB. REPARTO DIOCESANO, URB. REPAR",April 06 08:55',April 06 16:00',2001-2500,Scheduled Maintenance,Our power restoration team is onsite conducting critical repairs to restore power the area as quickly and safely as possible. 
PONCE,"COND. AURORA APARTMENTS, SECT. CASCO URBANO, URB. SANTA MARIA",April 06 08:50',April 06 16:00',501-1000,Scheduled Maintenance,Our power restoration team is onsite conducting critical repairs to restore power the area as quickly and safely as possible. 
,VEGA BAJA - DORADO ,April 06 04:58',April 06 16:00',<500,Unplanned,Our power restoration team is onsite conducting critical repairs to restore power the area as quickly and safely as possible. 
HORMIGUEROS,"COM. CLUB DEPORTIVO DEL OESTE, COND. BAHIA SERENA, COND. CORAL BEACH, COND. PERLE DU MER, COND. PLAYA AZUL, COND. PUNTA ARENAS, COND. SEA VIEW, COND. SERENITY BY THE SEA , EDU. EASTERN UNIVERSITY, EDU. ESCUELA SEGUNDA UNIDAD BARRIO PUERTO REAL, HTL. MOTEL",April 05 22:13',April 06 15:00',<500,Unplanned,Our power restoration team is onsite conducting critical repairs to restore power the area as quickly and safely as possible. 