Municipality,Sector,Outage Reported,Estimated Time of Restoration,Estimated Customers Impacted,Category,Current Status
SAN JUAN,"COND. ALTAMESA GARDENS, COND. CHALETS DE LANDRAU, COND. PARQUE DE MONACILLOS, COND. PORTALES DE ALTAMESA, COND. PORTAL URBANO 1, COND. SAN IGNACIO, RES. RESIDENCIAL EL MANANTIAL, SECT. MONACILLO, URB. ALTAMESA, URB. COLLEGE PARK, URB. REPARTO LANDRAU",May 01 21:03',May 01 23:00',501-1000,Unplanned,"LUMA has successfully completed repairs and restored power to the area. If you have any questions, please contact us at 1-844-888-5862 (LUMA). "
SAN JUAN,"SECT. CATEDRAL, VIEJO SAN JUAN, COND. PARQUE DE LAS PALOMAS, HTL. HOTEL EL CONVENTO, SECT. CATEDRAL, COND. PILAR COMERCIAL 258, SECT. CATEDRAL, SECT. SAN FRANCISCO, COND. PLAZA 152, SECT. CATEDRAL",May 01 16:21',May 01 22:00',<500,Unplanned,"LUMA has successfully completed repairs and restored power to the area. If you have any questions, please contact us at 1-844-888-5862 (LUMA). "
CAROLINA,"CMPA. CENTRO DE ACTIVIDADES ARREVICA, COME. PLAZA CAROLINA MALL SHOPPING CENTER, URB. VALLE ARRIBA HEIGHTS, URB. VILLA CAROLINA 3RA EXTENSION, URB. VILLA FONTANA, URB. VILLA FONTANA PARK, RES. RESIDENCIAL MANUEL A. PEREZ",April 30 16:52',May 01 21:00',<500,Unplanned,"LUMA has successfully completed repairs and restored power to the area. If you have any questions, please contact us at 1-844-888-5862 (LUMA). "
SAN JUAN,"COND. PARQUE REAL, IGL. PARROQUIA ESPIRITU SANTO, URB. FLORAL PARK, URB. QUINTANA, CMPE. UNIVERSIDAD POLITECNICA DE PUERTO RICO, EDIF. SANTANDER MORTGAGE PLAZA",May 01 21:03',May 01 23:00',1001-1500,Unplanned,Our power restoration team is onsite conducting critical repairs to restore power the area as quickly and safely as possible.
SAN JUAN,"BDA. ALDEA DEL BIEN, COND. CALLE GUAYAMA 136, URB. QUINTANA",May 01 21:03',May 01 23:00',501-1000,Unplanned,Our power restoration team is onsite conducting critical repairs to restore power the area as quickly and safely as possible.
SAN JUAN,"COND. PARANA REAL, COND. RIGHT COURT, COND. RODANO, URB. EL PARAISO, URB. PARADISE HILLS, URB. RIO PIEDRAS HEIGHTS, URB. SAN GERARDO",May 01 21:03',May 01 23:00',<500,Unplanned,Enroute
,DOS BOCAS- CIALES,April 29 17:45',May 03 20:00',<500,Unplanned,Our power restoration team is onsite conducting critical repairs to restore power the area as quickly and safely as possible.