Municipality,Sector,Outage Reported,Estimated Time of Restoration,Estimated Customers Impacted,Category,Current Status
GUAYNABO,"BDA. ROMERO, COND. ALAMANDA, COND. EL BOSQUE, COND. EMERALD COURT, COND. MONTE DE LOS FRAILES, COND. MONTE VERDE, COND. PARCKVILLE PLAZA, COND. PRADOS DEL MONTE, COND. QUINTA VALLE, COND. RIDGE TOP LUXURY APARTMENTS, COND. VILLAS DE GUAYNABO, COND. VILLAS",May 03 13:10',May 03 19:00',3501-4000,Unplanned,Our power restoration team is onsite conducting critical repairs to restore power the area as quickly and safely as possible.
SAN JUAN,"CMPS. CENTRO MEDICO, URB. REPARTO METROPOLITANO, URB. VILLA NEVAREZ",May 03 12:20',May 03 17:00',1501-2000,Unplanned,Our local power restoration team is being dispatched to the area as soon as possible. 
YAUCO,"BDA. ARTURO LLUBERAS, PARC. ALMACIGO BAJO, PARC. NUEVAS, SECT. BARRIO ALGARROBO, SECT. CAnITA, SECT. COLLORES, SECT. CUESTA LOS PADILLA, SECT. EL ROCIO, SECT. EL SIETE, SECT. FACIO, SECT. FECO BONILLA, SECT. LA LINTERNA, SECT. LOS CRUCEROS, SECT. LOS HERN",May 03 12:12',May 03 18:00',2001-2500,Unplanned,Our power restoration team is onsite conducting critical repairs to restore power the area as quickly and safely as possible. 
SAN JUAN,"COND. VILLA OLIMPICA, EDU. ESCUELA ELEMENTAL LAS VIRTUDES, PARC. FALU, RES. RESIDENCIAL MANUEL A. PEREZ, URB. LAS VIRTUDES, URB. ROSENDO MATIENZO CINTRON, URB. VILLA OLIMPICA",May 03 11:50',May 03 17:00',501-1000,Unplanned,Our local power restoration team is being dispatched to the area as soon as possible. 
VILLALBA,"BDA. COOPERATIVA, BDA. NUEVA, COMU. HACIENDA EL MAYORAL, COMU. JARDINES DE VILLA BLANCA, COND. ESTANCIAS DEL MAYORAL, SECT. CASCO URBANO, SECT. EL CERCAO, SECT. EL CHICHON, SECT. EL COLLADO, SECT. EL HOYO, SECT. EL MAGUEY, SECT. EL PUENTE, SECT. EL SEMIL,",May 03 10:26',May 03 18:00',<500,Scheduled Maintenance,Our power restoration team is onsite conducting critical repairs to restore power the area as quickly and safely as possible. 
NARANJITO,"SECT. POMITO, CEM. CEMENTERIO MUNICIPAL DE NARANJITO, EDU. ESCUELA ELEMENTAL JOSEFINA MARRERO FEBUS, EDU. ESCUELA FIDEL G. PADILLA, EDU. ESCUELA MERCEDES ROSADO, RES. RESIDENCIAL CANDELARIO TORRES, SECT. ARTURO MORALES, SECT. CAMINO CHANGO VAZQUEZ, SECT. ",May 03 07:00',May 03 17:00',<500,Scheduled Maintenance,Our power restoration team is onsite conducting critical repairs to restore power the area as quickly and safely as possible. 
SAN SEBASTIAN,"EDU. ESCUELA JULIO BABILONIA, SECT. BARRETO HERNANDEZ, SECT. BOSQUES, SECT. SABANA, SECT. SAN LORENZO, SECT. SEGUI, EDU. ESCUELA NARCISO RABELL CABRERO, SECT. AGAPITO ROSADO, SECT. BEJUCO, SECT. GELO RAMOS, SECT. LABERINTO, SECT. LA PIEDRA, SECT. LA VEGA,",May 03 06:57',May 03 17:00',501-1000,Scheduled Maintenance,Our power restoration team is onsite conducting critical repairs to restore power the area as quickly and safely as possible. 
ARECIBO,"COMU. CARRIONES, COMU. DOMINGO RUIZ, COMU. LAS PEREZ, COMU. LOS LLANOS, EDU. ESCUELA FEDERICO DEGETAU, SECT. CUESTA MANATI, SECT. LA REPRESA, SECT. LOS RIVERA, SECT. PARCELAS PEREZ, SECT. SAN GERONIMO, URB. BRISAS DEL VALLE, URB. HACIENDA MONTE VERDE, URB",May 02 17:08',May 03 13:00',2001-2500,Unplanned,Our power restoration team is onsite conducting critical repairs to restore power the area as quickly and safely as possible. 