Municipality,Sector,Outage Reported,Estimated Time of Restoration,Estimated Customers Impacted,Category,Current Status
,"              TRAMO DE MIRADOR A CAMBALACHE                                SECT. CASCO URBANO, COM. TERMINAL DE TRANSPORTACION, SECT. ARECIBO PUEBLO, SECT. CASCO URBANO, COMU. BUENOS AIRES, COND. VILLA MAR APARTMENTS, SECT. ARECIBO PUEBLO, SECT. CASCO URBANO, URB. VILLAMAR, SECT. CASCO URBANO, COME. ARECIBO PLAZA SHOPPING CENTER, COMU. ABRA SAN FRANCISCO, SECT. CASCO URBANO, URB. MARTELL",November 20 12:50',November 20 18:00',<500,Unplanned,"LUMA has successfully completed repairs and restored power to the area. If you have any questions, please contact us at 1-844-888-5862 (LUMA). "
GUAYAMA,"COMU. AMELIA MARIN, RES. RESIDENCIAL CARIOCA, SECT. CASCO URBANO, SECT. LOMA DEL VIENTO, URB. CARIOCA, URB. GUAYAMA TOWNHOUSES, URB. REPARTO SABANA, URB. REX MANOR",November 20 08:35',November 20 19:00',501-1000,Scheduled Maintenance,"LUMA has successfully completed repairs and restored power to the area. If you have any questions, please contact us at 1-844-888-5862 (LUMA). "
CAGUAS,"URB. BONNEVILLE HEIGHTS 1RA SECCION, URB. BONNEVILLE TERRACE, URB. BROOKLYN, URB. EXTENSION LA GRANJA, URB. LA GRANJA, URB. SAN ALFONSO, URB. SHUFFORD COURT, URB. TURABO GARDENS 2DA SECCION, URB. VILLA TURABO, BDA. MORALES, COME. CENTRO COMERCIAL TURABO G",November 20 04:20',November 20 18:00',<500,Unplanned,"LUMA has successfully completed repairs and restored power to the area. If you have any questions, please contact us at 1-844-888-5862 (LUMA). "
,TRAMO > LLORENS > VILLAMAR,October 28 12:25',November 21 23:00',<500,Unplanned,Our power restoration team is onsite conducting critical repairs to restore power the area as quickly and safely as possible.
TRUJILLO ALTO,"SECT. EL REGENTE, SECT. LOS APONTE, SECT. PEDRO PARRILLA, SECT. PEPE VALENTIN, SECT. TULO ALEMNAN, PARC. RAMON T. COLON, SECT. ALEMAN, SECT. ARNALDO MARTINEZ, SECT. AYALA, SECT. GATEWAY HILLS, SECT. LOS ALAMOS, SECT. LOS NUnEZ, SECT. MATOJO, SECT. RUIZ BE",November 20 08:35',November 20 19:00',501-1000,Scheduled Maintenance,Our power restoration team is onsite conducting critical repairs to restore power the area as quickly and safely as possible. 
,  TRAMO  ACB 4055B-MOD 4005. ESCUELA RUBEN RODRIGUEZ ,November 19 11:50',November 20 21:00',<500,Unplanned,Our power restoration team is onsite conducting critical repairs to restore power the area as quickly and safely as possible. 
,TRAMO > ENTRE LOS ACB'S 7911A - 7925B. ,November 16 20:20',November 20 22:00',<500,Unplanned,Our power restoration team is onsite conducting critical repairs to restore power the area as quickly and safely as possible.