Municipality,Sector,Outage Reported,Estimated Time of Restoration,Estimated Customers Impacted,Category,Current Status
SABANA GRANDE,"CEM. CEMENTERIO MUNICIPAL MASONICO DE SABANA GRANDE, EDU. ESCUELA JOSE A. CASTILLO, EDU. ESCUELA JOSE R. GAZTAMBIDE, EDU. ESCUELA ROSENDO MATIENZO CINTRON, RES. RESIDENCIAL JOSE CASTILLO MERCADO, SECT. LA MAQUINA, URB. ALTURAS DE SAN JOSE, URB. ESTANCIAS ",November 01 10:30',November 01 19:00',3001-3500,Scheduled Maintenance,"LUMA has successfully completed repairs and restored power to the area. If you have any questions, please contact us at 1-844-888-5862 (LUMA). "
GUAYAMA,"COMU. CORAZON, COMU. OLIMPO, SECT. CAIMITAL, SECT. CAIMITAL ALTO, SECT. FINCA LA DESEADA, SECT. SAN MARTIN, URB. ALTURAS DEL OLIMPO, URB. BELLO HORIZONTE, URB. JARDINES DE MONTE OLIVO, URB. PARQUE SAN ANTONIO",November 01 09:00',November 01 19:00',<500,Scheduled Maintenance,"LUMA has successfully completed repairs and restored power to the area. If you have any questions, please contact us at 1-844-888-5862 (LUMA). "
SABANA GRANDE,"EDU. ESCUELA DAVID ANTONGIORGI CORDOVA, PARC. LIBORIO NEGRON, PARC. RAYO GUARAS, SECT. CERRO GORDO, URB. REPARTO LAS TUNAS, URB. SANTA MARIA",November 01 08:30',November 01 19:00',2501-3000,Scheduled Maintenance,"LUMA has successfully completed repairs and restored power to the area. If you have any questions, please contact us at 1-844-888-5862 (LUMA). "
,"BO. FULLADOZA, PUEBLO, FLAMENCO, PLAYA SARDINAS, BDA. CLARK, BDA. VILLA MUnECO, CEM. CEMENTERIO MUNICIPAL DE CULEBRA, COMU. VILLA FLAMENCO, COND. COSTA BONITA RESOT, SECT. LA ROMANA, URB. ALTURAS DE ZONI, URB. LA PERLA, URB. PLAYA CLARA, URB. PUNTA VIENTO ESTATES",October 31 10:37',November 02 19:00',<500,Unplanned,Our power restoration team is onsite conducting critical repairs to restore power the area as quickly and safely as possible.
, COSTA SUR S.P. - RADIAL (DEMACO),October 31 07:42',November 02 23:00',<500,Unplanned,Our power restoration team is onsite conducting critical repairs to restore power the area as quickly and safely as possible.
,TRAMO > LLORENS > VILLAMAR,October 28 12:25',November 02 18:00',<500,Unplanned,Our power restoration team is onsite conducting critical repairs to restore power the area as quickly and safely as possible.