Municipality,Sector,Outage Reported,Estimated Time of Restoration,Estimated Customers Impacted,Category,Current Status
SAN JUAN,"ARE. PARQUE SAN IGNACIO, URB. COLLEGE PARK, URB. EXTENSION COLLEGE PARK, URB. SAN FRANCISCO",December 08 14:36',December 08 18:00',501-1000,Unplanned,"LUMA has successfully completed repairs and restored power to the area. If you have any questions, please contact us at 1-844-888-5862 (LUMA). "
SAN SEBASTIAN,"SECT. COLO MEDINA, SECT. CRUZ LUGO, SECT. GELO ESTEVES, SECT. LA 21, SECT. LALO JIMENEZ, SECT. LAS TOSCAS, SECT. LECHUZA, SECT. LINDIN, SECT. MILLO MATOS",December 08 08:45',December 08 17:00',<500,Scheduled Maintenance,"LUMA has successfully completed repairs and restored power to the area. If you have any questions, please contact us at 1-844-888-5862 (LUMA). "
SAN JUAN,"SECT. LOS BAEZ, URB. MONTE APOLO ESTATES, PARC. CANEJA, SECT. COREA, SECT. LA CORTE, SECT. LOS GONZALEZ 2, SECT. LOS ROMEROS, SECT. VILLA MARGARITA, URB. DEL PILAR, URB. GARCIA, URB. LOS CALDAS, URB. MILAVILLE, URB. REPARTO DEL PILAR, URB. ROMANY, URB. SA",December 08 07:02',December 08 18:00',<500,Scheduled Maintenance,"LUMA has successfully completed repairs and restored power to the area. If you have any questions, please contact us at 1-844-888-5862 (LUMA). "
, JOBOS T.C. > MAUNABO T.C.,November 30 21:14',December 13 19:00',<500,Unplanned,Our power restoration team is onsite conducting critical repairs to restore power the area as quickly and safely as possible.
,TRAMO > ENTRE LOS ACB'S 7911A - 7925B. ,November 16 20:20',December 08 18:00',<500,Unplanned,Our power restoration team is onsite conducting critical repairs to restore power the area as quickly and safely as possible.
PONCE,"COND. PASEO DEL PRINCIPE, COND. PASEO DEL REY, COND. PASEO LA PRINCESA, COND. PASEO LA REINA, RES. RESIDENCIAL DOCTOR PILA, URB. JARDINES FAGOT, URB. SANTA CLARA, URB. VALLE VERDE",December 08 14:46',December 08 18:00',501-1000,Unplanned,Our power restoration team is onsite conducting critical repairs to restore power the area as quickly and safely as possible. 
,TRAMO > MONACILLOS TC > CAPARRA,December 08 14:30',December 08 23:00',<500,Unplanned,Our power restoration team is onsite conducting critical repairs to restore power the area as quickly and safely as possible. 
PONCE,"COMU. BRISAS DEL LAGO, COMU. CERRILLO HOYOS, COMU. COTO LAUREL, EDU. ESCUELA INTERMEDIA JUAN SERRALLES, EDU. ESCUELA SUPERIOR JUAN SERRALES, SECT. CERRILLO HOYOS, SECT. PALMAREJO, URB. HACIENDAS ANA MARIA, URB. LLANOS DEL SUR",December 08 10:28',December 08 20:00',<500,Scheduled Maintenance,Our power restoration team is onsite conducting critical repairs to restore power the area as quickly and safely as possible. 