Municipality,Sector,Outage Reported,Estimated Time of Restoration,Estimated Customers Impacted,Category,Current Status
QUEBRADILLAS,"SECT. LA SABANA, SECT. MANDELLES, SECT. PALOMAR, URB. HACIENDA LA SABANA, COMU. COCOS, COND. VILLA JULIA, EDU. ESCUELA SEGUNDA UNIDAD LUIS MUnOZ RIVERA, SECT. LOS BORGES, SECT. LOS CHAVES, URB. DOS CEIBAS, URB. LA CEIBA, URB. SANTA MARINA, COME. QUEBRADIL",March 19 18:50',March 19 23:00',1001-1500,Unplanned,"LUMA has successfully completed repairs and restored power to the area. If you have any questions, please contact us at 1-844-888-5862 (LUMA). "
BAYAMON,"CMPE. ESCUELA DE MEDICINA SAN JUAN BAUTISTA, RES. RESIDENCIAL VIRGILIO DAVILA, SECT. CASCO URBANO, URB. SANTA CRUZ",March 19 18:46',March 19 23:00',<500,Unplanned,"LUMA has successfully completed repairs and restored power to the area. If you have any questions, please contact us at 1-844-888-5862 (LUMA). "
AGUADILLA,"COME. BORINQUEN TOWN PLAZA, COND. PUERTA DEL MAR, HOSP. HOSPITAL BUEN SAMARITANO, HTL. HOTEL EL FARO, RES. RESIDENCIAL AGUSTIN STAHL, RES. RESIDENCIAL JOSE DE DIEGO, SECT. EL COBO, SECT. LOS ROBLES CUESTA VIEJA, SECT. PLAYUELA, SECT. REPARTO RAMOS, SECT. ",March 19 10:15',March 19 20:00',<500,Scheduled Maintenance,"LUMA has successfully completed repairs and restored power to the area. If you have any questions, please contact us at 1-844-888-5862 (LUMA). "
PONCE,"AD. AEROPUERTO REGIONAL MERCEDITA, COND. MICHELLE, EDU. UNIVERSIDAD INTERAMERICANA RECINTO DE PONCE, IND. SABANETAS, PARC. SABANETAS, SECT. BUYONES, SECT. CALZADA, SECT. VALLAS TORRES, URB. ALTA VISTA, URB. CENTRAL MERCEDITA EL VIGIA, URB. LOS CAOBOS, URB",March 19 08:19',March 19 20:00',501-1000,Scheduled Maintenance,"LUMA has successfully completed repairs and restored power to the area. If you have any questions, please contact us at 1-844-888-5862 (LUMA). "
TRUJILLO ALTO,"COMU. SAINT JUST, COMU. MATIENZO CINTRON, SECT. BETANIA, SECT. LAS CRUCES, SECT. MARQUEZ, URB. EXTENSION ROUND HILLS, URB. NUESTRA SEnORA DE LOURDES, URB. ROUND HILLS, URB. ROUND HILLS COURTS, URB. WONDERVILLE",March 19 06:31',March 19 20:00',<500,Scheduled Maintenance,"LUMA has successfully completed repairs and restored power to the area. If you have any questions, please contact us at 1-844-888-5862 (LUMA). "
TRUJILLO ALTO,"COMU. SAINT JUST, URB. COLINAS DE MONTEBELLO, URB. PARQUE MONTEBELLO, BDA. GONZALEZ, CMPD. ENCANTADA, CMPR. ENCANTADA, COME. LAGO ALTO PLAZA, COME. LAGO ALTO PLAZA SHOPPING CENTER, COM. EMPACADORA HILL BROTHERS, COME. PLAZA TRUJILLO SHOPPING CENTER, COME.",March 19 06:31',March 19 20:00',1501-2000,Scheduled Maintenance,"LUMA has successfully completed repairs and restored power to the area. If you have any questions, please contact us at 1-844-888-5862 (LUMA). "
TRUJILLO ALTO,"COM. FARMACIA WALGREENS, COND. BALCONES DE VENUS, COND. CHALETS DE CUPEY, COND. ESTANCIAS CHALETS, COND. FLORIMAR GARDENS, COND. FRONTERAS, COND. HILL COURT, COND. LES JARDINS, COND. MIRADORES DE VENUS, COND. PARQUES DE CUPEY, COND. PORTICOS DE CUPEY, CON",March 19 15:15',March 20 18:00',<500,Unplanned,Our power restoration team is onsite conducting critical repairs to restore power the area as quickly and safely as possible.
TRUJILLO ALTO,"COM. FARMACIA WALGREENS, COND. BALCONES DE VENUS, COND. CHALETS DE CUPEY, COND. ESTANCIAS CHALETS, COND. FLORIMAR GARDENS, COND. FRONTERAS, COND. HILL COURT, COND. LES JARDINS, COND. MIRADORES DE VENUS, COND. PARQUES DE CUPEY, COND. PORTICOS DE CUPEY, CON",March 19 08:44',March 19 20:00',501-1000,Scheduled Maintenance,Our power restoration team is onsite conducting critical repairs to restore power the area as quickly and safely as possible. 
,TRAMO DE PUERTA DE TIERRAS -COVADONGA GIS,March 12 10:39',March 22 16:00',<500,Unplanned,Our power restoration team is onsite conducting critical repairs to restore power the area as quickly and safely as possible.