Municipality,Sector,Outage Reported,Estimated Time of Restoration,Estimated Customers Impacted,Category,Current Status
,TRAMO > DAGUAO > ACB 5417A,September 12 18:36',September 12 23:00',>5000,Unplanned,Our local power restoration team is being dispatched to the area as soon as possible. 
CATAÑO,"ARE. COLISEO COSME BAITIA SALAMO, ARE. PARQUE BAY VIEW, CEM. CEMENTERIO VIEJO MUNICIPAL DE CATAnO, CMPG. DEPARTAMENTO DE LA FAMILIA, COM. PUERTO RICO TELEPHONE, COND. BAHIA COURT, EDU. ESCUELA RAMON B. LOPEZ, EDU. ESCUELA SUPERIOR FRANCISCO OLLER, RES. RE",September 12 16:31',September 12 23:00',501-1000,Unplanned,Our local power restoration team is being dispatched to the area as soon as possible. 
,"MANATI TC-MANATI SEC 8405 MANAI PUEBLO COMU. LA MONA, COMU. SAN JOSE, COMU. VILLA BLANCA, COND. MAR CHIQUITA APARTMENTS, COND. MAR CHIQUITA CONDOMINIUM, COND. MAR CHIQUITA OCEAN VIEW, COND. PARAISO DE MAR CHIQUITA, IND. INDUSTRIAL SAN JOSE, SECT. BOQUILLAS, SECT. EL ALTO, SECT. LA CALIFORNIA, SECT. LA QUEMADA, SECT. LINDA MAR, SECT. LOS RABANOS, URB. BRISAS DE MAR CHIQUITA, URB. EL VERDE, URB. ESTANCIA DE ILEANA, URB. ESTANCIAS DE VALLE VERDE, URB. ESTANCIAS EL ROCIO, URB. HACIENDA LA MILAGROSA, URB. PORTO FINO, URB. REPARTO MIRADOR MARCHIQUITA, URB. REPARTO YUNEL, URB. SAN FERNANDO, URB. SANTA TERESA, URB. VALLE DE TIERRAS NUEVAS, URB. VALLES DE MANATI, URB. VILLAS DE MAR CHIQUITA, COME. PUERTO RICO PREMIUM OUTLETS, SECT. TRINIDAD, COME. PLAZA ATENAS, COMU. LA MONA, IND. INDUSTRIAL SAN JOSE, SECT. BOQUILLAS, SECT. LA CALIFORNIA, SECT. LOS RABANOS, URB. BRISAS DE MAR CHIQUITA, URB. HACIENDA LA MONSERRATE, URB. VILLAS DE MAR CHIQUITA, BDA. FELIX CORDOVA DAVILA, COMU. ALTAGRACIA, COND. MANATI PLAZA APARTMENTS, EDU. ESCUELA FELIX CORDOVA DAVILA, IND. INDUSTRIAL SAN JOSE, RES. RESIDENCIAL ENRIQUE ZORRILLA, SECT. CASCO URBANO, SECT. CORDOVA DAVILA, SECT. CUESTA MARIN, SECT. REPARTO MEJIAS, URB. ATENAS, URB. EXTENSION O' NEILL, URB. FLAMBOYAN, URB. MANATI CHALETS, URB. O'NEILL, URB. SAN SALVADOR, URB. VILLA BEATRIZ, URB. VILLA EVANGELINA, URB. VILLA NITZA, COMU. ALTAGRACIA, SECT. CORDOVA DAVILA, SECT. REPARTO MEJIAS, URB. ATENAS",September 12 12:35',September 12 21:00',<500,Unplanned,Our power restoration team is onsite conducting critical repairs to restore power the area as quickly and safely as possible. 
NAGUABO,"URB. RIO BLANCO HEIGHTS, URB. VISTAS DE RIO BLANCO, EDU. ESCUELA DESIDERIO MENDEZ RODRIGUEZ (MAIZALES), PARC. LA FE, PARC. MAIZALES, PARC. RIO BLANCO, SECT. CUCHILLA, SECT. EL PILON , SECT. FLORIDA, SECT. LA MINA, SECT. RANCHO GRANDE, SECT. VILLA TERAPIA",September 12 06:50',September 12 21:00',1501-2000,Scheduled Maintenance,Our power restoration team is onsite conducting critical repairs to restore power the area as quickly and safely as possible. 
VEGA BAJA,"SECT. LOS TUBOS, BDA. SANDIN, COND. ATLANTIC VIEW COURT, SECT. PLAYA PUERTO NUEVO, URB. EXTENSION OCEAN FRONT, URB. LOS ALMENDROS, URB. OCEAN FRONT, URB. OCEAN PARK, URB. REPARTO MAR DEL NORTE, URB. VILLA DE LOS PESCADORES, URB. VILLAS DE LA PLAYA, SECT. ",September 12 06:22',September 12 21:00',>5000,Scheduled Maintenance,Our power restoration team is onsite conducting critical repairs to restore power the area as quickly and safely as possible. 
BAYAMON,"RES. RESIDENCIAL FALIN TORRECH, SECT. LA CAMBIJA",September 11 14:35',September 12 23:00',<500,Unplanned,Our power restoration team is onsite conducting critical repairs to restore power the area as quickly and safely as possible. 
,TRAMO > CANOVANAS > RIO GRANDE,September 10 19:50',September 13 18:00',<500,Unplanned,Our power restoration team is onsite conducting critical repairs to restore power the area as quickly and safely as possible.
,    TRAMO JUANA DIAZ TC – TORO NEGRO(0330 AL 11A  ),August 29 11:21',September 15 18:00',<500,Unplanned,Our power restoration team is onsite conducting critical repairs to restore power the area as quickly and safely as possible.