Municipality,Sector,Outage Reported,Estimated Time of Restoration,Estimated Customers Impacted,Category,Current Status
,TRAMO > LLORENS > VILLAMAR,October 28 12:25',November 09 12:00',<500,Unplanned,Our power restoration team is onsite conducting critical repairs to restore power the area as quickly and safely as possible.
GUAYAMA,"ARE. AREA RECREATIVA, CMPD. COMPLEJO DEPORTIVO MUNICIPAL DE GUAYAMA, CMPE. INSTITUTO TECNOLOGICO DE PUERTO RICO RECINTO GUAYAMA, COME. LA FUENTE TOWN CENTER, COME. PLAZA DEL MERCADO DE GUAYAMA, COME. SAN VICENTE MALL, EDU. ACADEMIA SAN ANTONIO, EDU. ESCUE",November 09 08:34',November 09 12:00',<500,Unplanned,Our power restoration team is onsite conducting critical repairs to restore power the area as quickly and safely as possible. 
COROZAL,"EDU. ESCUELA EMILIO R. DELGADO, SECT. LA ALCOBA, URB. CERROMONTE, URB. MONTERREY, URB. MARIA DEL CARMEN, URB. MONTERREY, URB. VISTAS DEL RIO 2, URB. VISTAS DEL RIO 3, URB. VISTAS DEL TOA, COME. PLAZA AQUARIUM MALL, SECT. LOS HOYOS, SECT. LOS MUDOS, URB. C",November 09 08:32',November 09 14:30',2501-3000,Unplanned,Our local power restoration team is being dispatched to the area as soon as possible. 
TOA BAJA,"COM. AMERICAN PETROLEUM COMPANY, COMU. CAMPANILLAS, IND. INDUSTRIA LECHERA DE PUERTO RICO, SECT. VILLA HOSTOS, URB. RESIDENCIAL CAMPANILLA",November 09 07:34',November 09 17:00',<500,Scheduled Maintenance,Our power restoration team is onsite conducting critical repairs to restore power the area as quickly and safely as possible. 
FAJARDO,"BDA. OBRERA, BDA. ROOSEVELT, COME. DEL ESTE SHOPPING CENTER, COM. RALPH'S FOOD WAREHOUSE 10, PARC. SALDAnA, PARC. SAN PEDRO, URB. ALTURAS DE SAN PEDRO, URB. MONTEMAR, URB. NARANJO VALLEY, URB. SAN PEDRO",November 09 07:14',November 09 17:00',<500,Scheduled Maintenance,Our power restoration team is onsite conducting critical repairs to restore power the area as quickly and safely as possible. 
MARICAO,"COMU. LA ISABEL, SECT. ACEITUNA, SECT. PALMARES, PARC. LA ISABEL, PARC. LAS CARMELITAS, PARC. ROLON, SECT. CALLE INES, SECT. CAMBALACHE, SECT. CAMINO DOMINGO BACO, SECT. LA ENVIDIADA, SECT. LAS VEGAS, SECT. REPARTO NARANJALES",November 09 07:14',November 09 19:30',501-1000,Scheduled Maintenance,Our power restoration team is onsite conducting critical repairs to restore power the area as quickly and safely as possible. 
SAN JUAN,"COND. LOS CEDROS, URB. EL CEREZAL, URB. EL PARAISO, URB. REPARTO DE DIEGO",November 09 06:12',November 09 11:00',<500,Unplanned,Our local power restoration team is being dispatched to the area as soon as possible. 