Municipality,Sector,Outage Reported,Estimated Time of Restoration,Estimated Customers Impacted,Category,Current Status
ARECIBO,"SECT. ANIMAS, URB. ESTANCIAS BALSEIRO, URB. PASEOS REALES",April 12 07:44',April 12 19:00',<500,Unplanned,"LUMA has successfully completed repairs and restored power to the area. If you have any questions, please contact us at 1-844-888-5862 (LUMA). "
CAGUAS,"CEM. CEMENTERIO BORINQUEN MEMORIAL PARK 1, SECT. EL COQUI, SECT. GUASABARA, SECT. LA BARRA, SECT. LA GUASABARA, SECT. LA LIGA, SECT. LA MESA, SECT. LA PONDEROSA, SECT. LOS CURAS, SECT. LOS MUCHOS, SECT. REPARTO SOLANO, SECT. SUR DE LAS AMERICAS, URB. LAKE",April 12 15:00',April 12 21:00',2001-2500,Unplanned,Enroute
LAS MARIAS,"COMU. ACEVEDO, COMU. GUILLERMO MARTINEZ, COMU. REPARTO SANTALIZ, COMU. SANTA ROSA, PARC. LAVERGNE, PARC. SANTA ROSA, SECT. EL LLANO, SECT. LA GUAJANA, SECT. LAS JUANITAS, SECT. LOS VEGA, SECT. PEPE TRABAL, SECT. SECTOR CALLE PALMER, URB. ESTANCIAS DE SANT",April 12 11:00',April 12 18:00',1501-2000,Scheduled Maintenance,Our power restoration team is onsite conducting critical repairs to restore power the area as quickly and safely as possible. 
PATILLAS,"COMU. LAMBOGLIA, COMU. LOS POLLOS, COMU. LOS POLLOS 2, COMU. VILLA PESQUERA, FGE. PLANTA DE TRATAMIENTO DE AAA, SECT. BARRO BLANCO, SECT. CAGUITAS, SECT. HIGUERO, SECT. LA LUNA, SECT. MALAGUETA, SECT. PROVIDENCIA, URB. JARDINES DE PATILLAS, URB. MELISSA, ",April 12 08:23',April 12 19:00',501-1000,Scheduled Maintenance,Our power restoration team is onsite conducting critical repairs to restore power the area as quickly and safely as possible. 
BAYAMON,"SECT. CHICHARO, SECT. COLLORES, SECT. CRUZ VERGARA, SECT. EL GANDUL, SECT. EL PUNTO, SECT. GOVEO, SECT. ISAAC VERGARA, SECT. LAS NIEVES, SECT. LOS BARROS, SECT. LOS BRAnAS, SECT. LOS FONSECA, SECT. LOS GONZALES, SECT. LOS MULEROS, SECT. PASTO SECO, SECT. ",April 12 08:19',April 12 19:00',501-1000,Scheduled Maintenance,Our power restoration team is onsite conducting critical repairs to restore power the area as quickly and safely as possible. 
MAYAGUEZ,"PARC. NUEVAS MARINI, PARC. SAN CARLOS, SECT. BALBOA, SECT. CALLE FRONTONES, SECT. CAMINO JUSTINIANO, SECT. CAMINO LOS LECLERC, SECT. CAMINO LOS SANCHEZ, SECT. CAMINO PABLO FLORES OLIVIERI, SECT. CAMINO PARES, SECT. CAMINO SANTALIZ, SECT. CASCO URBANO, SEC",April 12 07:58',April 12 19:00',<500,Scheduled Maintenance,Our power restoration team is onsite conducting critical repairs to restore power the area as quickly and safely as possible. 
TRUJILLO ALTO,"COM. FARMACIA WALGREENS, COND. BALCONES DE VENUS, COND. CHALETS DE CUPEY, COND. ESTANCIAS CHALETS, COND. FLORIMAR GARDENS, COND. FRONTERAS, COND. HILL COURT, COND. LES JARDINS, COND. MIRADORES DE VENUS, COND. PARQUES DE CUPEY, COND. PORTICOS DE CUPEY, CON",April 12 07:44',April 12 19:00',<500,Scheduled Maintenance,Our power restoration team is onsite conducting critical repairs to restore power the area as quickly and safely as possible. 