Municipality,Sector,Outage Reported,Estimated Time of Restoration,Estimated Customers Impacted,Category,Current Status
JUANA DIAZ,"COMU. ARUS, COMU. GALICIA, COMU. SERRANO, COMU. SINGAPUR, URB. GALICIA DEL MAR, URB. LOS HUCARES, SECT. MANZANILLA",May 16 09:58',May 16 18:30',501-1000,Scheduled Maintenance,"LUMA has successfully completed repairs and restored power to the area. If you have any questions, please contact us at 1-844-888-5862 (LUMA). "
VILLALBA,"COND. VILLALBA ELDERLY APARTMENTS, PARC. CESPEDES, SECT. APEADEROS, SECT. DAJAOS, SECT. EL HOYITO, SECT. EL LIMON, SECT. EL NUEVO PINO, SECT. EL PINO, SECT. JOVITO, SECT. JOVITOS, URB. ALTURAS DE VILLALBA , URB. EXTENSION ALTURAS DE VILLALBA, URB. LA VEGA",May 16 07:49',May 16 18:30',1501-2000,Scheduled Maintenance,"LUMA has successfully completed repairs and restored power to the area. If you have any questions, please contact us at 1-844-888-5862 (LUMA). "
CAGUAS,"CMPG. CENTRO DE GOBIERNO MUNICIPAL, COM. CAGUAS BODY PART, COME. LAS CATALINAS MALL, COM. NUEVA VIDA 97.7, FGM. CENTRO DE BELLAS ARTES ANGEL O. BERRIOS, FGM. NUEVA ALCALDIA CAGUAS, SECT. CASCO URBANO",May 16 18:59',May 16 23:00',501-1000,Unplanned,Our local power restoration team is being dispatched to the area as soon as possible. 
CAGUAS,"COME. CENTRO COMERCIAL VILLA DEL CARMEN, COMU. NARANJITO, COND. VILLA NUEVA, DOT. RIO TURABO, EDU. ESCUELA CIPRIANO MANRIQUE, PARC. NUEVAS, PARC. VIEJAS, RES. RESIDENCIAL JOSE GAUTIER BENITEZ, RES. RESIDENCIAL VILLA DEL REY, SECT. ACUEDUCTOS, SECT. ALTURA",May 16 09:10',May 16 19:30',501-1000,Scheduled Maintenance,Our power restoration team is onsite conducting critical repairs to restore power the area as quickly and safely as possible. 
,MAYAGUEZ-MORA-CAMBALACHE ,May 07 21:36',June 03 18:00',<500,Unknown,Our power restoration team is onsite conducting critical repairs to restore power the area as quickly and safely as possible.