Municipality,Sector,Outage Reported,Estimated Time of Restoration,Estimated Customers Impacted,Category,Current Status
HUMACAO,"COND. AQUABELLA, COND. BEACH VILLAGE, COND. CRESCENT BEACH, COND. CRESCENT COVE, COND. FAIRLAKES 3, COND. FAIRLAKES VILLAGE, COND. FAIRWAY COURTS, COND. FAIRWAY COURTS VILLAS, COND. HACIENDAS DE PALMAS, COND. HARBOUR LAKES, COND. LA JOLLA, COND. LAS VILLA",March 15 11:24',March 15 11:00',<500,Unplanned,"LUMA has successfully completed repairs and restored power to the area. If you have any questions, please contact us at 1-844-888-5862 (LUMA). "
HUMACAO,"COND. AQUABELLA, COND. BEACH VILLAGE, COND. CRESCENT BEACH, COND. CRESCENT COVE, COND. FAIRLAKES 3, COND. FAIRLAKES VILLAGE, COND. FAIRWAY COURTS, COND. FAIRWAY COURTS VILLAS, COND. HACIENDAS DE PALMAS, COND. HARBOUR LAKES, COND. LA JOLLA, COND. LAS VILLA",March 15 11:07',March 15 18:00',3501-4000,Unplanned,"LUMA has successfully completed repairs and restored power to the area. If you have any questions, please contact us at 1-844-888-5862 (LUMA). "
GUANICA,"COMU. LA MONTALVA, COND. PLAYA SANTA AEELA CENTRO VACACIONAL, COND. PLAZA EL BATEY, SECT. CALETAS DE SALINAS, SECT. LA JOYA, SECT. LA LOMA, SECT. MAGUEYES, URB. BACO, URB. PLAYA SANTA, URB. PLAZA EL BATEY, URB. VALLE TANIA",March 15 10:30',March 15 17:00',<500,Scheduled Maintenance,Our power restoration team is onsite conducting critical repairs to restore power the area as quickly and safely as possible. 
,JUNCOS 115 KV BUS 2 > AMGEN,March 15 09:00',March 15 18:00',<500,Unplanned,Our local power restoration team is being dispatched to the area as soon as possible. 
AGUADILLA,"COME. BORINQUEN TOWN PLAZA, COND. PUERTA DEL MAR, HOSP. HOSPITAL BUEN SAMARITANO, HTL. HOTEL EL FARO, RES. RESIDENCIAL AGUSTIN STAHL, RES. RESIDENCIAL JOSE DE DIEGO, SECT. EL COBO, SECT. LOS ROBLES CUESTA VIEJA, SECT. PLAYUELA, SECT. REPARTO RAMOS, SECT. ",March 15 08:57',March 15 18:00',501-1000,Scheduled Maintenance,Our power restoration team is onsite conducting critical repairs to restore power the area as quickly and safely as possible. 
AGUADILLA,"CMPG. COAST GUARD, SECT. LOS CIRCULOS, URB. BASE RAMEY , URB. GATE 5",March 15 08:47',March 15 16:00',<500,Scheduled Maintenance,Our power restoration team is onsite conducting critical repairs to restore power the area as quickly and safely as possible. 
YABUCOA,"COME. PLAZA YABUCOA SHOPPING CENTER, COM. GARAJE SHELL, COMU. EL NEGRO CAMINO NUEVO, EDU. ESCUELA FRANCISCO SUSTACHE, IND. PUERTO RICO SUN OIL COMPANY, IND. ZONA INDUSTRIAL BARRIO JUAN MARTIN, PARC. EL NEGRO, SECT. EL GUANO, SECT. EL NEGRO, SECT. POBLADO ",March 15 08:20',March 15 15:00',1501-2000,Scheduled Maintenance,Our power restoration team is onsite conducting critical repairs to restore power the area as quickly and safely as possible. 
,TRAMO DE PUERTA DE TIERRAS -COVADONGA GIS,March 12 10:39',March 17 16:00',<500,Unplanned,Our power restoration team is onsite conducting critical repairs to restore power the area as quickly and safely as possible.