Municipality,Sector,Outage Reported,Estimated Time of Restoration,Estimated Customers Impacted,Category,Current Status
SAN JUAN,"COND. MANSIONES DE GARDEN HILLS SUR, URB. GARDEN HILLS , URB. GARDEN HILLS ESTATES, URB. MANSIONES DE GARDEN HILLS, URB. VILLA CAPARRA, COME. ALTAMIRA SHOPPING CENTER, COND. CAMINO REAL, EDIF. POMPINA INVESTMENT, RES. RESIDENCIAL VILLA ESPAnA, URB. ALTAMI",July 29 16:34',July 29 20:00',1501-2000,Unplanned,"LUMA has successfully completed repairs and restored power to the area. If you have any questions, please contact us at 1-844-888-5862 (LUMA). "
MAUNABO,"EDU. ESCUELA ALFONSO CASTA MARTINEZ, RES. RESIDENCIAL CARMEN H. MARTORELL, RES. RESIDENCIAL JARDINES LOS ALMENDROS, SECT. BATEY COLUMBIA, SECT. GARCIA, SECT. LA PICA, URB. CALIMANO, URB. EXTENSION CALIMANO, URB. EXTENSION VILLA NAVARRO, URB. LOS ALMENDROS",July 29 10:23',July 29 19:00',>5000,Scheduled Maintenance,"LUMA has successfully completed repairs and restored power to the area. If you have any questions, please contact us at 1-844-888-5862 (LUMA). "
GUAYNABO,"CEM. CEMENTERIO NUEVO BARRIO FRAILES, IND. LOS FRAILES INDUSTRIAL PARK, URB. BELLOMONTE, URB. OASIS GARDENS",July 29 18:25',July 29 23:30',2501-3000,Unplanned,Enroute
SAN JUAN,"COM. COMPUTER HOUSE, COM. ESTACIONAMIENTO, COM. EWCO ELECTROMECANICA-MECANICA, COM. LA LUCENSE BAKERY, COM. LOS PIONEROS, COM. PISC, COM. SCHOOL &amp; OFFICE SUPPLIES, COM. TURBO CENTER, EDU. ESCUELA SUPERIOR GABRIELA MISTRAL, URB. CAPARRA HEIGHTS, URB. C",July 29 16:43',July 29 22:00',<500,Unplanned,Our power restoration team is onsite conducting critical repairs to restore power the area as quickly and safely as possible. 
SAN JUAN,"BDA. BUEN CONSEJO, BDA. VENEZUELA, CEM. CEMENTERIO VILLA NEVAREZ, CMPE. JARDIN BOTANICO, COND. EL PARAISO, COND. PARADISE COURT, COND. PARADISE COURT 2, COND. PARK GARDENS COURT, EDU. COLEGIO SAN JOSE, IND. SAN JOSE, IND. URBANIZACION INDUSTRIAL EL CINCO,",July 29 15:27',July 29 22:00',<500,Unplanned,Our power restoration team is onsite conducting critical repairs to restore power the area as quickly and safely as possible. 
,"TRAMO FONALLEDAS - LOMAS         ONG. HOGAR MI ADORADA CASITA, URB. CAPARRA TERRACE, URB. PUERTO NUEVO, URB. REPARTO METROPOLITANO, ARE. PARQUE DE BASEBALL, ARE. PARQUE PASIVO, CMPS. CENTRO MEDICO, COND. REPARTO METROPOLITANO, URB. LAS AMERICAS, URB. REPARTO METROPOLITANO, COM. SUIZA DAIRY, URB. LA RIVIERA, URB. REPARTO METROPOLITANO, COM. DYNAPHONE, COM. GASOLINERA PUMA, COM. GASOLINERA TOTAL EXCELLIUM, COM. JUAN PAN PIZZA, COM. NRC COMPUTER + SUPPLIES, COM. SPINNING, EDU. ESCUELA ELEMENTAL ISAAC GONZALEZ MARTINEZ, URB. CAPARRA TERRACE, URB. PUERTO NUEVO",July 28 14:37',July 29 16:00',<500,Unknown,Our power restoration team is onsite conducting critical repairs to restore power the area as quickly and safely as possible.