Municipality,Sector,Outage Reported,Estimated Time of Restoration,Estimated Customers Impacted,Category,Current Status
TRUJILLO ALTO,"CEM. CEMENTERIO MUNICIPAL DE TRUJILLO ALTO, COND. SENDEROS DEL RIO, COND. VISTA SERENA, EDU. ESCUELA EL CONQUISTADOR, SECT. CULEBRA, SECT. LOS AYALAS, URB. EL CONQUISTADOR, URB. EL CONQUISTADOR TOWNHOUSES, URB. HACIENDAS DEL LAGO, URB. LA LOMITA, URB. LA ",April 07 15:45',April 07 20:00',1001-1500,Unplanned,"LUMA has successfully completed repairs and restored power to the area. If you have any questions, please contact us at 1-844-888-5862 (LUMA). "
MARICAO,"IND. HACIENDA CAFETALERA DELFINA, IND. HACIENDA CAFETALERA LLANADAS, IND. HACIENDA CARACOLILLO, SECT. CARRIZALES, SECT. CHAGO MENDEZ, SECT. EL 22, SECT. EL QUEMAO, SECT. INDIO URAYON, SECT. JUSTINIANO, SECT. LA SALVACION, SECT. LAS SESENTA, SECT. LAS TORR",April 07 08:04',April 07 20:00',1001-1500,Scheduled Maintenance,"LUMA has successfully completed repairs and restored power to the area. If you have any questions, please contact us at 1-844-888-5862 (LUMA). "
,TRAMO DE PUERTA DE TIERRAS -COVADONGA GIS,March 12 10:39',April 14 18:00',<500,Unplanned,Our power restoration team is onsite conducting critical repairs to restore power the area as quickly and safely as possible.
,"EDU. ESCUELA DIEGO TORRES VARGAS, HOSP. REGIONAL RUIZ ARNAU, URB. INDUSTRIAL MINILLAS, URB. LOMAS VERDES 1, URB. LOMAS VERDES 2, URB. LOMAS VERDES 3, URB. SANTA JUANITA 3, URB. SANTA JUANITA 4, URB. SANTA JUANITA 7, URB. SANTA JUANITA 8, URB. SANTA JUANITA 9, URB. SANTA JUANITA APARTMENTS, URB. VALLE BELLO CHALETS, URB. VISTA BELLA, URB. INDUSTRIAL MINILLAS, URB. INDUSTRIAL MINILLAS, CEM. CEMENTERIO MUNICIPAL LOMAS VERDES, COM. COMERCIO, COND. CHALETS DE ROYAL PALM, EDU. ESCUELA DR. JOSE PADIN, EDU. ESCUELA JOSEFITA MONSERRATE DE SELLES, URB. AGUSTIN STAHL, URB. ALTURAS DE FLAMBOYAN, URB. INDUSTRIAL MINILLAS, URB. LOMAS VERDES 1, URB. LOMAS VERDES 3, URB. ROYAL PALM, URB. SANTA ROSA, CMPA. CASA COMERIO SALON DE ACTIVIDADES, COMU. JUAN SANCHEZ, EDU. ESCUELA ANGEL MILLAN HUERTAS, EDU. ESCUELA JOSE ANDINO AMEZQUITA, SECT. SANTA JUANITA, URB. INDUSTRIAL MINILLAS",April 07 15:30',April 07 20:00',4501-5000,Unplanned,Our power restoration team is onsite conducting critical repairs to restore power the area as quickly and safely as possible. 
SAN JUAN,"COND. MANSIONES DE GARDEN HILLS SUR, URB. GARDEN HILLS , URB. GARDEN HILLS ESTATES, URB. MANSIONES DE GARDEN HILLS, URB. VILLA CAPARRA, COME. ALTAMIRA SHOPPING CENTER, COND. CAMINO REAL, EDIF. POMPINA INVESTMENT, RES. RESIDENCIAL VILLA ESPAnA, URB. ALTAMI",April 07 08:04',April 07 20:00',1501-2000,Unplanned,Our local power restoration team is being dispatched to the area as soon as possible. 