Municipality,Sector,Outage Reported,Estimated Time of Restoration,Estimated Customers Impacted,Category,Current Status
FAJARDO,"BDA. MONTAnEZ, BDA. VEVE CALZADA, RES. RESIDENCIAL VILLA FAJARDO , SECT. CASCO URBANO, URB. GARCIA PONCE, URB. PROYECTO FEMA, URB. RESIDENCIAL VILLA FAJARDO 1, URB. SANTIAGO VEVE CALZADA",February 29 07:03',February 29 13:00',1001-1500,Unplanned,Our power restoration team is onsite conducting critical repairs to restore power the area as quickly and safely as possible. 
PONCE,"COME. PLAZA LAS MONJITAS, SECT. LAS CANITAS, SECT. VILLA DOS RIOS, URB. ALTURAS DE JACARANDA, URB. EL MONTE, URB. GLENVIEW GARDENS, URB. JACARANDA, URB. LAS MONJITAS, URB. QUINTAS DE MONSERRATE, URB. VISTA POINT",February 29 07:03',February 29 17:30',1501-2000,Scheduled Maintenance,Our power restoration team is onsite conducting critical repairs to restore power the area as quickly and safely as possible. 
PONCE,"EDU. ESCUELA HERMINIA GARCIA, PARC. MARAGUEZ VALLAS, SECT. EL GOLPE AVISA, SECT. EL TESORO, SECT. VERDUM, URB. GLENVIEW GARDENS, URB. HACIENDA SAN JOSE, URB. JARDINES DE PONCE",February 29 07:03',February 29 17:30',501-1000,Scheduled Maintenance,Our power restoration team is onsite conducting critical repairs to restore power the area as quickly and safely as possible. 
CAGUAS,"SECT. CAMINO NUEVO, BDA. MORALES, CMPA. MOISTY PARK, CMPG. CENTRAL AUTORIDAD DE ENERGIA ELECTRICA, EDU. ESCUELA MYRNA M. FUENTES, EDU. ESCUELA PEPITA ARENAS, SECT. EL CAMPITO, SECT. LA UNION Y EL PALITO, URB. JARDINES DE CAGUAS, URB. PARQUE DEL MONTE, URB",February 29 07:03',February 29 17:00',3001-3500,Unplanned,Our local power restoration team is being dispatched to the area as soon as possible. 
GUANICA,"BDA. ESPERANZA, COMU. BELGICA, COMU. EXTENSION ALTURAS DE BELGICA , COMU. EXTENSION BELGICA , COMU. FRATERNIDAD, COMU. LA MAFAFA, COMU. MARIA ANTONIA, COMU. SANTA JUANITA, COMU. SANTA RITA, COND. PITIRRE, PARC. ARENA, RES. RESIDENCIAL JARDINES DE GUANICA,",February 29 07:03',February 29 17:00',1001-1500,Scheduled Maintenance,Our power restoration team is onsite conducting critical repairs to restore power the area as quickly and safely as possible. 