Municipality,Sector,Outage Reported,Estimated Time of Restoration,Estimated Customers Impacted,Category,Current Status
CAROLINA,"SECT. LOMAS COLE, SECT. CUESTA LOS FLACOS, SECT. EL TROMPITO, SECT. FILIPINAS, SECT. LA LOMA, SECT. LAS LAJAS, SECT. LOS CARMONA, SECT. LOS COHITRE, SECT. LOS FLORES, SECT. LOS HANCE, SECT. LOS NIEVES, SECT. LOS SOSA, SECT. TIERRA SECA",April 19 09:31',April 19 18:00',<500,Scheduled Maintenance,Our power restoration team is onsite conducting critical repairs to restore power the area as quickly and safely as possible. 
SAN JUAN,"CMPG. AUTORIDAD DE ENERGIA ELECTRICA, COND. BALCONES DE SAN JUAN, COND. DE DIEGO CHALETS, COND. PARQUE SAN AGUSTIN, COND. PRUDENCIO RIVERA MARTINEZ, EDIF. CARIBBEAN SIGN SUPPLY, EDU. ESCUELA ELEMENTAL LAS VIRTUDES, EDU. ESCUELA SECUNDARIA DR. CESAREO ROSA",April 19 09:00',April 19 17:00',<500,Scheduled Maintenance,Our power restoration team is onsite conducting critical repairs to restore power the area as quickly and safely as possible. 
NARANJITO,"SECT. POMITO, CEM. CEMENTERIO MUNICIPAL DE NARANJITO, EDU. ESCUELA ELEMENTAL JOSEFINA MARRERO FEBUS, EDU. ESCUELA FIDEL G. PADILLA, EDU. ESCUELA MERCEDES ROSADO, RES. RESIDENCIAL CANDELARIO TORRES, SECT. ARTURO MORALES, SECT. CAMINO CHANGO VAZQUEZ, SECT. ",April 19 08:45',April 19 15:00',<500,Scheduled Maintenance,Our power restoration team is onsite conducting critical repairs to restore power the area as quickly and safely as possible. 
PEÑUELAS,"SECT. FORNES, SECT. LOS PEREZ, SECT. MARTILLO, EDU. ESCUELA FELIPE QUInONES, SECT. EL LLANO",April 19 08:30',April 19 14:00',<500,Unplanned,Our power restoration team is onsite conducting critical repairs to restore power the area as quickly and safely as possible. 
SAN SEBASTIAN,"SECT. CORCOVADA, BDA. CHINTO RONDON, BDA. PUEBLO NUEVO, BDA. STALINGRADO, BDA. TABLASTILLA, COMU. GONZALEZ, SECT. CASCO URBANO, SECT. EL CALLEJON, SECT. EL TUNEL, SECT. GELO RAMOS, SECT. JUSTO PEREZ, SECT. MONTALVO, SECT. PARALELO 38, SECT. SISO QUILES, U",April 19 08:04',April 19 18:00',501-1000,Unplanned,Our power restoration team is onsite conducting critical repairs to restore power the area as quickly and safely as possible. 
TRUJILLO ALTO,"COM. FARMACIA WALGREENS, COND. BALCONES DE VENUS, COND. CHALETS DE CUPEY, COND. ESTANCIAS CHALETS, COND. FLORIMAR GARDENS, COND. FRONTERAS, COND. HILL COURT, COND. LES JARDINS, COND. MIRADORES DE VENUS, COND. PARQUES DE CUPEY, COND. PORTICOS DE CUPEY, CON",April 19 07:00',April 19 18:00',501-1000,Scheduled Maintenance,Our power restoration team is onsite conducting critical repairs to restore power the area as quickly and safely as possible. 
DORADO,"CMPR. DORADO DEL MAR, COMU. MAMEYAL, COMU. SAN ANTONIO, COMU. VILLA PLATA, COND. COSTA DORADA, COND. OCEAN VILLAS, COND. VISTAS DEL MAR, EDU. ESCUELA INTERMEDIA JOSE SANTOS ALEGRIA, RES. RESIDENCIAL MANUEL MORALES, SECT. CASCO URBANO, URB. VILLAS DE GOLF ",April 18 03:14',April 18 12:00',<500,Unplanned,Our local power restoration team is being dispatched to the area as soon as possible. 
,TRAMO > MONACILLOS > CENTRO MEDICO,April 17 18:10',April 19 20:00',<500,Unplanned,Our power restoration team is onsite conducting critical repairs to restore power the area as quickly and safely as possible.