Municipality,Sector,Outage Reported,Estimated Time of Restoration,Estimated Customers Impacted,Category,Current Status
JAYUYA,"COMU. MARQUEZ, COMU. SANTA CLARA, SECT. HOYO FRIO, SECT. LA SALSA, SECT. LOS AJOS, SECT. VISTA ALEGRE, URB. ALTURAS DE JAYUYA, URB. JARDINES DE JAYUYA, PARC. ISOLINA",May 15 08:30',May 15 17:30',501-1000,Scheduled Maintenance,"LUMA has successfully completed repairs and restored power to the area. If you have any questions, please contact us at 1-844-888-5862 (LUMA). "
CAROLINA,"URB. LOIZA VALLEY, COME. LOS COLOBOS SHOPPING CENTER, COND. ANDALUCIA, COND. BALCONES DE MONTE REAL, COND. PARQUE JULIANA, COND. POLARIS, COND. PORTICOS DEL SOL, EDU. ESCUELA PRISCO FUENTES, PARC. BUENAVENTURA, SECT. CAMBUTE, SECT. MONOLORO, URB. ALTURAS ",May 15 08:45',May 15 11:00',501-1000,Unplanned,Our power restoration team is onsite conducting critical repairs to restore power the area as quickly and safely as possible. 
JAYUYA,"COMU. MARQUEZ, COMU. SANTA CLARA, SECT. HOYO FRIO, SECT. LA SALSA, SECT. LOS AJOS, SECT. VISTA ALEGRE, URB. ALTURAS DE JAYUYA, URB. JARDINES DE JAYUYA, PARC. ISOLINA",May 15 08:29',May 15 18:00',501-1000,Scheduled Maintenance,Our power restoration team is onsite conducting critical repairs to restore power the area as quickly and safely as possible. 
CAROLINA,"COMU. SAINT JUST, COMU. SAN ANTON, COND. PARQUE DE SAN ANTON, RES. RESIDENCIAL LOS MIRTOS, SECT. LA LOMA, URB. CIUDAD CENTRAL, URB. PASEO DE LA ALHAMBRA, URB. ROLLING HILLS, URB. VILLAS DEL MADRIGAL, URB. VILLAS DE SAN ANTON",May 15 08:23',May 15 17:00',2501-3000,Scheduled Maintenance,Our power restoration team is onsite conducting critical repairs to restore power the area as quickly and safely as possible. 
TRUJILLO ALTO,"COM. FARMACIA WALGREENS, COND. BALCONES DE VENUS, COND. CHALETS DE CUPEY, COND. ESTANCIAS CHALETS, COND. FLORIMAR GARDENS, COND. FRONTERAS, COND. HILL COURT, COND. LES JARDINS, COND. MIRADORES DE VENUS, COND. PARQUES DE CUPEY, COND. PORTICOS DE CUPEY, CON",May 15 07:47',May 15 17:00',501-1000,Scheduled Maintenance,Our power restoration team is onsite conducting critical repairs to restore power the area as quickly and safely as possible. 
YABUCOA,"JACANAS, LIMONES, CAMINO NUEVO, JARDINES DE YABUCOA, VALLE DE YABUCOA, CENTRO COMERCIAL RALPHS, BPPR, WALGREENS, UNIVERSIDAD DEL TURABO",May 15 06:49',May 15 18:00',501-1000,Scheduled Maintenance,Our power restoration team is onsite conducting critical repairs to restore power the area as quickly and safely as possible. 
,MAYAGUEZ-MORA-CAMBALACHE ,May 07 21:36',June 03 18:00',<500,Unknown,Our power restoration team is onsite conducting critical repairs to restore power the area as quickly and safely as possible.