Municipality,Sector,Outage Reported,Estimated Time of Restoration,Estimated Customers Impacted,Category,Current Status
SAN JUAN,"CMPG. ARMY RESERVE CENTER, CMPG. SAN PATRICIO FOREST, EDU. ESCUELA ELEMENTAL EUGENIO MARIA DE HOSTOS, FGE. ESTACION DE BOMBEROS DE SAN JUAN, FGE. INSTITUTO DEL DENGUE, URB. CAPARRA TERRACE, URB. PUERTO NUEVO",November 06 16:00',November 06 23:00',1501-2000,Unplanned,"LUMA has successfully completed repairs and restored power to the area. If you have any questions, please contact us at 1-844-888-5862 (LUMA). "
MAYAGUEZ,"COME. WESTERN PLAZA SHOPPING CENTER, SECT. BONET, SECT. CUBA, SECT. PITILLO, URB. ALTURAS DE MAYAGUEZ, URB. BELLAS LOMAS, URB. COLINAS DE ALTURAS DE MAYAGUEZ, URB. COLLEGE GARDENS, URB. CUMBRES DE MIRADERO, URB. EL RETIRO, URB. ESTANCIAS DE MIRADERO, URB.",November 06 10:28',November 06 22:00',2001-2500,Scheduled Maintenance,"LUMA has successfully completed repairs and restored power to the area. If you have any questions, please contact us at 1-844-888-5862 (LUMA). "
AGUADA,"COMU. COMUNIDAD ESPECIAL CALLE SAN JOSE, SECT. CASCO URBANO, COMU. COMUNIDAD ESPECIAL CALLE SAN FRANCISCO, COMU. COMUNIDAD ESPECIAL CALLE SAN JOSE, RES. RESIDENCIAL FRANCISCO EGIPCIACO, RES. RESIDENCIAL LOS ROBLES, SECT. CASCO URBANO, SECT. JOSE CHEPE HER",November 06 08:01',November 06 21:00',>5000,Scheduled Maintenance,"LUMA has successfully completed repairs and restored power to the area. If you have any questions, please contact us at 1-844-888-5862 (LUMA). "
,TRAMO > LLORENS > VILLAMAR,October 28 12:25',November 07 18:00',<500,Unplanned,Our power restoration team is onsite conducting critical repairs to restore power the area as quickly and safely as possible.
SAN JUAN,"CMPE. UNIVERSIDAD DEL SAGRADO CORAZON, COND. ANGELICA, COND. DHARMA, COND. EGIDA ALTURAS DE SAN JUAN, COND. HABITAT DE CANTERA, COND. IMPERIAL SUITES, COND. PARQUE VICTORIA, COND. THE LOFTS AT 2014, EDU. ESCUELA ELEMENTAL FRAY BARTOLOME DE LAS CASAS, EDU.",November 06 16:15',November 06 23:00',2501-3000,Unplanned,Our local power restoration team is being dispatched to the area as soon as possible. 
SAN JUAN,"SECT. LOS NAVARROS, SECT. LOS SANTA, SECT. PEDRO RAMOS, SECT. TOME, EDU. ESCUELA SUPERIOR INES MARIA MENDOZA, SECT. AVELINO LOPEZ, SECT. CAMINO LOS BENITEZ 1, SECT. CAMINO LOS SERRANO, SECT. CAMINO LOS SOLA, SECT. CAMINO PILAR FERREIRA, SECT. CAMINO TABON",November 06 09:09',November 06 21:00',<500,Unplanned,Our power restoration team is onsite conducting critical repairs to restore power the area as quickly and safely as possible. 
SAN JUAN,"ARTERIAL HOSTOS, HATO REY CENTRO, NEW SAN JUAN, HATO REY NORTE",November 05 17:44',November 06 21:00',<500,Unplanned,Our power restoration team is onsite conducting critical repairs to restore power the area as quickly and safely as possible. 