Municipality,Sector,Outage Reported,Estimated Time of Restoration,Estimated Customers Impacted,Category,Current Status
ARECIBO,"COMU. BUENOS AIRES, COND. VILLA MAR APARTMENTS, SECT. ARECIBO PUEBLO, SECT. CASCO URBANO, URB. VILLAMAR",October 28 17:33',October 28 23:00',1001-1500,Unplanned,"LUMA has successfully completed repairs and restored power to the area. If you have any questions, please contact us at 1-844-888-5862 (LUMA). "
SAN JUAN,"COND. LUISA 55, COND. PICCIONI 1125, COND. VENETIAN TOWER",October 28 14:59',October 28 21:00',1501-2000,Unplanned,"LUMA has successfully completed repairs and restored power to the area. If you have any questions, please contact us at 1-844-888-5862 (LUMA). "
SAN JUAN,"EL CONDADO, AVE. ASHFORD, VIEJO SAN JUAN, SANTURCE",October 28 17:32',October 28 23:00',<500,Unplanned,Our power restoration team is onsite conducting critical repairs to restore power the area as quickly and safely as possible. 
SAN JUAN,"ARE. PARQUE DE BASEBALL, ARE. PARQUE PASIVO, CMPS. CENTRO MEDICO, COND. REPARTO METROPOLITANO, URB. LAS AMERICAS, URB. REPARTO METROPOLITANO",October 28 13:59',October 28 23:00',501-1000,Unplanned,Our power restoration team is onsite conducting critical repairs to restore power the area as quickly and safely as possible. 
,TRAMO > LLORENS > VILLAMAR,October 28 12:25',October 29 23:00',<500,Unplanned,Our power restoration team is onsite conducting critical repairs to restore power the area as quickly and safely as possible.
DORADO,"COME. DORADO SHOPPING CENTER, SECT. SANTA ROSA",October 27 20:45',October 28 23:00',<500,Unplanned,Our power restoration team is onsite conducting critical repairs to restore power the area as quickly and safely as possible. 