Municipality,Sector,Outage Reported,Estimated Time of Restoration,Estimated Customers Impacted,Category,Current Status
,"COM. IL CUOCO, COM. INSTANT PRINT, COM. KIMPO GARDEN, COND. EL MONTE NORTE, COND. EL MONTE SUR, COND. EL MONTE SUR TOWN HOUSES, URB. BALDRICH, URB. HYDE PARK",November 18 07:12',November 18 13:00',<500,Unplanned,"LUMA has successfully completed repairs and restored power to the area. If you have any questions, please contact us at 1-844-888-5862 (LUMA). "
,TRAMO > LLORENS > VILLAMAR,October 28 12:25',November 21 23:00',<500,Unplanned,Our power restoration team is onsite conducting critical repairs to restore power the area as quickly and safely as possible.
, CAGUAS Region @ OROCOVIS Municipality ,November 18 07:54',November 18 13:00',>5000,Unplanned,Our local power restoration team is being dispatched to the area as soon as possible. 
MARICAO,"SECT. LAS ABEJAS, SECT. LAS PIEDRAS, SECT. SANTONES",November 18 07:05',November 18 13:00',<500,Unplanned,Our local power restoration team is being dispatched to the area as soon as possible. 
ADJUNTAS,"CEM. CEMENTERIO ADJUNTAS, COMU. GUILARTE, EDU. ESCUELA FRANCISCO PIETRI MARIANI, SECT. CERRO NOVILLO, SECT. CUESTA LOS HERNANDEZ, SECT. CUESTA MALDONADO, SECT. EL MAJAGUAL, SECT. EL VALLE, SECT. HELECHALES, SECT. LA LLOROSA, SECT. LAS CASITAS, SECT. PARCE",November 18 06:55',November 18 12:00',1001-1500,Unplanned,Our local power restoration team is being dispatched to the area as soon as possible. 
MAYAGUEZ,URB. REPARTO MACIAS,November 18 06:41',November 18 12:00',<500,Unplanned,Our local power restoration team is being dispatched to the area as soon as possible. 
,TRAMO > ENTRE LOS ACB'S 7911A - 7925B. ,November 16 20:20',November 18 22:00',<500,Unplanned,Our power restoration team is onsite conducting critical repairs to restore power the area as quickly and safely as possible.