Municipality,Sector,Outage Reported,Estimated Time of Restoration,Estimated Customers Impacted,Category,Current Status
,,September 17 15:09',September 17 15:00',<500,Unplanned,Our local power restoration team is being dispatched to the area as soon as possible. 
TRUJILLO ALTO,"SECT. LOS COLONES, SECT. LOS MARQUEZ, SECT. MARIA ANTONIA HERNANDEZ, SECT. PEN, SECT. CULEBRA, SECT. GONZALO CORTEZ, SECT. LUISA SANCHEZ, URB. BRISAS DE LA GLORIA",September 17 14:14',September 17 20:00',501-1000,Unplanned,Our local power restoration team is being dispatched to the area as soon as possible. 
TRUJILLO ALTO,"URB. ALAMEIN, URB. EXTENSION VILLA CAPRI, URB. PARK GARDENS, URB. VENUS GARDENS SUR, URB. VILLA ANDALUCIA, URB. VILLA CAPRI, URB. VILLA CAPRI COURT, URB. VILLA ROSALES, COME. UNIVERSAL PLAZA, COND. CAMINO TERRA VERDE, COND. COOPERATIVA JARDINES DE TRUJILL",September 17 13:47',September 17 19:00',1001-1500,Unplanned,Our local power restoration team is being dispatched to the area as soon as possible. 
CEIBA,"URB. ROOSEVELT GARDENS, PARC. DAGUAO, PARC. NUEVAS DAGUAO, PARC. VIEJAS DAGUAO, URB. PROMISED LAND",September 17 09:52',September 17 18:00',501-1000,Scheduled Maintenance,Our power restoration team is onsite conducting critical repairs to restore power the area as quickly and safely as possible. 
SAN JUAN,"URB. SAN FRANCISCO, URB. SAN IGNACIO, URB. SANTA MARIA",September 17 09:19',September 17 19:00',501-1000,Scheduled Maintenance,Our power restoration team is onsite conducting critical repairs to restore power the area as quickly and safely as possible. 
YAUCO,"ARE. YAUCO URBAN PARK, BDA. ARTURO LLUBERAS, CMPD. COLISEO RAUL PIPOTE OLIVERAS, CMPG. INSTALACIONES MUNICIPALES, COMU. LOMA BONITA, COND. EGIDA ESTANCIA DORADA, EDU. ESCUELA ARTURO LLUBERAS, IND. STARTORIUS STEDIM BIOTECH, ONG. MIGRANT HEALTH CENTER WEST",September 17 08:30',September 17 17:00',501-1000,Scheduled Maintenance,Our power restoration team is onsite conducting critical repairs to restore power the area as quickly and safely as possible. 
,AGUAS BUENAS G.I.S. - SABANA LLANA T.C,September 17 07:45',September 17 20:00',<500,Unknown,Our power restoration team is onsite conducting critical repairs to restore power the area as quickly and safely as possible. 
,SAN JUAN S.P. - VIADUCTO T.C. -,September 17 06:24',September 17 18:00',<500,Scheduled Maintenance,Our power restoration team is onsite conducting critical repairs to restore power the area as quickly and safely as possible. 
BAYAMON,"BDA. LA ALDEA, CMPA. CIUDAD DEL NInO, CMPD. MARIANO (TITO ORTIZ), CMPE. UNIVERSIDAD INTERAMERICANA RECINTO DE BAYAMON, COND. BOSQUE SERENO, COND. CHALETS LAS CUMBRES, COND. SHALOM FACILITY CARE ROYAL TOWN (EGIDA), SECT. LOS ALVAREZ, SECT. LOS MARREROS, SE",September 16 16:54',September 17 19:00',<500,Unplanned,Our power restoration team is onsite conducting critical repairs to restore power the area as quickly and safely as possible. 