Municipality,Sector,Outage Reported,Estimated Time of Restoration,Estimated Customers Impacted,Category,Current Status
MANATI,"COMU. LA MONA, COMU. SAN JOSE, COMU. VILLA BLANCA, COND. MAR CHIQUITA APARTMENTS, COND. MAR CHIQUITA CONDOMINIUM, COND. MAR CHIQUITA OCEAN VIEW, COND. PARAISO DE MAR CHIQUITA, IND. INDUSTRIAL SAN JOSE, SECT. BOQUILLAS, SECT. EL ALTO, SECT. LA CALIFORNIA, ",July 11 18:16',July 11 23:00',2001-2500,Unplanned,Our local power restoration team is being dispatched to the area as soon as possible. 
MAYAGUEZ,"COND. EL CASTILLO, COND. VILLAS CENTROAMERICANAS, IND. ZONA INDUSTRIAL, SECT. CALLE LOS INGENIEROS, SECT. CALLE PERPETUO SOCORRO, SECT. CAMINO CRISTO DE LOS MILAGROS, SECT. EL SECO, SECT. PITILLO, URB. ALTURAS DE MAYAGUEZ, URB. JARDINES DEL OBISPADO, URB.",July 11 17:03',July 11 19:00',1001-1500,Unplanned,Our local power restoration team is being dispatched to the area as soon as possible. 
SAN SEBASTIAN,"EDU. ESCUELA JULIO BABILONIA, SECT. BARRETO HERNANDEZ, SECT. BOSQUES, SECT. SABANA, SECT. SAN LORENZO, SECT. SEGUI, EDU. ESCUELA NARCISO RABELL CABRERO, SECT. AGAPITO ROSADO, SECT. BEJUCO, SECT. GELO RAMOS, SECT. LABERINTO, SECT. LA PIEDRA, SECT. LA VEGA,",July 11 10:13',July 11 19:00',<500,Unplanned,Our power restoration team is onsite conducting critical repairs to restore power the area as quickly and safely as possible. 
BARCELONETA,"SECT. VIBORA, URB. COSTA DE ORO, ARE. EXTENSION PUNTA PALMAS",July 11 09:15',July 11 19:00',501-1000,Scheduled Maintenance,Our power restoration team is onsite conducting critical repairs to restore power the area as quickly and safely as possible. 
AGUADILLA,"CMPG. ANTIGUA BASE RAMEY, RES. RESIDENCIAL AGUSTIN STAHL, SECT. EL COBO, SECT. EL CUCO, SECT. EL MACETAZO, SECT. LA ALAMBRA, SECT. PLAYUELA, SECT. REPARTO TRES PALMAS, SECT. VILLA BETANIA, URB. BORINQUEN, URB. VILLAS DEL HORIZONTE, URB. VILLAS DE PALMA RE",July 11 09:15',July 11 19:00',501-1000,Unplanned,Our power restoration team is onsite conducting critical repairs to restore power the area as quickly and safely as possible. 
GUAYAMA,"COMU. CARMEN, COMU. OLIMPO, COMU. VILLA NUEVA, EDU. ESCUELA JUAN ALEMAnY SILVA, SECT. CASCO URBANO, SECT. CULEBRA, SECT. EL PALO, SECT. ENCHAUTEGUI, SECT. LINEA CAPO, SECT. LOS BARROS, SECT. LOS BERNIELES, SECT. PALMAS BAJAS, SECT. RANCHOS GUAYAMA, SECT. ",July 11 09:09',July 11 19:00',501-1000,Scheduled Maintenance,Our power restoration team is onsite conducting critical repairs to restore power the area as quickly and safely as possible. 
GUAYAMA,"ARE. AREA RECREATIVA, CMPD. COMPLEJO DEPORTIVO MUNICIPAL DE GUAYAMA, CMPE. INSTITUTO TECNOLOGICO DE PUERTO RICO RECINTO GUAYAMA, COME. LA FUENTE TOWN CENTER, COME. PLAZA DEL MERCADO DE GUAYAMA, COME. SAN VICENTE MALL, EDU. ACADEMIA SAN ANTONIO, EDU. ESCUE",July 11 08:31',July 11 19:00',1501-2000,Scheduled Maintenance,Our power restoration team is onsite conducting critical repairs to restore power the area as quickly and safely as possible. 