Municipality,Sector,Outage Reported,Estimated Time of Restoration,Estimated Customers Impacted,Category,Current Status
SAN JUAN,"COND. METRO COURT, RES. RESIDENCIAL VILLA ESPAnA, URB. LAS LOMAS",July 02 06:50',July 02 09:30',1501-2000,Unplanned,Enroute
SAN JUAN,SECT. LA CERAMICA,July 02 06:40',July 02 09:30',<500,Unplanned,Enroute
,"MONACILLO A SABANA LLANA  LAS CUEVAS, CARRAIZO, SECT. LOS COLONES, SECT. LOS MARQUEZ, SECT. MARIA ANTONIA HERNANDEZ, SECT. PEN, SECT. CULEBRA, SECT. GONZALO CORTEZ, SECT. LUISA SANCHEZ, URB. BRISAS DE LA GLORIA",July 02 06:18',July 02 10:00',501-1000,Unplanned,Our local power restoration team is being dispatched to the area as soon as possible. 
CAYEY,"COMU. PASTO VIEJO, EDU. ESCUELA REXFORD GUY TUGWELL, SECT. CRUZ, SECT. EL CAMPITO, SECT. EL HATO, SECT. GORITO, SECT. LOS GUZMAN, SECT. LOS PAGANES, SECT. MORENO, SECT. TOnO SAEZ, URB. VISTAS DEL SUR PLANTATION, SECT. SANCHEZ, URB. VISTAS DEL CARIBE",July 02 06:15',July 02 09:30',1501-2000,Unplanned,Our local power restoration team is being dispatched to the area as soon as possible. 
CANOVANAS,"COME. THE OUTLET MALL 6, COND. ALBORADA , URB. ESTANCIAS DEL RIO, URB. RIVER GARDENS, URB. RIVER GARDENS ESTATES, URB. RIVER PLANTATION, COME. PLAZA NORESTE SHOPPING CENTER, ONG. HOGAR SANTA TERESA TODA HERMANAS CARMELITA, SECT. PALMAREJO, URB. COUNTRY VI",July 02 06:00',July 02 11:00',2501-3000,Unplanned,Our local power restoration team is being dispatched to the area as soon as possible. 
RIO GRANDE,"PARC. CAROLA, SECT. MABI, SECT. MUnIZ MUnIZ, SECT. PALMER",July 02 05:50',July 02 10:00',3501-4000,Unplanned,Our local power restoration team is being dispatched to the area as soon as possible. 
BARRANQUITAS,"EDU. ESCUELA CAnABON ABAJO, SECT. BARRANCAS PARCELAS NUEVAS, SECT. BARRANCAS PARCELAS VIEJAS, SECT. CAnABON, SECT. EL COLLAO, SECT. LAJITAS, SECT. ORTIZ, SECT. LA PAJONA, SECT. LOS ALVARADO, SECT. MANA",July 02 05:46',July 02 10:00',2001-2500,Unplanned,Our local power restoration team is being dispatched to the area as soon as possible. 
FAJARDO,"COME. VILLA MARINA SHOPPING CENTER, COND. PALMA VISTA, COND. SIETE MARES, RES. RESIDENCIAL PEDRO ROSARIO, SECT. LAS CROABAS, URB. LA ROCA, URB. LINDO MONTE, URB. MONTE BRISAS 3, URB. RAFAEL BERMUDEZ, URB. SANTA ISIDRA 1, URB. SANTA ISIDRA 2, URB. SANTA IS",July 02 05:43',July 02 10:00',1501-2000,Unplanned,Our local power restoration team is being dispatched to the area as soon as possible. 