Municipality,Sector,Outage Reported,Estimated Time of Restoration,Estimated Customers Impacted,Category,Current Status
,GAUTIER BENITEZ A VEREDAS,February 02 08:19',February 02 14:00',4501-5000,Unplanned,"LUMA has successfully completed repairs and restored power to the area. If you have any questions, please contact us at 1-844-888-5862 (LUMA). "
,     TRAMO ACB'S 0335A - 0381B ,January 21 13:45',February 02 23:00',<500,Unplanned,Our power restoration team is onsite conducting critical repairs to restore power the area as quickly and safely as possible.
SAN JUAN,"CMPS. CENTRO MEDICO, URB. REPARTO METROPOLITANO, URB. VILLA NEVAREZ",February 02 10:20',February 02 16:00',1501-2000,Unplanned,Enroute
ARROYO,"BDA. LAS MERCEDES, COMU. BUENA VISTA, COMU. EXTENSION BUENA VISTA, COMU. LAS 500, EDU. ESCUELA EDMUNDO DEL VALLE, PARC. NUEVAS DE LA BARRIADA MARIN, SECT. ANTIGUA, SECT. CHARDON, SECT. EL MULTAR, SECT. EL PIOJO, SECT. EMAJAGUAL, SECT. JACANA, SECT. LAS 25",February 02 09:32',February 02 16:00',501-1000,Scheduled Maintenance,Our power restoration team is onsite conducting critical repairs to restore power the area as quickly and safely as possible. 
AGUADILLA,"PUEBLO DE AGUADILLA, AGUADILLA MALL, AVE. CORAZONEZ, EL PASEO REAL MARINA",February 02 08:46',February 02 14:00',<500,Unplanned,Our local power restoration team is being dispatched to the area as soon as possible. 
MANATI,"BDA. FELIX CORDOVA DAVILA, CMPD. ACROPOLIS DE MANATI, COME. TRIGAL PLAZA, COMU. REPARTO EXPRESO, COND. ATENAS COURT, COND. VILLAS DE MANATI, PARC. MONTE BELLO, PARC. PINZON, SECT. CANTA GALLO, SECT. EL CUCO, SECT. EL LLANO, SECT. EL RAYO, SECT. HOYOS MALO",February 02 07:40',February 02 15:30',501-1000,Scheduled Maintenance,Our power restoration team is onsite conducting critical repairs to restore power the area as quickly and safely as possible. 
SAN JUAN,"EDU. ESCUELA WILLIAM D. BOYCE, RES. RESIDENCIAL VILLA ESPAnA, URB. LAS LOMAS",February 02 07:20',February 02 13:00',501-1000,Unplanned,Our power restoration team is onsite conducting critical repairs to restore power the area as quickly and safely as possible. 
ADJUNTAS,"BDA. ACUEDUCTO, BDA. RODRIGUEZ, BDA. RULLAN, BDA. SALSIPUEDES, BDA. SAN FELIPE, CMPD. COMPLEJO RECREATIVO GUARIONEX POLIDEPORTIVO, EDU. ESCUELA DOMINGO PIETRI RUIZ, RES. RESIDENCIAL VALLE VERDE HOUSING, RES. RESIDENCIAL VILLA VALLE VERDE, SECT. CARABALLO,",February 02 04:31',February 02 10:00',<500,3rd Party Damage,Our power restoration team is onsite conducting critical repairs to restore power the area as quickly and safely as possible. 