Municipality,Sector,Outage Reported,Estimated Time of Restoration,Estimated Customers Impacted,Category,Current Status
SAN JUAN,"ARE. AREA RECREATIVA DE SAN JOSE, COMU. SIERRA MAESTRA, COND. LOS GIRASOLES, EDU. ESCUELA ELEMENTAL SANTIAGO IGLESIAS PANTIN, EDU. ESCUELA INTERMEDIA DR. JOSE N. GANDARA, ONG. HOGAR CREA SAN JOSE, SECT. VILLA CLEMENTE, URB. EMBALSE SAN JOSE, URB. SAN JOSE",February 10 09:50',February 10 19:00',1501-2000,Scheduled Maintenance,"LUMA has successfully completed repairs and restored power to the area. If you have any questions, please contact us at 1-844-888-5862 (LUMA). "
GUAYNABO,"CEM. CEMENTERIO NUEVO BARRIO FRAILES, IND. LOS FRAILES INDUSTRIAL PARK, URB. BELLOMONTE, URB. OASIS GARDENS",February 10 07:50',February 10 19:00',501-1000,Scheduled Maintenance,"LUMA has successfully completed repairs and restored power to the area. If you have any questions, please contact us at 1-844-888-5862 (LUMA). "
MAYAGUEZ,"COM. CLUB DEPORTIVO DE MAYAGUEZ, COND. MAJAGUAL 1, COND. MAJAGUAL 2, RES. RESIDENCIAL CANDELARIA, RES. RESIDENCIAL EL CARMEN, RES. RESIDENCIAL KENNEDY, RES. RESIDENCIAL RAMIREZ DE ARELLANO, URB. GUANAJIBO HOMES, URB. MIRAMAR, URB. RAMIREZ DE ARELLANO, URB",February 10 06:50',February 10 19:00',2501-3000,Scheduled Maintenance,"LUMA has successfully completed repairs and restored power to the area. If you have any questions, please contact us at 1-844-888-5862 (LUMA). "
SAN SEBASTIAN,URB. VALLE VERDE,February 10 17:40',February 10 23:00',2501-3000,Unplanned,Our local power restoration team is being dispatched to the area as soon as possible. 
GUAYNABO,"CMPD. PARQUE DE RECREO PALMA REAL, CMPD. PARQUE RECREO, COME. JARDINES REALES SHOPPING CENTER, COM. PLAZOLETA LAS CUMBRES, COND. ALTOS REALES, COND. BALCONES DE GUAYNABO, COND. CHALETS DEL PARQUE, COND. MONTE MAYOR, COND. MURANO LUXURY APARTMENTS, COND. P",February 10 13:23',February 10 19:00',2001-2500,Scheduled Maintenance,Our power restoration team is onsite conducting critical repairs to restore power the area as quickly and safely as possible. 
GUAYNABO,"BDA. CRUZ MELENDEZ, COND. GRANADA PARK, COND. PORTALES DE ALHELÃ, RES. RESIDENCIAL MARTINEZ NADAL, RES. RESIDENCIAL ROSALEDA, SECT. EL ULTIMO CHANCE, SECT. PEnAGARICANO, URB. EL JARDIN, URB. EXTENSION PARKVILLE TOWN HOUSE, URB. HIGHLAND GARDENS, URB. LOS ",February 10 09:50',February 10 20:00',2001-2500,Scheduled Maintenance,Our power restoration team is onsite conducting critical repairs to restore power the area as quickly and safely as possible. 
GUAYNABO,"CMPA. COLISEO MARIO MORALES, COM. GASOLINERA TOTAL EXCELLIUM, COM. SEARS ROEBUCK DE PUERTO RICO, COND. ALAMANDA, COND. BALCONES DE SAN PEDRO, COND. GRAND VIEW, COND. PARQUE DE TERRANOVA, COND. PORTAL DE SOFIA, EDIF. DESING PLAZA CORPORATION, EDIF. ESCOBAL",February 10 06:50',February 10 19:00',2001-2500,Scheduled Maintenance,Our power restoration team is onsite conducting critical repairs to restore power the area as quickly and safely as possible. 
,TRAMO > COMERIO > CIDRA,February 07 18:45',February 10 20:00',<500,Unplanned,Our power restoration team is onsite conducting critical repairs to restore power the area as quickly and safely as possible.
,TRAMO > 4 HERMANOS  > ACACIA T.C,February 07 06:45',February 10 18:00',<500,Unplanned,Our power restoration team is onsite conducting critical repairs to restore power the area as quickly and safely as possible. 