Municipality,Sector,Outage Reported,Estimated Time of Restoration,Estimated Customers Impacted,Category,Current Status
,"HUMACAO TC A VERDEMAR CEM. CEMENTERIO VERDE MAR, COMU. JUNQUITO, EDU. ESCUELA JOSE TORO RIOS, IND. BRISTOL MYERS SQUIBB, PARC. BAJANDAS, SECT. ALTURAS DE JUNQUITO, SECT. PARCELAS EL BATEY, URB. ALTURAS DE BUSO, URB. ALTURAS DEL ESTE, URB. CIUDAD CRISTIANA, URB. EL RETIRO, URB. EXTENSION BUSO, URB. EXTENSION VERDE MAR, URB. JARDINES DIVERSILANDIA, URB. LA ESTANCIA, URB. VERDE MAR, URB. VILLA HUMACAO, URB. VILLA PALMIRA, URB. VILLA PALMIRA TOWN HOUSE, PARC. LA OLA , PARC. NUEVAS PUNTA SANTIAGO, PARC. VIEJAS PUNTA SANTIAGO, URB. TROPICAL BEACH ",April 22 14:40',April 22 20:00',3001-3500,Unplanned,"LUMA has successfully completed repairs and restored power to the area. If you have any questions, please contact us at 1-844-888-5862 (LUMA). "
GUAYAMA,"BDA. MOSQUITO, CMPG. COMPLEJO CORRECCIONAL DE GUAYAMA, COMU. BARRANCA, COMU. MIRAMAR, COMU. NUEVO AMANECER, COMU. POZUELO, COMU. SAN MARTIN, COMU. SANTA ANA, COND. EL LEGADO CHICHI RODRIGUEZ GOLF RESORT, EDU. ESCUELA JOSE MUnOZ VAZQUEZ, IND. PLANTA DE HOR",April 22 15:55',April 22 21:00',3501-4000,Unplanned,Our power restoration team is onsite conducting critical repairs to restore power the area as quickly and safely as possible.
SAN JUAN,"HOTEL LA CONCHA, HOTEL VANDERBILT, VENTANA DEL MAR, IGL. PARROQUIA SAN MERRITZ",April 22 06:43',April 22 20:00',<500,Unplanned,Our local power restoration team is being dispatched to the area as soon as possible. 
,BALDRICH-ACB 3201B MAPFRE,April 21 05:33',April 22 19:00',<500,Unplanned,Our power restoration team is onsite conducting critical repairs to restore power the area as quickly and safely as possible.
,TRAMO > MONACILLOS > CENTRO MEDICO,April 17 18:10',April 22 21:00',<500,Unplanned,Our power restoration team is onsite conducting critical repairs to restore power the area as quickly and safely as possible.