Municipality,Sector,Outage Reported,Estimated Time of Restoration,Estimated Customers Impacted,Category,Current Status
SALINAS,"IND. HACIENDA LAS CAROLINAS, IND. SALINAS INDUSTRIAL PARK, PARC. LAS 80, RES. RESIDENCIAL BRISAS DEL MAR, SECT. ARENAL, SECT. BORINQUEN, SECT. CASCO URBANO, SECT. COCO MARGARITA, SECT. LAS MERCEDES DE LOS POLEOS, SECT. POLEOS, SECT. VILLA COFRESI, SECT. V",December 18 07:05',December 18 17:00',>5000,Scheduled Maintenance,"LUMA has successfully completed repairs and restored power to the area. If you have any questions, please contact us at 1-844-888-5862 (LUMA). "
MANATI,"COMU. LA MONA, COMU. SAN JOSE, COMU. VILLA BLANCA, COND. MAR CHIQUITA APARTMENTS, COND. MAR CHIQUITA CONDOMINIUM, COND. MAR CHIQUITA OCEAN VIEW, COND. PARAISO DE MAR CHIQUITA, IND. INDUSTRIAL SAN JOSE, SECT. BOQUILLAS, SECT. EL ALTO, SECT. LA CALIFORNIA, ",December 18 07:05',December 18 17:00',2001-2500,Scheduled Maintenance,"LUMA has successfully completed repairs and restored power to the area. If you have any questions, please contact us at 1-844-888-5862 (LUMA). "
MAYAGUEZ,"CMPD. ESTADIO CENTROAMERICANO DE MAYAGUEZ, COND. JARDIN DE SANTA MARIA, RES. RESIDENCIAL KENNEDY, SECT. LA MARINA, URB. SANTA MARIA",December 15 13:20',December 18 17:00',<500,Unplanned,"LUMA has successfully completed repairs and restored power to the area. If you have any questions, please contact us at 1-844-888-5862 (LUMA). "
,HATO TEJAS TC - DORADO TC ,December 18 14:45',December 18 20:45',<500,Unplanned,Our local power restoration team is being dispatched to the area as soon as possible. 
CAROLINA,"CMPD. POLIDEPORTIVO GUILLERMO ANGULO, COND. BRISAS DE BORINQUEN 1, COND. BRISAS DE BORINQUEN 2, COND. LAS PRIMAVERAS, COND. SAN CIPRIAN 1, COND. SAN CIPRIAN 2, COND. SAN CIPRIAN 3, COND. VILLA CAROLINA COURT, EDU. ESCUELA ELEMENTAL AMALIA EXPOSITO, IGL. I",December 18 14:45',December 18 20:45',1001-1500,Unplanned,Our local power restoration team is being dispatched to the area as soon as possible. 