Municipality,Sector,Outage Reported,Estimated Time of Restoration,Estimated Customers Impacted,Category,Current Status
,"LINEA 10000//4000 BAYAMON PUEBLO-MAGNOLIA-LOMAS VERDES-NARANJITO  COND. SANTA JUANITA HOUSING, URB. FOREST VIEW, URB. SANTA JUANITA 1, URB. SANTA JUANITA 2, URB. SANTA JUANITA 3, CMPD. BAYAMON SOCCER COMPLEX, SECT. ESTEBAN CRUZ, SECT. LA LOMITA, URB. EL CORTIJO, URB. SANTA JUANITA 1, URB. SANTA JUANITA 5, URB. SANTA JUANITA 6, URB. SANTA JUANITA 7, URB. SANTA JUANITA 8, URB. SUNNY HILLS, EDU. ESCUELA CARLOS ORAMA PADILLA, URB. FOREST VIEW, URB. MAGNOLIA GARDENS, URB. VILLA CONTESSA, COND. PASEO SANTA JUANITA, RES. RESIDENCIAL MAGNOLIA GARDENS, URB. CAMPO ALEGRE, URB. COUNTRY ESTATES, URB. EXTENSION CAMPO ALEGRE, URB. EXTENSION FRANCISCO OLLER, URB. FRANCISCO OLLER, URB. MAGNOLIA GARDENS  URB. ALTURAS DE FLAMBOYAN, URB. GOLDEN HILLS, URB. LOMAS VERDES 4, URB. ROYAL PALM, URB. SANTA JUANITA 3, SECT. TORTUGUERO, URB. BRAULIO DUEnO COLON, URB. EXTENSION FOREST HILLS, URB. FLAMBOYAN GARDENS, URB. ROYAL PALM, URB. VILLA CONTESSA, URB. EXTENSION FOREST HILLS, URB. FOREST VIEW, URB. LOMAS VERDES 4, URB. VILLA CONTESSA    ",June 18 15:28',June 18 21:00',<500,Unplanned,Our local power restoration team is being dispatched to the area as soon as possible. 
COROZAL,"SECT. MAVILLA, URB. EXTENSION MARIA DEL CARMEN, SECT. ARTURO MORALES, SECT. CUCHILLAS, SECT. CUCHILLAS PACHECO, SECT. LOS GUAYABOS, SECT. LOS QUILES, SECT. SICO MARTINEZ, COME. PLAZA AQUARIUM MALL, SECT. CHARRIEZ, SECT. LOMAS GARCIA, SECT. LOS SANCHEZ",June 18 15:11',June 18 21:00',501-1000,Unplanned,Our power restoration team is onsite conducting critical repairs to restore power the area as quickly and safely as possible. 
YAUCO,"SECT. LA REPUBLICA, SECT. LOS HERNANDEZ, SECT. QUInONES, URB. QUINTAS DE VALLE VERDE, URB. VILLAS DEL CAFETAL 2",June 18 12:00',June 18 18:00',1001-1500,Scheduled Maintenance,Our power restoration team is onsite conducting critical repairs to restore power the area as quickly and safely as possible. 
SALINAS,"IND. HACIENDA LAS CAROLINAS, IND. SALINAS INDUSTRIAL PARK, PARC. LAS 80, RES. RESIDENCIAL BRISAS DEL MAR, SECT. ARENAL, SECT. BORINQUEN, SECT. CASCO URBANO, SECT. COCO MARGARITA, SECT. LAS MERCEDES DE LOS POLEOS, SECT. POLEOS, SECT. VILLA COFRESI, SECT. V",June 18 09:12',June 18 18:00',<500,Scheduled Maintenance,Our power restoration team is onsite conducting critical repairs to restore power the area as quickly and safely as possible. 
AGUADILLA,"COND. PARQUE LOS CAOBOS, RES. RESIDENCIAL CUESTA VIEJA, RES. RESIDENCIAL JOSE DE DIEGO, RES. RESIDENCIAL JUAN GARCIA DUCOS, RES. RESIDENCIAL PUESTA DEL SOL, SECT. AGUADILLA PUEBLO, SECT. CALLEJON DEL FUERTE, SECT. CUESTA NUEVA, SECT. CUESTA VIEJA, SECT. L",June 18 08:28',June 18 18:00',501-1000,Scheduled Maintenance,Our power restoration team is onsite conducting critical repairs to restore power the area as quickly and safely as possible. 
JUANA DIAZ,"COMU. EXTENSION GUAYABAL, COMU. GUAYABAL, EDU. ESCUELA JUANITA RIVERA, SECT. CERRO, SECT. CUEVITAS, SECT. LA COLONIA, SECT. LAS MAGAS, SECT. PASO HONDO, SECT. RINCON, URB. ESTANCIA DEL GUAYABAL, URB. RESIDENCIAL LOMAS, URB. URSULA MILAN, URB. VALLE ESMERA",June 18 07:33',June 18 18:00',1501-2000,Unplanned,Our power restoration team is onsite conducting critical repairs to restore power the area as quickly and safely as possible. 
,TRAMO > BUENA VISTA > PONCE TC,June 15 19:10',June 18 20:00',<500,Unplanned,Our power restoration team is onsite conducting critical repairs to restore power the area as quickly and safely as possible.
,TRAMO > VIADUCTO > PARQUES Y RECREOS,June 14 03:55',June 18 13:00',<500,Unplanned,Our power restoration team is onsite conducting critical repairs to restore power the area as quickly and safely as possible.