Municipality,Sector,Outage Reported,Estimated Time of Restoration,Estimated Customers Impacted,Category,Current Status
,,,,,,
SAN JUAN,"CMPA. LOS PASEOS CLUB HOUSE, COM. CENTRO DE CONVECIONES LOS PASEOS, COND. CHURCHILL PARK, COND. COLINA REAL, COND. GARDEN VALLEY CLUB, COND. PARQUE EL SEnORIAL 251, COND. PASEO DEL BOSQUE, COND. PASEO DEL ROCIO, COND. PASEO MONTE, COND. VILLAS DEL SEnORIA",October 04 21:36',October 05 04:00',1501-2000,Unplanned,Our local power restoration team is being dispatched to the area as soon as possible. 
CAROLINA,"URB. EXTENSION EL COMANDANTE, URB. COUNTRY CLUB",October 04 21:34',October 05 04:00',501-1000,Unplanned,Our local power restoration team is being dispatched to the area as soon as possible. 
,TRAMO > BAYAMON P > NARANJITO,October 04 21:25',October 05 04:30',>5000,Unplanned,Enroute
,CONQUISTADOR > MONACILLOS.,October 04 21:11',October 05 15:00',<500,Unplanned,Our power restoration team is onsite conducting critical repairs to restore power the area as quickly and safely as possible.
CULEBRA,"BO. FULLADOZA, PUEBLO, FLAMENCO, PLAYA SARDINAS, BDA. CLARK, BDA. VILLA MUnECO, CEM. CEMENTERIO MUNICIPAL DE CULEBRA, COMU. VILLA FLAMENCO, COND. COSTA BONITA RESOT, SECT. LA ROMANA, URB. ALTURAS DE ZONI, URB. LA PERLA, URB. PLAYA CLARA, URB. PUNTA VIENTO",October 04 19:05',October 05 15:00',<500,Unplanned,Our local power restoration team is being dispatched to the area as soon as possible. 
, BUENA VISTA @ MERCEDITAS,October 04 17:25',October 05 18:00',<500,Unplanned,Our power restoration team is onsite conducting critical repairs to restore power the area as quickly and safely as possible.
,TRAMO > INDIERA A YAUCO I,October 04 02:02',October 05 18:00',<500,Unplanned,Our power restoration team is onsite conducting critical repairs to restore power the area as quickly and safely as possible.