Municipality,Sector,Outage Reported,Estimated Time of Restoration,Estimated Customers Impacted,Category,Current Status
AGUADILLA,"COMU. PALMAR, RES. RESIDENCIAL JOSE AGUSTIN APONTE, SECT. AGUADILLA PUEBLO, SECT. AVENIDA LOS CORAZONES, SECT. CERRO VISBAL, SECT. GONZALO, SECT. MONTE BRUJO",March 27 09:45',March 27 19:00',501-1000,Scheduled Maintenance,"LUMA has successfully completed repairs and restored power to the area. If you have any questions, please contact us at 1-844-888-5862 (LUMA). "
JUANA DIAZ,"COMU. CRISTINA, COMU. PIEDRA AGUZA, COMU. SANTA MARTA, SECT. LAS PALMAS, URB. ALTURAS DEL ENCANTO, URB. EXTENSION JACAGUAX, URB. EXTENSION LAS MARIAS, URB. QUINTAS DE ALTAMIRA, URB. REPARTO LAS MARIAS, URB. VALLE HUCARES, URB. VILLA EL ENCANTO, URB. VILLA",March 27 08:48',March 27 19:00',1001-1500,Scheduled Maintenance,"LUMA has successfully completed repairs and restored power to the area. If you have any questions, please contact us at 1-844-888-5862 (LUMA). "
SAN JUAN,"COND. ATRIUM PLAZA, COND. LA MORADA APARTMENTS, SECT. LA CERAMICA, EDIF. TELEMUNDO / WKAQ, EDU. HEAD START NEMESIO R. CANALES, IND. URBANIZACION INDUSTRIAL TRES MONJITAS, AVE. CHARDON, HATO REY NORTE, AVE. CHARDON, HATO REY NORTE, HATO REY CENTRAL",March 27 18:05',March 27 23:00',2001-2500,Unplanned,Our local power restoration team is being dispatched to the area as soon as possible. 
SAN JUAN,"CMPE. COLEGIO UNIVERSITARIO DE SAN JUAN, CMPG. FEDERAL COURT BUILDINGS, COND. PARQUE CENTRO, COND. SAN JUAN CHATEAU, IND. URBANIZACION INDUSTRIAL TRES MONJITAS, PLAZA LAS AMERICAS, PLAZA LAS AMERICAS, ARTERIAL HOSTOS, HATO REY CENTRO, NEW SAN JUAN, HATO R",March 27 18:05',March 27 23:00',501-1000,Unplanned,Our local power restoration team is being dispatched to the area as soon as possible. 
SAN JUAN,"CMPG. ARMY RESERVE CENTER, CMPG. SAN PATRICIO FOREST, EDU. ESCUELA ELEMENTAL EUGENIO MARIA DE HOSTOS, FGE. ESTACION DE BOMBEROS DE SAN JUAN, FGE. INSTITUTO DEL DENGUE, URB. CAPARRA TERRACE, URB. PUERTO NUEVO",March 26 10:50',March 27 20:00',<500,Unplanned,Our power restoration team is onsite conducting critical repairs to restore power the area as quickly and safely as possible. 
,TRAMO DE PUERTA DE TIERRAS -COVADONGA GIS,March 12 10:39',March 28 18:00',<500,Unplanned,Our power restoration team is onsite conducting critical repairs to restore power the area as quickly and safely as possible.