Municipality,Sector,Outage Reported,Estimated Time of Restoration,Estimated Customers Impacted,Category,Current Status
PONCE,"COMU. LA CUARTA , SECT. TIBURONES, COMU. AGUILITA, COMU. BRISAS DE MARAVILLA, EDU. ESCUELA AGUILITA, PARC. NUEVAS AGUILITA, SECT. RENOVALES, URB. EXTENSION LA FE, URB. LA FE, URB. SANTA RITA 1, URB. SANTA RITA 2, URB. VILLAS DE LA ESPERANZA, VERT. VERTEDE",July 24 20:17',July 24 23:00',3001-3500,3rd Party Damage,"LUMA has successfully completed repairs and restored power to the area. If you have any questions, please contact us at 1-844-888-5862 (LUMA). "
ISABELA,"CARR #2, WALGREENS",July 24 10:36',July 24 21:00',<500,Scheduled Maintenance,"LUMA has successfully completed repairs and restored power to the area. If you have any questions, please contact us at 1-844-888-5862 (LUMA). "
MAYAGUEZ,"PARC. NUEVAS MARINI, PARC. SAN CARLOS, SECT. BALBOA, SECT. CALLE FRONTONES, SECT. CAMINO JUSTINIANO, SECT. CAMINO LOS LECLERC, SECT. CAMINO LOS SANCHEZ, SECT. CAMINO PABLO FLORES OLIVIERI, SECT. CAMINO PARES, SECT. CAMINO SANTALIZ, SECT. CASCO URBANO, SEC",July 24 21:41',July 24 23:00',2001-2500,Unplanned,Our local power restoration team is being dispatched to the area as soon as possible. 
,MAYAGUEZ PLANTA - ACACIAS TC ,July 24 21:41',July 24 23:00',<500,Unplanned,Our power restoration team is onsite conducting critical repairs to restore power the area as quickly and safely as possible.
,TRAMO > YAUCO 2 > SAN GERMAN,July 24 08:18',July 25 20:00',<500,Unplanned,Our power restoration team is onsite conducting critical repairs to restore power the area as quickly and safely as possible.
,MANATI TC - VEGA BAJA TC ,July 23 11:47',July 25 20:00',<500,Unplanned,Our power restoration team is onsite conducting critical repairs to restore power the area as quickly and safely as possible.