Municipality,Sector,Outage Reported,Estimated Time of Restoration,Estimated Customers Impacted,Category,Current Status
ARECIBO,"COM. ARECIBO CINEMA, SECT. LAS CANELAS, SECT. SAN DANIEL , URB. ALTURAS DE SAN DANIEL, URB. REPARTO SAN MIGUEL, COM. BANCO VILBAO VIZCAYA, COME. PLAZA DEL NORTE SHOPPING CENTER, COM. TOYS'R'US PLAZA DEL NORTE",May 07 08:50',May 07 13:00',<500,Unplanned,"LUMA has successfully completed repairs and restored power to the area. If you have any questions, please contact us at 1-844-888-5862 (LUMA). "
CANOVANAS,"EDU. ESCUELA JOBOS, RES. RESIDENCIAL BRISAS DE LOIZA, RES. RESIDENCIAL LOIZA GARDENS, RES. RESIDENCIAL SAN PATRICIO, RES. RESIDENCIAL YUQUIYU, SECT. EL JOBO, SECT. LA 23, SECT. LOS MILLONARIOS, SECT. VILLA DEL CARMEN, SECT. VILLA KENNEDY, URB. ESTANCIAS D",May 07 06:05',May 07 11:00',1501-2000,Unplanned,"LUMA has successfully completed repairs and restored power to the area. If you have any questions, please contact us at 1-844-888-5862 (LUMA). "
GUAYANILLA,"SECT. LA MACHINA, SECT. VEGA LINDA, URB. EXTENSION GUAYDIA, URB. EXTENSION SANTA ELENA 1, URB. EXTENSION SANTA ELENA 2, URB. GUADYA, URB. SAN AUGUSTO, URB. SANTA ELENA, URB. SANTA MARIA, EDU. ESCUELA QUEBRADAS, PARC. QUEBRADAS, SECT. EL MANANTIAL, SECT. E",May 07 09:15',May 07 17:00',<500,Scheduled Maintenance,Our power restoration team is onsite conducting critical repairs to restore power the area as quickly and safely as possible. 
AÑASCO,"EDU. ESCUELA ALICIDES FIGUEROA, PARC. JOSEFA, RES. RESIDENCIAL VISTAS DE AnASCO, SECT. ALTURAS DE LIBRADA, SECT. CASCO URBANO, SECT. CERRO GORDO, SECT. LIBRADA, SECT. MATA Y ORSINI, SECT. VILLA AVILES, URB. ALTURAS DE LIBERTAD 2, URB. ESTANCIAS DE VALLE V",May 06 18:16',May 07 14:00',<500,Unplanned,Our power restoration team is onsite conducting critical repairs to restore power the area as quickly and safely as possible. 
,AGUADILLA T-BONE,May 06 00:51',May 07 21:00',<500,Unplanned,Our power restoration team is onsite conducting critical repairs to restore power the area as quickly and safely as possible.