Municipality,Sector,Outage Reported,Estimated Time of Restoration,Estimated Customers Impacted,Category,Current Status
SAN JUAN,"COND. ALTAMESA GARDENS, COND. CHALETS DE LANDRAU, COND. PARQUE DE MONACILLOS, COND. PORTALES DE ALTAMESA, COND. PORTAL URBANO 1, COND. SAN IGNACIO, RES. RESIDENCIAL EL MANANTIAL, SECT. MONACILLO, URB. ALTAMESA, URB. COLLEGE PARK, URB. REPARTO LANDRAU",October 04 14:16',October 04 20:00',501-1000,Unplanned,"LUMA has successfully completed repairs and restored power to the area. If you have any questions, please contact us at 1-844-888-5862 (LUMA). "
, San GermAn TC – ACB 1219A,September 30 13:39',October 05 16:00',<500,Unplanned,Our power restoration team is onsite conducting critical repairs to restore power the area as quickly and safely as possible.
ADJUNTAS,"BDA. ACUEDUCTO, BDA. RODRIGUEZ, BDA. RULLAN, BDA. SALSIPUEDES, BDA. SAN FELIPE, CMPD. COMPLEJO RECREATIVO GUARIONEX POLIDEPORTIVO, EDU. ESCUELA DOMINGO PIETRI RUIZ, RES. RESIDENCIAL VALLE VERDE HOUSING, RES. RESIDENCIAL VILLA VALLE VERDE, SECT. CARABALLO,",October 04 17:15',October 04 21:00',3001-3500,Unplanned,Our power restoration team is onsite conducting critical repairs to restore power the area as quickly and safely as possible. 
SAN JUAN,"CMPG. ARMY RESERVE CENTER, CMPG. SAN PATRICIO FOREST, EDU. ESCUELA ELEMENTAL EUGENIO MARIA DE HOSTOS, FGE. ESTACION DE BOMBEROS DE SAN JUAN, FGE. INSTITUTO DEL DENGUE, URB. CAPARRA TERRACE, URB. PUERTO NUEVO",October 04 02:05',October 04 19:00',<500,Unknown,Our power restoration team is onsite conducting critical repairs to restore power the area as quickly and safely as possible. 
,TRAMO > INDIERA A YAUCO I,October 04 02:02',October 04 19:00',<500,Unplanned,Our local power restoration team is being dispatched to the area as soon as possible. 
SAN JUAN,"COM. BANCO POPULAR DE PUERTO RICO, COM. SAGRADO CORAZON, EDU. ESCUELA ELEMENTAL CARMEN SANABRIA DE FIGUEROA, URB. ESTANCIAS DE SAN GERARDO, URB. NOSTALGIA DE SAN GERARDO, URB. SAGRADO CORAZON, URB. SAN GERARDO",October 03 11:15',October 04 19:00',<500,Unplanned,Our power restoration team is onsite conducting critical repairs to restore power the area as quickly and safely as possible. 