Municipality,Sector,Outage Reported,Estimated Time of Restoration,Estimated Customers Impacted,Category,Current Status
ARECIBO,"EDU. COLEGIO SAN FELIPE, RES. RESIDENCIAL EXTENSION MANUEL ZENO GANDIA",February 21 15:45',February 21 19:00',<500,Unplanned,Our power restoration team is onsite conducting critical repairs to restore power the area as quickly and safely as possible. 
LAS MARIAS,"COMU. ACEVEDO, COMU. GUILLERMO MARTINEZ, COMU. REPARTO SANTALIZ, COMU. SANTA ROSA, PARC. LAVERGNE, PARC. SANTA ROSA, SECT. EL LLANO, SECT. LA GUAJANA, SECT. LAS JUANITAS, SECT. LOS VEGA, SECT. PEPE TRABAL, SECT. SECTOR CALLE PALMER, URB. ESTANCIAS DE SANT",February 21 09:45',February 21 17:00',1501-2000,Scheduled Maintenance,Our power restoration team is onsite conducting critical repairs to restore power the area as quickly and safely as possible. 
LAJAS,"COMU. RAYO PLATA, PARC. LAJAS ARRIBA, PARC. LA PLATA, PARC. SANTA ROSA, SECT. LA GARZA, SECT. LA JAVILLA, SECT. LAS CUEVAS, SECT. PInALEJOS, SECT. VILLA SAN JOSE, SECT. VISTA ALEGRE, URB. ESTANCIA DE SANTA ROSA, URB. ESTANCIAS DEL PARRA 2, URB. EXTENSION ",February 21 08:36',February 21 17:00',1001-1500,Scheduled Maintenance,Our power restoration team is onsite conducting critical repairs to restore power the area as quickly and safely as possible. 
VEGA BAJA,"COMU. CANTERA, COMU. BRISAS DE TORTUGUERO, COMU. OJO DE AGUA, COMU. VILLA COLOMBO, PARC. PANAINI, SECT. EL HOYO, SECT. GUARICO, SECT. MISS KELLY, URB. CIARA DEL SOL, URB. ESTANCIAS DE CAMPO BELLO, URB. GUARICO, URB. JARDINES DE VEGA BAJA",February 21 08:35',February 21 17:00',<500,Scheduled Maintenance,Our power restoration team is onsite conducting critical repairs to restore power the area as quickly and safely as possible. 
CANOVANAS,"COMU. LAS 400, COMU. VILLA SIN MIEDO, EDU. ESCUELA EDUARDO GARCIA CARRILLO, EDU. ESCUELA ELEMENTAL BARRIO LAS 400, EDU. ESCUELA ELEMENTAL DOMINGO NIEVES ORTIZ, EDU. ESCUELA MANUEL AGOSTO LEBRON, EDU. ESCUELA PEDRO GUTIERREZ, IND. INDUSTRIAL PARK, PARC. BE",February 21 08:14',February 21 17:00',2001-2500,Scheduled Maintenance,Our power restoration team is onsite conducting critical repairs to restore power the area as quickly and safely as possible. 
CANOVANAS,"CMPR. CIUDAD JARDIN DE CANOVANAS, COND. PLAZA DEL ESTE, COND. VILLAS DE CIUDAD JARDIN DE CANOVANAS, IND. INDUSTRIAL PARK, PARC. CAMPO RICO, SECT. ALTURAS DE CAMPO RICO, URB. CIUDAD JARDIN 1 DE CANOVANAS, URB. CIUDAD JARDIN 2 DE CANOVANAS, URB. CIUDAD JARD",February 21 08:14',February 21 17:00',501-1000,Scheduled Maintenance,Our power restoration team is onsite conducting critical repairs to restore power the area as quickly and safely as possible. 