Municipality,Sector,Outage Reported,Estimated Time of Restoration,Estimated Customers Impacted,Category,Current Status
ARROYO,"ARE. PARQUE DE PELOTA, CMPT. VILLAS DE PUNTA GUILARTE, COND. ARROYO BEACH RESORT, COND. CAMPO MAR, COND. MAR DEL SUR, COND. VILLA DE PUNTA GUILARTE, COND. VILLA PHI DELTA, PARC. NUEVAS LA PALMA, PARC. VIEJAS LA PALMA, SECT. ACUEDUCTO, SECT. CONCORDIA, SEC",May 04 07:48',May 04 15:00',2001-2500,Unplanned,"LUMA has successfully completed repairs and restored power to the area. If you have any questions, please contact us at 1-844-888-5862 (LUMA). "
SAN JUAN,"CMPD. FRAIGCOMAR, CMPG. AUTORIDAD METROPOLITANA DE AUTOBUSES, FGM. DEFENSA CIVIL MUNICIPAL, IND. URBANIZACION INDUSTRIAL EL CINCO, RES. RESIDENCIAL LAS AMAPOLAS, RES. RESIDENCIAL SAN FERNANDO, URB. ALTURAS DE SANTA MARIA, URB. BELISA, URB. CARIBE, URB. CH",May 04 12:38',May 04 18:00',1501-2000,Unplanned,Our local power restoration team is being dispatched to the area as soon as possible. 
CAGUAS,"CEM. CEMENTERIO BORINQUEN MEMORIAL PARK 1, SECT. EL COQUI, SECT. GUASABARA, SECT. LA BARRA, SECT. LA GUASABARA, SECT. LA LIGA, SECT. LA MESA, SECT. LA PONDEROSA, SECT. LOS CURAS, SECT. LOS MUCHOS, SECT. REPARTO SOLANO, SECT. SUR DE LAS AMERICAS, URB. LAKE",May 04 10:38',May 04 16:00',1001-1500,Unplanned,Our power restoration team is onsite conducting critical repairs to restore power the area as quickly and safely as possible. 
HUMACAO,"CEM. CEMENTERIO VERDE MAR, COMU. JUNQUITO, EDU. ESCUELA JOSE TORO RIOS, IND. BRISTOL MYERS SQUIBB, PARC. BAJANDAS, SECT. ALTURAS DE JUNQUITO, SECT. PARCELAS EL BATEY, URB. ALTURAS DE BUSO, URB. ALTURAS DEL ESTE, URB. CIUDAD CRISTIANA, URB. EL RETIRO, URB.",May 04 08:15',May 04 18:00',<500,Scheduled Maintenance,Our power restoration team is onsite conducting critical repairs to restore power the area as quickly and safely as possible. 
MAYAGUEZ,"URB. ALTURAS DE MAYAGUEZ, URB. PASEO LOS ROBLES, SECT. MILLO COTES, SECT. QUEBRADA LARGA, COM. RESTAURANTE EL COCHE, COND. PLAYA ALMIRANTE, EDU. ESCUELA MARIANA BRACETTI, PARC. LAS MARIAS, SECT. AJIES, SECT. JUAN VEGA, SECT. LA CHOZA, SECT. LA TOSCA, URB.",May 04 07:48',May 04 17:00',>5000,Scheduled Maintenance,Our power restoration team is onsite conducting critical repairs to restore power the area as quickly and safely as possible. 
MOCA,"EDU. ESCUELA NARCISO BOSQUE SOTO, SECT. AVILES, SECT. BOSQUES, SECT. LOS FIGUEROA, SECT. BRISAS DE CAMPO ALEGRE",May 04 01:35',May 04 17:00',<500,Unplanned,Our power restoration team is onsite conducting critical repairs to restore power the area as quickly and safely as possible. 
GUAYAMA,"CMPA. CLUB DE TROTAMUNDOS, COMU. AMELIA MARIN, COMU. BRANDERI, EDU. ACADEMIA ADVENTISTA, HTL. BRANDEMAR, URB. JARDINES DE MONTE OLIVO",May 03 22:36',May 04 15:00',4501-5000,3rd Party Damage,Our local power restoration team is being dispatched to the area as soon as possible. 
GUAYNABO,"BDA. ROMERO, COND. ALAMANDA, COND. EL BOSQUE, COND. EMERALD COURT, COND. MONTE DE LOS FRAILES, COND. MONTE VERDE, COND. PARCKVILLE PLAZA, COND. PRADOS DEL MONTE, COND. QUINTA VALLE, COND. RIDGE TOP LUXURY APARTMENTS, COND. VILLAS DE GUAYNABO, COND. VILLAS",May 03 13:10',May 04 18:00',<500,Unplanned,Our power restoration team is onsite conducting critical repairs to restore power the area as quickly and safely as possible. 