Municipality,Sector,Outage Reported,Estimated Time of Restoration,Estimated Customers Impacted,Category,Current Status
BAYAMON,"EDU. ESCUELA JUAN MOREL CAMPOS, IND. REPARTO INDUSTRIAL CORREA, URB. 2DA EXTENSION VILLA RICA, URB. COLINAS DE FRESNO, URB. HERMANAS DAVILA, URB. REPARTO FLAMINGO, URB. VILLA RICA, COND. JARDINES METROPOLITANOS",August 23 14:15',August 23 23:00',<500,Unplanned,Our local power restoration team is being dispatched to the area as soon as possible. 
MAYAGUEZ,"COME. WESTERN PLAZA SHOPPING CENTER, SECT. BONET, SECT. CUBA, SECT. PITILLO, URB. ALTURAS DE MAYAGUEZ, URB. BELLAS LOMAS, URB. COLINAS DE ALTURAS DE MAYAGUEZ, URB. COLLEGE GARDENS, URB. CUMBRES DE MIRADERO, URB. EL RETIRO, URB. ESTANCIAS DE MIRADERO, URB.",August 23 13:43',August 23 23:00',2001-2500,Unplanned,Our local power restoration team is being dispatched to the area as soon as possible. 
VIEQUES,"BDA. EL FUERTE, COMU. BRAVOS DE BOSTON, COMU. SANTA MARIA, COMU. VILLA BORINQUEN, EDU. ESCUELA MARIA M. SIMMONS DE RIVERA, IGL. IGLESIA APOSTOLICA ROMANA, SECT. CANON, SECT. ISABEL SEGUNDA, SECT. LEGUILLOW, SECT. MORROPOUSE, URB. ISABEL 2",August 23 00:33',August 23 23:00',<500,Unplanned,Our power restoration team is onsite conducting critical repairs to restore power the area as quickly and safely as possible. 
RIO GRANDE,"URB. PRADERA DEL YUNQUE, URB. QUINTAS DEL VERDE, URB. VILLAS DEL RIO, URB. VILLAS DE RIO GRANDE, COMU. BARTOLO, COMU. JOSE PH HERNANDEZ, COMU. VILLA CALZADA, PARC. BELLA VISTA, PARC. MALPICA, PARC. SAMUEL DAVILA, SECT. CARA DEL INDIO, SECT. CASCO URBANO, ",August 22 00:06',August 24 08:00',<500,Unplanned,Our power restoration team is onsite conducting critical repairs to restore power the area as quickly and safely as possible.
,TRAMO > ACAIA > 4HERMANOS,August 15 22:00',August 23 23:00',<500,Unplanned,Our power restoration team is onsite conducting critical repairs to restore power the area as quickly and safely as possible.
,TRAMO > SABANA LLANA TC > CANOVANAS TC,August 13 22:55',August 23 23:00',<500,Unplanned,Our power restoration team is onsite conducting critical repairs to restore power the area as quickly and safely as possible.