Municipality,Sector,Outage Reported,Estimated Time of Restoration,Estimated Customers Impacted,Category,Current Status
,TRAMO DE PUERTA DE TIERRAS -COVADONGA GIS,March 12 10:39',April 14 18:00',<500,Unplanned,Our power restoration team is onsite conducting critical repairs to restore power the area as quickly and safely as possible.
DORADO,"CMPD. EAST COURSE DORADO, CMPR. PASEOS DE DORADO, COME. PASEO DEL PLATA SHOPPING, COND. PLANTATION VILLAGE, URB. DORADO BEACH EAST, URB. PASEO DEL MAR, URB. PASEO DEL SOL, URB. PASEO LAS OLAS, URB. PASEO LAS PALMAS, URB. PASEO LOS CORALES 1, URB. PASEO LO",April 04 15:50',April 04 21:00',<500,Unplanned,Our local power restoration team is being dispatched to the area as soon as possible. 
,      TRAMO DE DORADO TC-BREnAS,April 04 15:50',April 04 20:00',<500,Unplanned,Our local power restoration team is being dispatched to the area as soon as possible. 
AGUADILLA,"CMPG. ANTIGUA BASE RAMEY, RES. RESIDENCIAL AGUSTIN STAHL, SECT. EL COBO, SECT. EL CUCO, SECT. EL MACETAZO, SECT. LA ALAMBRA, SECT. PLAYUELA, SECT. REPARTO TRES PALMAS, SECT. VILLA BETANIA, URB. BORINQUEN, URB. VILLAS DEL HORIZONTE, URB. VILLAS DE PALMA RE",April 04 12:00',April 04 18:00',<500,Scheduled Maintenance,Our power restoration team is onsite conducting critical repairs to restore power the area as quickly and safely as possible. 
ARECIBO,"URB. BRISAS DE PALMA ROJA, URB. CORALES DEL MAR, URB. COSTA DEL ATLANTICO, URB. COSTAS DEL MAR, COMU. ISLOTE 2, COMU. JAREALITO, COMU. VIGIA, COND. ATLANTICA, COND. OCEANIA APARTMENTS, SECT. BARRIO ISLOTE, SECT. BOAN, SECT. CARACOLES, SECT. RINCON CHIQUIT",April 04 08:21',April 04 17:00',2001-2500,Scheduled Maintenance,Our power restoration team is onsite conducting critical repairs to restore power the area as quickly and safely as possible. 
VEGA BAJA,"COMU. LOS PUERTOS, SECT. MARISMILLA, SECT. VILLA PALMAS, URB. JARDIN DORADO, URB. LOS PRADOS DE DORADO NORTE, URB. LOS PRADOS DE DORADO SUR, COME. PLAZA DEL MAR SHOPPING CENTER, COMU. BREnAS, COMU. CARMELITA, COMU. CERRO GORDO, COMU. VILLA ALEGRIA, COMU. ",April 04 08:09',April 04 17:00',4001-4500,Scheduled Maintenance,Our power restoration team is onsite conducting critical repairs to restore power the area as quickly and safely as possible. 