Municipality,Sector,Outage Reported,Estimated Time of Restoration,Estimated Customers Impacted,Category,Current Status
,      TRAMO JUNCOS-HUMACAO ,September 20 09:08',September 20 17:00',<500,Unplanned,Our local power restoration team is being dispatched to the area as soon as possible. 
MANATI,"COMU. LA MONA, COMU. SAN JOSE, COMU. VILLA BLANCA, COND. MAR CHIQUITA APARTMENTS, COND. MAR CHIQUITA CONDOMINIUM, COND. MAR CHIQUITA OCEAN VIEW, COND. PARAISO DE MAR CHIQUITA, IND. INDUSTRIAL SAN JOSE, SECT. BOQUILLAS, SECT. EL ALTO, SECT. LA CALIFORNIA, ",September 20 09:01',September 20 15:00',1501-2000,Unplanned,Our power restoration team is onsite conducting critical repairs to restore power the area as quickly and safely as possible. 
YAUCO,"ARE. YAUCO URBAN PARK, BDA. ARTURO LLUBERAS, CMPD. COLISEO RAUL PIPOTE OLIVERAS, CMPG. INSTALACIONES MUNICIPALES, COMU. LOMA BONITA, COND. EGIDA ESTANCIA DORADA, EDU. ESCUELA ARTURO LLUBERAS, IND. STARTORIUS STEDIM BIOTECH, ONG. MIGRANT HEALTH CENTER WEST",September 20 08:27',September 20 17:00',501-1000,Scheduled Maintenance,Our power restoration team is onsite conducting critical repairs to restore power the area as quickly and safely as possible. 
OROCOVIS,"EDU. ESCUELA ROMAN DIAZ AVILES, SECT. DR. UMPIERRE, SECT. GREGORIO, SECT. LA FAMILIA, SECT. LA HACIENDA, SECT. LOS ALVARADO, SECT. MIRAFLORES, SECT. MONTE BELLO, SECT. PUENTE DOBLE, SECT. SALIDA A COAMO, SECT. SANAMUERTOS, CEM. CEMENTERIO MUNICIPAL DE ORO",September 20 07:49',September 20 17:00',>5000,Scheduled Maintenance,Our power restoration team is onsite conducting critical repairs to restore power the area as quickly and safely as possible. 
FAJARDO,"COND. CASTILLO DEL MAR, COND. COSTA ESMERALDA, PARC. AGUAS CLARAS, URB. BRISAS DE CEIBA, URB. COSTA BRAVA, URB. HACIENDA LAS LOMAS, URB. JARDINES DE CEIBA 1, URB. JARDINES DE CEIBA 2, URB. PASEO DE CEIBA, URB. PASEO DE LA COSTA, URB. RIVER VALLEY, URB. TH",September 20 06:50',September 20 17:00',1501-2000,Scheduled Maintenance,Our power restoration team is onsite conducting critical repairs to restore power the area as quickly and safely as possible. 
, BAYAMON TC - CATAnO -  CARCEL DE MUJERES  ,September 19 20:18',September 20 15:00',<500,Unplanned,Our power restoration team is onsite conducting critical repairs to restore power the area as quickly and safely as possible. 
,TRAMO > BARRANQUITAS > OROCOVIS,September 17 19:57',September 20 17:00',<500,Unplanned,Our power restoration team is onsite conducting critical repairs to restore power the area as quickly and safely as possible. 
,TRAMO YAHUECAS-ADJUNTAS  ,September 17 15:09',September 21 17:00',<500,Unplanned,Our power restoration team is onsite conducting critical repairs to restore power the area as quickly and safely as possible.